{
  "question" : "все его фактультеты какие",
  "answer" : "В Университете Государственном Молдовы (USM) есть следующие факультеты:\n\n1. [Факультет биологии и педологии](https://usm.md/?page_id=489)\n2. [Факультет химии и химической технологии](https://usm.md/?page_id=492)\n3. [Факультет права](https://usm.md/?page_id=495)\n4. [Факультет журналистики и научных коммуникаций](https://usm.md/?page_id=505)\n5. [Факультет физики и инженерии](https://usm.md/?page_id=498)\n6. [Факультет истории и философии](https://usm.md/?page_id=502)\n7. [Факультет математики и информатики](https://usm.md/?page_id=515)\n8. [Факультет литературы](https://usm.md/?page_id=511)\n9. [Факультет экономических наук](https://usm.md/?page_id=528)\n10. [Факультет психологии, наук об образовании, социологии и социальной работы](https://usm.md/?page_id=518)\n11. [Факультет международных отношений, политических и административных наук](https://usm.md/?page_id=522)\n\nЕсли вам нужна дополнительная информация о каком-либо из факультетов, дайте знать!",
  "contexts" : [ "[***Drept public (90 credite, studii cu frecvență redusă)***](http://admitere.usm.md/wp-content/uploads/Drept-public-_90-cr_MP_2024_cu-frecventa-redusa.pdf)***;***\n\n[***Administrare Publică (120 credite, studii cu frecvență)***](http://admitere.usm.md/wp-content/uploads/Administrare-publica_120-cr_MP_2024_cu-frecventa.pdf)***;***\n\n[***Administrare Publică (120 credite, studii cu frecvență redusă)***](http://admitere.usm.md/wp-content/uploads/Administrare_publica_120-cr_MP_2024_cu_frecventa_redusa.pdf)***;***\n\n[***Relații Internaționale (120 credite, studii cu frecvență)***](http://admitere.usm.md/wp-content/uploads/Relatii-internationale_120-cr_MP_2024_cu-frecventa.pdf)***;***\n\n[***Relații Internaționale (120 credite, studii cu frecvență redusă)***](http://admitere.usm.md/wp-content/uploads/Relatii-internationale_120-cr_MP_2024_cu-frecventa-redusa.pdf)***;***\n\n[***Management (120 credite, studii cu frecvență)***](http://admitere.usm.md/wp-content/uploads/Management_120-cr_MP_2024_cu-frecventa.pdf)***;***\n\n**[*Management (120 credite, cu frecvența redusă)*](http://admitere.usm.md/wp-content/uploads/Management_MP_120-cr_cu-frecventa-redusa.pdf)**\n\n**vor prezenta Comisiei de Admitere o confirmare de la locul de muncă.**\n\n###### Adresa\n\n###### Facultăţi\n\n* [Facultatea de Biologie si Pedologie](https://usm.md/?page_id=489)\n\n* [Facultatea de Chimie şi Tehnologie Chimică](https://usm.md/?page_id=492)\n\n* [Facultatea de Drept](https://usm.md/?page_id=495)\n\n* [Facultatea de Jurnalism şi Ştiinţe ale Comunicării](https://usm.md/?page_id=505)\n\n* [Facultatea de Fizica si Inginerie](https://usm.md/?page_id=498)\n\n* [Facultatea de Istorie şi Filosofie](https://usm.md/?page_id=502)\n\n* [Facultatea de Matematică şi Informatică](https://usm.md/?page_id=515)\n\n* [Facultatea de Litere](https://usm.md/?page_id=511)\n\n* [Facultatea de Științe Economice](https://usm.md/?page_id=528)\n\n* [Facultatea Psihologie, Ştiinţe ale Educaţiei, Sociologie și Asistență Socială](https://usm.md/?page_id=518)\n\n* [Facultatea de Relaţii Internaţionale, Ştiinţe Politice şi Administrative](https://usm.md/?page_id=522)\n\n###### Contacte\n\n* +373 22 244 810\n\n* 9:00 - 17:00\n\n* [Universitatea de Stat din Moldova str. Alexei Mateevici 60, MD-2009](https://www.google.com/maps/place/Universitatea+de+Stat+din+Moldova/@47.018939,28.824491,18z/data=!4m5!3m4!1s0x0:0xd8e8b74ac8c3ef7b!8m2!3d47.0192025!4d28.8230857?hl=ro)\n\n* rector@usm.md  \nToleranță zero corupției\n\n* integritate@usm.md\n\n* [old.usm.md](https://old.usm.md)  \n[Facebook](https://www.facebook.com/UniversitateaDeStatDinMoldova/) [Instagram](https://www.instagram.com/accounts/login/?next=/usm.md/) [Youtube](https://www.youtube.com/channel/UC3oFsXde0eZRaAqeX_6iBcg/videos)  \n**Universitatea de Stat din Moldova 2025 © All Rights Reserved\n​**  \nSecție Programare Web al USM ®  \nUniversitatea de Stat din Moldova folosește module cookie strict necesare și alte tehnologii similare pentru a opera acest website și pentru a oferi utilizatorilor o experiență personalizată. Pe lângă modulele cookie strict necesare, Universitatea de Stat din Moldova folosește module cookie opționale pentru a îmbunătăți și personaliza experiența utilizatorilor, pentru a analiza performanța website-ului.Ok [Source]{https://admitere.usm.md/?page_id=565)", "* adeverința eliberată de organul teritorial de tutelă și curatelă, pentru copiii orfani și copiii rămași fără ocrotire părintească;\n\n* certificatele medicale corespunzătoare, care atestă gradul de dizabilitate al candidatului sau al părinților acestuia;\n\n* certificatul care confirmă că unul din părinții candidatului a participat la acțiunile militare pentru apărarea integrității și independenței Republicii Moldova sau în războiul din Afganistan ori la lichidarea consecințelor avariei de la Cernobîl, eliberat de organele abilitate; adeverință care confirmă participarea candidatului la operațiunile militare post-conflict cu caracter umanitar în Irak;\n\n* certificatul despre componența familiei și copiile certificatelor de naștere ale fraților/surorilor (pentru candidații care provin din familii cu trei și mai mulți copii);\n\n* confirmarea apartenenței la familii de romi;\n\n* recomandarea organului local de specialitate în domeniul învățământului sau adeverința de la locul de muncă al părinților -- cadre didactice pentru înscrierea la concursul de admitere la specialitățile din domeniul general de studiu *Ştiinţe ale educaţiei;*\n\n* după caz certificatul medical (pentru programele care necesită capacități/rezistență fizică)\n\n###### Adresa\n\n###### Facultăţi\n\n* [Facultatea de Biologie si Pedologie](https://usm.md/?page_id=489)\n\n* [Facultatea de Chimie şi Tehnologie Chimică](https://usm.md/?page_id=492)\n\n* [Facultatea de Drept](https://usm.md/?page_id=495)\n\n* [Facultatea de Jurnalism şi Ştiinţe ale Comunicării](https://usm.md/?page_id=505)\n\n* [Facultatea de Fizica si Inginerie](https://usm.md/?page_id=498)\n\n* [Facultatea de Istorie şi Filosofie](https://usm.md/?page_id=502)\n\n* [Facultatea de Matematică şi Informatică](https://usm.md/?page_id=515)\n\n* [Facultatea de Litere](https://usm.md/?page_id=511)\n\n* [Facultatea de Științe Economice](https://usm.md/?page_id=528)\n\n* [Facultatea Psihologie, Ştiinţe ale Educaţiei, Sociologie și Asistență Socială](https://usm.md/?page_id=518)\n\n* [Facultatea de Relaţii Internaţionale, Ştiinţe Politice şi Administrative](https://usm.md/?page_id=522)\n\n###### Contacte\n\n* +373 22 244 810\n\n* 9:00 - 17:00\n\n* [Universitatea de Stat din Moldova str. Alexei Mateevici 60, MD-2009](https://www.google.com/maps/place/Universitatea+de+Stat+din+Moldova/@47.018939,28.824491,18z/data=!4m5!3m4!1s0x0:0xd8e8b74ac8c3ef7b!8m2!3d47.0192025!4d28.8230857?hl=ro)\n\n* rector@usm.md  \nToleranță zero corupției\n\n* integritate@usm.md\n\n* [old.usm.md](https://old.usm.md)  \n[Facebook](https://www.facebook.com/UniversitateaDeStatDinMoldova/) [Instagram](https://www.instagram.com/accounts/login/?next=/usm.md/) [Youtube](https://www.youtube.com/channel/UC3oFsXde0eZRaAqeX_6iBcg/videos)  \n**Universitatea de Stat din Moldova 2025 © All Rights Reserved\n​**  \nSecție Programare Web al USM ®  \nUniversitatea de Stat din Moldova folosește module cookie strict necesare și alte tehnologii similare pentru a opera acest website și pentru a oferi utilizatorilor o experiență personalizată. Pe lângă modulele cookie strict necesare, Universitatea de Stat din Moldova folosește module cookie opționale pentru a îmbunătăți și personaliza experiența utilizatorilor, pentru a analiza performanța website-ului.Ok [Source]{https://admitere.usm.md/?page_id=562)", "* *[**Facultatea de Fizica şi Inginerie**](http://admitere.usm.md/?page_id=512)*\n\n* *[**Facultatea de Istorie și Filozofie**](http://admitere.usm.md/?page_id=515)*\n\n* *[**Facultatea de Jurnalism și Științe ale Comunicării**](http://admitere.usm.md/?page_id=520)*\n\n* *[**Facultatea de Litere**](http://admitere.usm.md/?page_id=524)*\n\n* *[**Facultatea de Matematică şi Informatică**](http://admitere.usm.md/?page_id=529)*\n\n* *[**Facultatea de Psihologie, Ştiinţe ale Educaţiei, Sociologie şi Asistenţă Socială**](http://admitere.usm.md/?page_id=540)*\n\n* *[**Facultatea Relaţii Internaţionale, Ştiinţe Politice şi Administrative**](http://admitere.usm.md/?page_id=545)*\n\n* *[**Facultatea de Știinte Economice**](http://admitere.usm.md/?page_id=550)*\n\n###### Adresa\n\n###### Facultăţi\n\n* [Facultatea de Biologie și Geoștiințe](https://usm.md/?page_id=489)\n\n* [Facultatea de Chimie şi Tehnologie Chimică](https://usm.md/?page_id=492)\n\n* [Facultatea de Drept](https://usm.md/?page_id=495)\n\n* [Facultatea de Jurnalism şi Ştiinţe ale Comunicării](https://usm.md/?page_id=505)\n\n* [Facultatea de Fizica si Inginerie](https://usm.md/?page_id=498)\n\n* [Facultatea de Istorie şi Filosofie](https://usm.md/?page_id=502)\n\n* [Facultatea de Matematică şi Informatică](https://usm.md/?page_id=515)\n\n* [Facultatea de Litere](https://usm.md/?page_id=511)\n\n* [Facultatea de Științe Economice](https://usm.md/?page_id=528)\n\n* [Facultatea Psihologie, Ştiinţe ale Educaţiei, Sociologie și Asistență Socială](https://usm.md/?page_id=518)\n\n* [Facultatea de Relaţii Internaţionale, Ştiinţe Politice şi Administrative](https://usm.md/?page_id=522)\n\n###### Contacte\n\n* +373 22 244 810\n\n* 9:00 - 17:00\n\n* [Universitatea de Stat din Moldova str. Alexei Mateevici 60, MD-2009](https://www.google.com/maps/place/Universitatea+de+Stat+din+Moldova/@47.018939,28.824491,18z/data=!4m5!3m4!1s0x0:0xd8e8b74ac8c3ef7b!8m2!3d47.0192025!4d28.8230857?hl=ro)\n\n* rector@usm.md  \nToleranță zero corupției\n\n* integritate@usm.md  \n[Facebook](https://www.facebook.com/UniversitateaDeStatDinMoldova/) [Instagram](https://www.instagram.com/accounts/login/?next=/usm.md/) [Youtube](https://www.youtube.com/channel/UC3oFsXde0eZRaAqeX_6iBcg/videos)  \n**Universitatea de Stat din Moldova 2025 © All Rights Reserved\n​**  \nOficiul Programare Web al USM ®  \n×  \n×  \n×  \n×  \n×  \n×  \n×  \n×  \n×  \n×  \n×  \nUniversitatea de Stat din Moldova folosește module cookie strict necesare și alte tehnologii similare pentru a opera acest website și pentru a oferi utilizatorilor o experiență personalizată. Pe lângă modulele cookie strict necesare, Universitatea de Stat din Moldova folosește module cookie opționale pentru a îmbunătăți și personaliza experiența utilizatorilor, pentru a analiza performanța website-ului.Ok [Source]{https://usm.md/?page_id=219)", "* *[**Facultatea de Fizica şi Inginerie**](http://admitere.usm.md/?page_id=437)*\n\n* *[**Facultatea de Istorie și Filozofie**](http://admitere.usm.md/?page_id=440)*\n\n* *[**Facultatea de Jurnalism și Științe ale Comunicării**](http://admitere.usm.md/?page_id=443)*\n\n* *[**Facultatea de Litere**](http://admitere.usm.md/?page_id=446)*\n\n* *[**Facultatea de Matematică şi Informatică**](http://admitere.usm.md/?page_id=450)*\n\n* *[**Facultatea de Psihologie, Ştiinţe ale Educaţiei, Sociologie şi Asistenţă Socială**](http://admitere.usm.md/?page_id=454)*\n\n* *[**Facultatea Relaţii Internaţionale, Ştiinţe Politice şi Administrative**](http://admitere.usm.md/?page_id=458)*\n\n* *[**Facultatea de Știinte Economice**](http://admitere.usm.md/?page_id=461)*\n\n###### Adresa\n\n###### Facultăţi\n\n* [Facultatea de Biologie și Geoștiințe](https://usm.md/?page_id=489)\n\n* [Facultatea de Chimie şi Tehnologie Chimică](https://usm.md/?page_id=492)\n\n* [Facultatea de Drept](https://usm.md/?page_id=495)\n\n* [Facultatea de Jurnalism şi Ştiinţe ale Comunicării](https://usm.md/?page_id=505)\n\n* [Facultatea de Fizica si Inginerie](https://usm.md/?page_id=498)\n\n* [Facultatea de Istorie şi Filosofie](https://usm.md/?page_id=502)\n\n* [Facultatea de Matematică şi Informatică](https://usm.md/?page_id=515)\n\n* [Facultatea de Litere](https://usm.md/?page_id=511)\n\n* [Facultatea de Științe Economice](https://usm.md/?page_id=528)\n\n* [Facultatea Psihologie, Ştiinţe ale Educaţiei, Sociologie și Asistență Socială](https://usm.md/?page_id=518)\n\n* [Facultatea de Relaţii Internaţionale, Ştiinţe Politice şi Administrative](https://usm.md/?page_id=522)\n\n###### Contacte\n\n* +373 22 244 810\n\n* 9:00 - 17:00\n\n* [Universitatea de Stat din Moldova str. Alexei Mateevici 60, MD-2009](https://www.google.com/maps/place/Universitatea+de+Stat+din+Moldova/@47.018939,28.824491,18z/data=!4m5!3m4!1s0x0:0xd8e8b74ac8c3ef7b!8m2!3d47.0192025!4d28.8230857?hl=ro)\n\n* rector@usm.md  \nToleranță zero corupției\n\n* integritate@usm.md  \n[Facebook](https://www.facebook.com/UniversitateaDeStatDinMoldova/) [Instagram](https://www.instagram.com/accounts/login/?next=/usm.md/) [Youtube](https://www.youtube.com/channel/UC3oFsXde0eZRaAqeX_6iBcg/videos)  \n**Universitatea de Stat din Moldova 2025 © All Rights Reserved\n​**  \nOficiul Programare Web al USM ®  \n×  \n×  \n×  \n×  \n×  \n×  \n×  \n×  \n×  \n×  \n×  \nUniversitatea de Stat din Moldova folosește module cookie strict necesare și alte tehnologii similare pentru a opera acest website și pentru a oferi utilizatorilor o experiență personalizată. Pe lângă modulele cookie strict necesare, Universitatea de Stat din Moldova folosește module cookie opționale pentru a îmbunătăți și personaliza experiența utilizatorilor, pentru a analiza performanța website-ului.Ok [Source]{https://usm.md/?page_id=216)" ]
}