{
  "question" : "Salut",
  "answer" : "Salut! Cum te pot ajuta astăzi? Dacă ai întrebări despre Universitatea de Stat din Moldova, burse, admitere sau orice altceva, nu ezita să întrebi!",
  "contexts" : [ "BURSE DE PERFORMANȚĂ -- Universitatea de Stat din Moldova Skip to content\n\n* Oferta 2024\n  * [Licență](https://admitere.usm.md/?page_id=98)\n  * [Master](https://admitere.usm.md/?page_id=94)\n  * [Întrebări frecvente](https://admitere.usm.md/?page_id=1925)\n  * [Programe de Motivare](https://admitere.usm.md/?page_id=2395)\n  * [Broșuri](https://admitere.usm.md/?page_id=41)\n  * [Taxe](https://admitere.usm.md/?page_id=4209)\n\n* [Microsoft 365](https://microsoft365.usm.md/)\n\n* [Centrul de Ghidare în Carieră](https://cgc.usm.md)\n\n* Cercetare\n  * [Departamentul Cercetare și Inovare](https://cercetare.usm.md/)\n  * [Institute de Cercetare](https://usm.md/?page_id=19861)\n\n* [International](https://international.usm.md/)  \n[](https://www.facebook.com/UniversitateaDeStatDinMoldova/) [](https://www.instagram.com/usm.md/) [](https://www.youtube.com/channel/UC3oFsXde0eZRaAqeX_6iBcg/videos)  \n[![Universitatea de Stat din Moldova](https://usm.md/wp-content/uploads/cropped-logo_dark_22.png)](https://usm.md/)  \nCaută după:\n\n* USM\n  * [Despre](https://usm.md/?page_id=18)\n  * Conducerea Universității\n    * [Rectorat](https://usm.md/?page_id=194)\n    * [Senatul Universitar](https://usm.md/?page_id=188)\n    * [Consiliul de Administrație](https://usm.md/?page_id=197)\n    * Comisiile Senatului\n      * [Comisia de etică universitară](https://usm.md/?page_id=549)\n      * [Comisia activitate didactică, învăţămînt şi evaluare academică](https://usm.md/?page_id=552)\n      * [Comisia management universitar şi dezvoltare instituţională](https://usm.md/?page_id=555)\n      * [Comisia informatizare](https://usm.md/?page_id=3129)\n      * [Comisia relaţii internaţionale](https://usm.md/?page_id=3128)\n      * [Comisia comunicare și promovarea imaginii](https://usm.md/?page_id=558)\n      * [Comisia pentru cercetare](https://usm.md/?page_id=561)\n      * [Comisia pentru probleme studenţeşti](https://usm.md/?page_id=564)\n      * [Comisia pentru activităţi culturale şi sportive](https://usm.md/?page_id=567)\n    * [Consiliul pentru Dezvoltarea Strategică Instituțională](https://usm.md/?page_id=191)\n    * [Consiliul Științific](https://usm.md/?page_id=626)\n  * Organizare\n    * Departamentul Managementul Calității\n      * [Structura](https://usm.md/?page_id=12865)\n      * [Acte normative](https://usm.md/?page_id=12868)\n      * Planuri de activitate, rapoarte\n        * [Planuri de activitate](https://usm.md/?page_id=12870)\n        * [Rapoarte de activitate](https://usm.md/?page_id=12877)\n      * Audit intern\n        * [Proceduri de audit](https://usm.md/?page_id=12880)\n        * [Planuri de audit](https://usm.md/?page_id=12884)\n        * [Membrii comisiilor de audit](https://usm.md/?page_id=12886)\n      * Evaluare externă\n        * [Planuri de măsuri corective](https://usm.md/?page_id=12894)\n        * Acte normative\n          * [Curente](https://usm.md/?page_id=12891)\n          * [Arhiva](https://usm.md/?page_id=16434)\n        * Acreditare Instituțională\n          * [Raportul de autoevaluare](https://usm.md/?page_id=19384)\n          * [Anexe](https://usm.md/?page_id=18560)\n            * [Anexa 1](https://usm.md/?page_id=18563)\n            * [Anexa 2.1](https://usm.md/?page_id=18566)\n            * [Anexa 2.2](https://usm.md/?page_id=18619)\n            * [Anexa 2.3](https://usm.md/?page_id=18620)\n            * [Anexa 2.4](https://usm.md/?page_id=19128)\n            * [Anexa 2.5](https://usm.md/?page_id=18643)\n            * [Anexa 3.1](https://usm.md/?page_id=18657)\n            * [Anexa 3.2](https://usm.md/?page_id=18699)\n            * [Anexa 3.3](https://usm.md/?page_id=18825)\n            * [Anexa 3.4](https://usm.md/?page_id=19037)\n            * [Anexa 3.5](https://usm.md/?page_id=19185)\n            * [Anexa 3.6](https://usm.md/?page_id=19248)\n            * [Anexa 3.7](https://usm.md/?page_id=19259)\n            * [Anexa 4](https://usm.md/?page_id=19270)\n            * [Anexe FV](https://usm.md/?page_id=19367)\n    * [Departamentul IT](https://usm.md/?page_id=25666)\n    * [Departamentul Cercetare și Inovare](https://cercetare.usm.md/)\n    * [Biblioteca USM](https://library.usm.md/)\n    * [Departamentul Relații Internaționale](https://usm.md/?page_id=257)\n    * [Centru de Resurse pentru Formare Continuă](https://usm.md/?page_id=228)\n    * [Secția Comunicare și Relații Publice](https://usm.md/?page_id=362)\n    * [Centrul de Ghidare în Carieră și Relații cu Piața Muncii](https://usm.md/?page_id=268)\n    * [Departamentul Resurse Umane](https://usm.md/?page_id=271)\n    * [Oficiul Achiziții Publice](https://usm.md/?page_id=385)\n    * [Departamentul Contabilitate](https://usm.md/?page_id=274)\n    * [Departamentul economico-financiar](https://usm.md/?page_id=752)\n    * [Organigrama](https://usm.md/wp-content/uploads/Organigrama_Noiembrie_Decembrie_Senat_28_11_2023.pdf)\n  * Resurse\n    * Resurse digitale\n      * [Revista de Istorie a Moldovei](https://usm.md/?page_id=15485)\n      * [VOX USM](https://usm.md/?page_id=1996)\n    * [Documente](https://usm.md/?page_id=203)\n      * [Acte normative nationale](https://usm.md/?page_id=206)\n      * [Acte normative USM](https://usm.md/?page_id=209)\n        * [Documente reglementare activitate instituţională](https://usm.md/?page_id=451)\n        * [Regulamente resurse umane](https://usm.md/?page_id=453)\n        * [Regulamente proces educational](https://usm.md/?page_id=455)\n        * [Regulamente managementul calității](https://usm.md/?page_id=457)\n        * [Regulamente activitate ştiinţifică](https://usm.md/?page_id=459)\n        * [Regulamente Relaţii Internaţionale](https://usm.md/?page_id=461)\n        * [Regulamente sistem informaţional](https://usm.md/?page_id=463)\n        * Planuri și rapoarte de activitate\n          * [Rapoarte de activitate](https://usm.md/?page_id=3237)\n          * [Situațiile financiare](https://usm.md/?page_id=1220)\n          * [Planuri achizitiilor publice](https://usm.md/?page_id=2203)\n          * [Raport privind realizarea contractelor încheiate în urma procedurilor de achiziție](https://usm.md/?page_id=1224)\n          * [Graficul şedinţelor departamentelor USM](https://usm.md/wp-content/uploads/Graficul_Sedintelor_Departamentelor-1.pdf)\n          * [Planuri și Rapoarte De Activitate](https://usm.md/?page_id=10032)\n        * [Arhiva](https://usm.md/?page_id=18165)\n    * [Moodle.USM](http://moodle.usm.md/)\n    * [Galeria](https://usm.md/?page_id=9106)\n    * [Materiale Grafice USM](https://usm.md/?page_id=20143)\n  * Proiecte\n    * Banca Mondială\n      * [Subproiecte](https://usm.md/?page_id=16155)\n      * [Transparență](https://usm.md/?page_id=26463)\n    * Erasmus+\n      * [DEFEP](https://defep.usm.md/)\n      * [EUDIPSEC](https://eudipsec.usm.md/)\n      * [QFORTE](https://usm.md/?page_id=29341)\n\n* [Facultăți](https://usm.md/)\n  * [Facultatea de Biologie și Geoștiințe](https://usm.md/?page_id=489)\n  * [Facultatea de Drept](https://usm.md/?page_id=495)\n  * [Facultatea de Chimie şi Tehnologie Chimică](https://usm.md/?page_id=492)\n  * [Facultatea de Fizica si Inginerie](https://usm.md/?page_id=498)\n  * [Facultatea de Istorie şi Filosofie](https://usm.md/?page_id=502)\n  * [Facultatea de Jurnalism şi Ştiinţe ale Comunicării](https://usm.md/?page_id=505)\n  * [Facultatea de Litere](https://usm.md/?page_id=511)\n  * [Facultatea de Matematică şi Informatică](https://usm.md/?page_id=515)\n  * [Facultatea Psihologie, Ştiinţe ale Educaţiei, Sociologie și Asistență Socială](https://usm.md/?page_id=518)\n  * [Facultatea de Relaţii Internaţionale, Ştiinţe Politice şi Administrative](https://usm.md/?page_id=522)\n  * [Facultatea de Ştiinţe Economice](https://usm.md/?page_id=528)\n  * [Institutul de Educație Fizică și Sport](https://usm.md/?page_id=31334)\n\n* [Studii](https://usm.md/?page_id=20)\n  * [Departamentul Studii](https://usm.md/?page_id=241)\n  * Calendar academic\n    * [Licență](https://usm.md/?page_id=731)\n    * [Master](https://usm.md/?page_id=734)\n    * [Doctorat](https://usm.md/?page_id=737)\n  * [Studii de Licență](https://usm.md/?page_id=216)\n  * [Studii de Masterat](https://usm.md/?page_id=219)\n  * [Studii de Doctorat](https://doctorat.usm.md/)\n  * [Catedra Militară](https://usm.md/?page_id=680)\n  * Burse\n    * [Burse finanțate din bugetul de stat](https://usm.md/?page_id=392)\n    * [Burse de performanță](https://usm.md/?page_id=396)\n  * [Recunoaștere și echivalare](https://usm.md/?page_id=26183)\n\n* [Formare Continuă](http://crfc.usm.md/)\n\n* [Studenti](https://usm.md/?page_id=34)\n  * Descoperă@USM\n    * [Concurs „Hai să #Celebrăm75USM!\"](https://usm.md/?page_id=3181)\n    * [Istoria USM](https://usm.md/wp-content/uploads/ISTORIA_USM.pdf)\n    * [Broșura USM (Ro)](https://usm.md/wp-content/uploads/Broshura_USM_2020_ro.pdf)\n    * [Broșura USM (En)](https://usm.md/wp-content/uploads/Broshura_USM_2020_en.pdf)\n    * [Oferta USM 2023](https://usm.md/wp-content/uploads/pliant_oferta-educațională-2021.pdf)\n    * [Ghid pentru studenții anului I și II](https://usm.md/wp-content/uploads/ghid-studenti-anul-I-SI-II-USM-web.pdf)\n    * [Program de motivare a candidaților](https://usm.md/?page_id=1112)\n  * [Campus](https://usm.md/?page_id=22279)\n  * [Asociații studențești](http://asusm.usm.md/)\n  * Actvitati extracurriculare\n    * [Arte Frumoase](https://usm.md/?page_id=668)\n    * [Sport](https://usm.md/?page_id=667)\n  * [Cariera](https://usm.md/?page_id=268)\n\n* [Contacte](https://usm.md/?page_id=1380)\n\n* Ro: ![Română](https://usm.md/wp-content/plugins/qtranslate-x/flags/ro.png)\n  * [![Română](https://usm.md/wp-content/plugins/qtranslate-x/flags/ro.png) Română](https://usm.md/?page_id=396&lang=ro \"Română\")\n  * [:uk: English](https://usm.md/?page_id=396&lang=en \"English\")\n  * [:ru: Русский](https://usm.md/?page_id=396&lang=ru \"Русский\")\n\n[![Universitatea de Stat din Moldova](https://usm.md/wp-content/uploads/cropped-logo_dark_22.png)](https://usm.md/)\n\n* USM\n  * [Despre](https://usm.md/?page_id=18)\n  * Conducerea Universității\n    * [Rectorat](https://usm.md/?page_id=194)\n    * [Senatul Universitar](https://usm.md/?page_id=188)\n    * [Consiliul de Administrație](https://usm.md/?page_id=197)\n    * Comisiile Senatului\n      * [Comisia de etică universitară](https://usm.md/?page_id=549)\n      * [Comisia activitate didactică, învăţămînt şi evaluare academică](https://usm.md/?page_id=552)\n      * [Comisia management universitar şi dezvoltare instituţională](https://usm.md/?page_id=555)\n      * [Comisia informatizare](https://usm.md/?page_id=3129)\n      * [Comisia relaţii internaţionale](https://usm.md/?page_id=3128)\n      * [Comisia comunicare și promovarea imaginii](https://usm.md/?page_id=558)\n      * [Comisia pentru cercetare](https://usm.md/?page_id=561)\n      * [Comisia pentru probleme studenţeşti](https://usm.md/?page_id=564)\n      * [Comisia pentru activităţi culturale şi sportive](https://usm.md/?page_id=567)\n    * [Consiliul pentru Dezvoltarea Strategică Instituțională](https://usm.md/?page_id=191)\n    * [Consiliul Științific](https://usm.md/?page_id=626)\n  * Organizare\n    * Departamentul Managementul Calității\n      * [Structura](https://usm.md/?page_id=12865)\n      * [Acte normative](https://usm.md/?page_id=12868)\n      * Planuri de activitate, rapoarte\n        * [Planuri de activitate](https://usm.md/?page_id=12870)\n        * [Rapoarte de activitate](https://usm.md/?page_id=12877)\n      * Audit intern\n        * [Proceduri de audit](https://usm.md/?page_id=12880)\n        * [Planuri de audit](https://usm.md/?page_id=12884)\n        * [Membrii comisiilor de audit](https://usm.md/?page_id=12886)\n      * Evaluare externă\n        * [Planuri de măsuri corective](https://usm.md/?page_id=12894)\n        * Acte normative\n          * [Curente](https://usm.md/?page_id=12891)\n          * [Arhiva](https://usm.md/?page_id=16434)\n        * Acreditare Instituțională\n          * [Raportul de autoevaluare](https://usm.md/?page_id=19384)\n          * [Anexe](https://usm.md/?page_id=18560)\n            * [Anexa 1](https://usm.md/?page_id=18563)\n            * [Anexa 2.1](https://usm.md/?page_id=18566)\n            * [Anexa 2.2](https://usm.md/?page_id=18619)\n            * [Anexa 2.3](https://usm.md/?page_id=18620)\n            * [Anexa 2.4](https://usm.md/?page_id=19128)\n            * [Anexa 2.5](https://usm.md/?page_id=18643)\n            * [Anexa 3.1](https://usm.md/?page_id=18657)\n            * [Anexa 3.2](https://usm.md/?page_id=18699)\n            * [Anexa 3.3](https://usm.md/?page_id=18825)\n            * [Anexa 3.4](https://usm.md/?page_id=19037)\n            * [Anexa 3.5](https://usm.md/?page_id=19185)\n            * [Anexa 3.6](https://usm.md/?page_id=19248)\n            * [Anexa 3.7](https://usm.md/?page_id=19259)\n            * [Anexa 4](https://usm.md/?page_id=19270)\n            * [Anexe FV](https://usm.md/?page_id=19367)\n    * [Departamentul IT](https://usm.md/?page_id=25666)\n    * [Departamentul Cercetare și Inovare](https://cercetare.usm.md/)\n    * [Biblioteca USM](https://library.usm.md/)\n    * [Departamentul Relații Internaționale](https://usm.md/?page_id=257)\n    * [Centru de Resurse pentru Formare Continuă](https://usm.md/?page_id=228)\n    * [Secția Comunicare și Relații Publice](https://usm.md/?page_id=362)\n    * [Centrul de Ghidare în Carieră și Relații cu Piața Muncii](https://usm.md/?page_id=268)\n    * [Departamentul Resurse Umane](https://usm.md/?page_id=271)\n    * [Oficiul Achiziții Publice](https://usm.md/?page_id=385)\n    * [Departamentul Contabilitate](https://usm.md/?page_id=274)\n    * [Departamentul economico-financiar](https://usm.md/?page_id=752)\n    * [Organigrama](https://usm.md/wp-content/uploads/Organigrama_Noiembrie_Decembrie_Senat_28_11_2023.pdf)\n  * Resurse\n    * Resurse digitale\n      * [Revista de Istorie a Moldovei](https://usm.md/?page_id=15485)\n      * [VOX USM](https://usm.md/?page_id=1996)\n    * [Documente](https://usm.md/?page_id=203)\n      * [Acte normative nationale](https://usm.md/?page_id=206)\n      * [Acte normative USM](https://usm.md/?page_id=209)\n        * [Documente reglementare activitate instituţională](https://usm.md/?page_id=451)\n        * [Regulamente resurse umane](https://usm.md/?page_id=453)\n        * [Regulamente proces educational](https://usm.md/?page_id=455)\n        * [Regulamente managementul calității](https://usm.md/?page_id=457)\n        * [Regulamente activitate ştiinţifică](https://usm.md/?page_id=459)\n        * [Regulamente Relaţii Internaţionale](https://usm.md/?page_id=461)\n        * [Regulamente sistem informaţional](https://usm.md/?page_id=463)\n        * Planuri și rapoarte de activitate\n          * [Rapoarte de activitate](https://usm.md/?page_id=3237)\n          * [Situațiile financiare](https://usm.md/?page_id=1220)\n          * [Planuri achizitiilor publice](https://usm.md/?page_id=2203)\n          * [Raport privind realizarea contractelor încheiate în urma procedurilor de achiziție](https://usm.md/?page_id=1224)\n          * [Graficul şedinţelor departamentelor USM](https://usm.md/wp-content/uploads/Graficul_Sedintelor_Departamentelor-1.pdf)\n          * [Planuri și Rapoarte De Activitate](https://usm.md/?page_id=10032)\n        * [Arhiva](https://usm.md/?page_id=18165)\n    * [Moodle.USM](http://moodle.usm.md/)\n    * [Galeria](https://usm.md/?page_id=9106)\n    * [Materiale Grafice USM](https://usm.md/?page_id=20143)\n  * Proiecte\n    * Banca Mondială\n      * [Subproiecte](https://usm.md/?page_id=16155)\n      * [Transparență](https://usm.md/?page_id=26463)\n    * Erasmus+\n      * [DEFEP](https://defep.usm.md/)\n      * [EUDIPSEC](https://eudipsec.usm.md/)\n      * [QFORTE](https://usm.md/?page_id=29341)\n\n* [Facultăți](https://usm.md/)\n  * [Facultatea de Biologie și Geoștiințe](https://usm.md/?page_id=489)\n  * [Facultatea de Drept](https://usm.md/?page_id=495)\n  * [Facultatea de Chimie şi Tehnologie Chimică](https://usm.md/?page_id=492)\n  * [Facultatea de Fizica si Inginerie](https://usm.md/?page_id=498)\n  * [Facultatea de Istorie şi Filosofie](https://usm.md/?page_id=502)\n  * [Facultatea de Jurnalism şi Ştiinţe ale Comunicării](https://usm.md/?page_id=505)\n  * [Facultatea de Litere](https://usm.md/?page_id=511)\n  * [Facultatea de Matematică şi Informatică](https://usm.md/?page_id=515)\n  * [Facultatea Psihologie, Ştiinţe ale Educaţiei, Sociologie și Asistență Socială](https://usm.md/?page_id=518)\n  * [Facultatea de Relaţii Internaţionale, Ştiinţe Politice şi Administrative](https://usm.md/?page_id=522)\n  * [Facultatea de Ştiinţe Economice](https://usm.md/?page_id=528)\n  * [Institutul de Educație Fizică și Sport](https://usm.md/?page_id=31334)\n\n* [Studii](https://usm.md/?page_id=20)\n  * [Departamentul Studii](https://usm.md/?page_id=241)\n  * Calendar academic\n    * [Licență](https://usm.md/?page_id=731)\n    * [Master](https://usm.md/?page_id=734)\n    * [Doctorat](https://usm.md/?page_id=737)\n  * [Studii de Licență](https://usm.md/?page_id=216)\n  * [Studii de Masterat](https://usm.md/?page_id=219)\n  * [Studii de Doctorat](https://doctorat.usm.md/)\n  * [Catedra Militară](https://usm.md/?page_id=680)\n  * Burse\n    * [Burse finanțate din bugetul de stat](https://usm.md/?page_id=392)\n    * [Burse de performanță](https://usm.md/?page_id=396)\n  * [Recunoaștere și echivalare](https://usm.md/?page_id=26183)\n\n* [Formare Continuă](http://crfc.usm.md/)\n\n* [Studenti](https://usm.md/?page_id=34)\n  * Descoperă@USM\n    * [Concurs „Hai să #Celebrăm75USM!\"](https://usm.md/?page_id=3181)\n    * [Istoria USM](https://usm.md/wp-content/uploads/ISTORIA_USM.pdf)\n    * [Broșura USM (Ro)](https://usm.md/wp-content/uploads/Broshura_USM_2020_ro.pdf)\n    * [Broșura USM (En)](https://usm.md/wp-content/uploads/Broshura_USM_2020_en.pdf)\n    * [Oferta USM 2023](https://usm.md/wp-content/uploads/pliant_oferta-educațională-2021.pdf)\n    * [Ghid pentru studenții anului I și II](https://usm.md/wp-content/uploads/ghid-studenti-anul-I-SI-II-USM-web.pdf)\n    * [Program de motivare a candidaților](https://usm.md/?page_id=1112)\n  * [Campus](https://usm.md/?page_id=22279)\n  * [Asociații studențești](http://asusm.usm.md/)\n  * Actvitati extracurriculare\n    * [Arte Frumoase](https://usm.md/?page_id=668)\n    * [Sport](https://usm.md/?page_id=667)\n  * [Cariera](https://usm.md/?page_id=268)\n\n* [Contacte](https://usm.md/?page_id=1380)\n\n* Ro: ![Română](https://usm.md/wp-content/plugins/qtranslate-x/flags/ro.png)\n  * [![Română](https://usm.md/wp-content/plugins/qtranslate-x/flags/ro.png) Română](https://usm.md/?page_id=396&lang=ro \"Română\")\n  * [:uk: English](https://usm.md/?page_id=396&lang=en \"English\")\n\n* [:ru: Русский](https://usm.md/?page_id=396&lang=ru \"Русский\")\n\nBURSE DE PERFORMANȚĂ\n====================\n\nPerformanța ta începe aici!  \n**PROGRAMUL \"BURSE DE MERIT\"**\n\nPentru cei mai buni studenți ai țării, Centrul de Informații Universitare (CIU), în colaborare cu Moldova Agroindbank S.A. și Compania Orange Moldova anunță anual concursul „BURSE DE MERIT″**.** Programul oferă, în bază de concurs, 50 de burse a câte **12000 de lei**pentru studenții de la ultimul an de studii, ciclul I licență, și de la primul an de studii, ciclul II master, care au obținut anul precedent de studii o medie a notelor la sesiunea ordinară nu mai mică de 9 în domeniul științelor exacte, tehnice și medico-biologice și nu mai mică de 9,5 în domeniul științelor social-umaniste. De asemenea, studenții trebuie să participe activ la cercetări științifice, conferințe, concursuri etc.\n\nInformații suplimentare privind programul \"Burse de merit\" pot fi obținute, accesând pagina [www.eac.md](http://www.eac.md)\n\n![](https://usm.md/wp-content/uploads/Bur_2-1024x681.jpg)\n\n**BURSE PENTRU VIITORUL TĂU**\n\nConcursul anual organizat de Centrul de Informații Universitare (CIU) este susținut financiar de Moldova Agroindbank S.A. Sunt oferite 30 de burse, în valoare de **10 000 de lei,** pentru studenții înmatriculați în anul I de studii, la instituțiile de învățământ superior din țară și pentru studenții bursieri ai ediției precedente, promovați în anul II sau III de studii, care pot candida pentru reînnoirea burselor. În cadrul proiectului se asigură suportul financiar pentru tinerii care demonstrează reușite la învățătură și implicare în activități extracurriculare pe o durată maximă de trei ani.\n\nConcursul, de obicei, se anunță iarna, iar rezultatele sunt prezentate primăvara. Pentru mai multe detalii, urmăriți pagina [www.eac.md](http://www.eac.md/ro/).\n\n![](https://usm.md/wp-content/uploads/Bur_3-1024x577.jpg)\n\n**BURSA DE STUDIU \"SUR-PLACE \"**\n\nFundația Konrad Adenauer acordă burse de studiu studenților talentați, implicați în activități din comunitate și viața politică. Proiectul este adresat studenţilor înscrişi la universităţile din Republica Moldova, în ciclul de licenţă, care au obținut rezultate academice deosebite şi pot face dovada implicării lor în societate şi în politică. Candidaţii trebuie să stăpânească cel puțin o limbă străină, cunoştinţele de limbă germană reprezintă un avantaj.\n\nBursa se acordă iniţial pentru o perioadă de 12 luni, putând fi prelungită în funcţie de rezultate.\n\nInformații privind acest program de burse pot fi găsite, accesând [www.kas.de/home](https://www.kas.de/home) sau această pagină [www.facebook.com/Fundatia-Konrad-Adenauer-Republica-Moldova](https://www.facebook.com/Fundatia-Konrad-Adenauer-Republica-Moldova-217191231772846/)\n\n![](https://usm.md/wp-content/uploads/Bur_4.jpg) [Source]{https://usm.md/?page_id=396)", "Acte necesare la admitere ciclul II -- Admitere 2024 Skip to content  \n[![](https://admitere.usm.md/wp-content/uploads/cropped-cropped-logo_dark_22-2-1.png)](https://admitere.usm.md/)[![Admitere 2024](https://admitere.usm.md/wp-content/uploads/cropped-cropped-logo_dark_22-2.png)](https://admitere.usm.md/)\n\n* [Oferta 2024](http://admitere.usm.md/)\n  * [Licenta](https://admitere.usm.md/?page_id=98)\n  * [Master](https://admitere.usm.md/?page_id=94)\n  * [Întrebări frecvente](https://admitere.usm.md/?page_id=1925)\n  * [Programe de motivare](https://admitere.usm.md/?page_id=2395)\n  * [Broșuri](https://admitere.usm.md/?page_id=41)\n  * [Taxe](https://admitere.usm.md/?page_id=4209)\n\n* [Calendarul admiterii](https://admitere.usm.md/?page_id=3906)\n\n* [Acte](http://admitere.usm.md/)\n  * [Regulamente](https://admitere.usm.md/?page_id=50)\n  * [Acte necesare admitere](http://admitere.usm.md/)\n    * [Acte necesare la admitere ciclul I](https://admitere.usm.md/?page_id=562)\n    * [Acte necesare la admitere ciclul II](https://admitere.usm.md/?page_id=565)\n  * Plan de admitere\n    * [Plan admitere Licenţă cu frecvență](http://admitere.usm.md/wp-content/uploads/Plan-inmatriculare_Licenta-2.pdf)\n    * [Plan admitere Licenţă cu frecvență redusă](http://admitere.usm.md/wp-content/uploads/Plan-inmatriculare_Licenta_frec.-redusa-1.pdf)\n    * [Plan admitere Master cu frecvență](http://admitere.usm.md/wp-content/uploads/Plan-inmatriculare_Master-2.pdf)\n    * [Plan admitere Master cu frecvență redusă](http://admitere.usm.md/wp-content/uploads/Plan-inmatriculare_master.frec_.redusa.pdf)\n    * [Plan admitere pentru studenți străini](http://admitere.usm.md/wp-content/uploads/plan-inmatr.-cetateni-straini-1.pdf)\n  * [Tuition fees](https://admitere.usm.md/?page_id=1476)\n  * [Taxe de studii](http://admitere.usm.md/)\n    * [Taxele de studii, Ciclul I studii superioare de licenţă](https://admitere.usm.md/?page_id=3740)\n    * [Taxele de studii, Ciclul II studii superioare de masterat](https://admitere.usm.md/?page_id=3741)\n\n* [Comisia de admitere](https://admitere.usm.md/?page_id=1445)\n\n* [Rezultate](https://admitere.usm.md/?page_id=56)\n  * [Turul I: Anunţarea rezultatelor finale](https://admitere.usm.md/?page_id=2682)\n  * [Turul II: Anunţarea rezultatelor finale](https://admitere.usm.md/?page_id=2778)\n\n* [Centrul de Ghidare în Carieră](https://cgc.usm.md/)\n\n* Ro: ![Română](https://admitere.usm.md/wp-content/plugins/qtranslate-x/flags/ro.png)\n  * [![Română](https://admitere.usm.md/wp-content/plugins/qtranslate-x/flags/ro.png) Română](https://admitere.usm.md/?page_id=565&lang=ro \"Română\")\n  * [:uk: English](https://admitere.usm.md/?page_id=565&lang=en \"English\")\n  * [:ru: Русский](https://admitere.usm.md/?page_id=565&lang=ru \"Русский\")\n\n[![](https://admitere.usm.md/wp-content/uploads/cropped-cropped-logo_dark_22-2-1.png)](https://admitere.usm.md/)[![Admitere 2024](https://admitere.usm.md/wp-content/uploads/cropped-cropped-logo_dark_22-2.png)](https://admitere.usm.md/)\n\n* [Oferta 2024](http://admitere.usm.md/)\n  * [Licenta](https://admitere.usm.md/?page_id=98)\n  * [Master](https://admitere.usm.md/?page_id=94)\n  * [Întrebări frecvente](https://admitere.usm.md/?page_id=1925)\n  * [Programe de motivare](https://admitere.usm.md/?page_id=2395)\n  * [Broșuri](https://admitere.usm.md/?page_id=41)\n  * [Taxe](https://admitere.usm.md/?page_id=4209)\n\n* [Calendarul admiterii](https://admitere.usm.md/?page_id=3906)\n\n* [Acte](http://admitere.usm.md/)\n  * [Regulamente](https://admitere.usm.md/?page_id=50)\n  * [Acte necesare admitere](http://admitere.usm.md/)\n    * [Acte necesare la admitere ciclul I](https://admitere.usm.md/?page_id=562)\n    * [Acte necesare la admitere ciclul II](https://admitere.usm.md/?page_id=565)\n  * Plan de admitere\n    * [Plan admitere Licenţă cu frecvență](http://admitere.usm.md/wp-content/uploads/Plan-inmatriculare_Licenta-2.pdf)\n    * [Plan admitere Licenţă cu frecvență redusă](http://admitere.usm.md/wp-content/uploads/Plan-inmatriculare_Licenta_frec.-redusa-1.pdf)\n    * [Plan admitere Master cu frecvență](http://admitere.usm.md/wp-content/uploads/Plan-inmatriculare_Master-2.pdf)\n    * [Plan admitere Master cu frecvență redusă](http://admitere.usm.md/wp-content/uploads/Plan-inmatriculare_master.frec_.redusa.pdf)\n    * [Plan admitere pentru studenți străini](http://admitere.usm.md/wp-content/uploads/plan-inmatr.-cetateni-straini-1.pdf)\n  * [Tuition fees](https://admitere.usm.md/?page_id=1476)\n  * [Taxe de studii](http://admitere.usm.md/)\n    * [Taxele de studii, Ciclul I studii superioare de licenţă](https://admitere.usm.md/?page_id=3740)\n    * [Taxele de studii, Ciclul II studii superioare de masterat](https://admitere.usm.md/?page_id=3741)\n\n* [Comisia de admitere](https://admitere.usm.md/?page_id=1445)\n\n* [Rezultate](https://admitere.usm.md/?page_id=56)\n  * [Turul I: Anunţarea rezultatelor finale](https://admitere.usm.md/?page_id=2682)\n  * [Turul II: Anunţarea rezultatelor finale](https://admitere.usm.md/?page_id=2778)\n\n* [Centrul de Ghidare în Carieră](https://cgc.usm.md/)\n\n* Ro: ![Română](https://admitere.usm.md/wp-content/plugins/qtranslate-x/flags/ro.png)\n  * [![Română](https://admitere.usm.md/wp-content/plugins/qtranslate-x/flags/ro.png) Română](https://admitere.usm.md/?page_id=565&lang=ro \"Română\")\n  * [:uk: English](https://admitere.usm.md/?page_id=565&lang=en \"English\")\n\n* [:ru: Русский](https://admitere.usm.md/?page_id=565&lang=ru \"Русский\")\n\nActe necesare la admitere ciclul II\n===================================\n\n<br />\n\n***Documente obligatorii:***\n\n* cererea de înscriere la concursul de admitere;\n\n* actul de studii, în original, cu anexa respectivă (absolvenți liceelor din România și alte state, promoția din anul admiterii, prezintă certificatul de studii, cu notele obținute la examenele de bacalaureat şi situația școlară pe anii de studii, urmând ca diploma de bacalaureat să fie prezentată ulterior); act de studii-xerox\n\n* 4 fotografii 3×4 cm;\n\n* copia buletinului de identitate;\n\n* Adeverință de recrut\n\nNOTĂ: **Candidații care aspiră la programele de master destinate funcționarilor publici:**\n\n**[*Anticorupție (90 credite, studii cu frecvență)*](http://admitere.usm.md/wp-content/uploads/Anticoruptie_90-cr_MP_2024_cu-frecventa.pdf)** ***;***\n\n[***Anticorupție (90 credite, studii cu frecvență redusă)***](http://admitere.usm.md/wp-content/uploads/Anticoruptie_90-cr_MP_2024_cu-frecventa-redusa.pdf)***;***\n\n[***Drept public (90 credite, studii cu frecvență)***](http://admitere.usm.md/wp-content/uploads/Drept-public_90-cr_MP_2024_cu-frecventa.pdf)***;*** [Source]{https://admitere.usm.md/?page_id=565)", "Da, după încheierea contractului de studii poți plăti taxa de studii prin transfer la orice sucursală a băncii Victoriabank. Rechizitele bancare ale USM sunt stipulate în contractul de studii.\n\n**Cum procedez în cazul în care vreau să-mi retrag dosarul?**\n\nRetragerea dosarului se face gratuit și necondiționat la comisia de admitere.\n\n**Dacă mă decid să îmi retrag dosarul din concurs, poate face altcineva lucrul acesta?**\n\nDa. Retragerea dosarului se poate face de către o altă persoană numai dacă aceasta prezintă o procură autentificată notarial.\n\n**Care este media generală de admitere la studii superioare de licență/integrate**\n\nMedia generală de admitere la studii superioare de licență/integrate este condiționată de media candidatului și criteriile stabilite pentru fiecare domeniu de studiu. Pentru domeniul Științe ale Educației, media de admitere nu poate fi mai mică de 6,50, indiferent de sursa de finanțare și forma de învățământ.\n\n**Dacă am fost înmatriculat la studii cu finanțare de la bugetul de stat voi beneficia de această finanțare pe toată durata studiilor?**\n\nFinanțarea de la bugetul de stat este oferită pentru un an de studii. La sfârșitul fiecărui an universitar se realizează un concurs al notelor medii pentru repartizarea locurilor cu finanțare de la bugetul de stat. Astfel, în dependență de mediile respective, unii studenți ar putea în continuare să beneficieze de finanțare de la bugetul de stat, iar alții să treacă la studii contra taxă.\n\n**Dacă intru la taxă cum pot ocupa ulterior un loc bugetat?**\n\nPoți trece pe locuri finanțate de la bugetul de stat după primul an de studii, în funcție de media pe care o vei obține.\n\n**Dacă doresc loc în cămin, mai este necesară completarea unui formular suplimentar?**\n\nPentru a beneficia de cazare în cămin, trebuie să depuneți o cerere la decanatul facultății la care ați fost admis. Perioada și procedura exactă vor fi anunțate ulterior, însă, de regulă, acest proces are loc după 20 august.\n\n**Cine poate beneficia de loc gratuit de cazare în cămine?**\n\nCei care corespund criteriilor stabilite de către Senatul USM.\n\n**Pot beneficia de un loc de cămin încă din primul an de studii?**\n\nPuteți benificia în limita locurilor disponibile.\n\n**Pot să studiez în paralel la două programe de studii/specialități?**\n\nNu. Poți urma a doua programă de studii în paralel, doar după finalizarea cel puţin a unui an de studii la primul program cu condiția că ai o notă medie înaltă. Poți beneficia de finanțare de la bugetul de stat doar la unul dintre programe, dacă nu ai mai beneficiat până la moment de un loc bugetat. Programele de studii în paralel pot fi realizate doar în cadrul aceleași instituții de învățământ superior, dar nu neapărat în aceeași facultate.\n\n**Ce burse oferă USM?**\n\nÎn baza performanțelor academice și ținând cont de prioritățile de dezvoltare, USM acordă din mijloacele sale special trei tipuri de burse de studii:\n\nburse de excelență -- pentru studenții care au fost admiși la universitate în baza unor rezultate academice remarcabile, obținute la olimpiadele republicane, regionale şi internaționale, detalii puteți vedea [**aici.**](https://admitere.usm.md/?page_id=2395)\n\nburse nominale -- pentru studenții cu rezultate academice înalte, înmatriculați la studii cu taxă, detalii puteți vedea [**aici.**](https://admitere.usm.md/?page_id=2395)\n\nburse nominale pentru candidații la specialitățile pedagogice, detalii puteți vedea [**aici.**](https://admitere.usm.md/?page_id=2395)\n\nburse sociale -- pentru tinerii performanți, care au fost admiși la universitate în baza unor rezultate academice înalte, fac parte din anumite categorii social-vulnerabile, dar nu au fost înmatriculați la locurile prevăzute pentru categoria 15%.\n\n**Pot beneficia de bursă socială dacă am restanțe?**\n\nNu, bursa socială se acordă în conformitate cu criteriile stabilite de regulamentul instituției, iar existența restanțelor poate influența eligibilitatea. Vă recomandăm să consultați regulamentul de acordare a burselor sau să contactați secretariatul facultății pentru informații suplimentare.\n\n**Pot deveni profesor de liceu absolvind USM?**\n\nDa, dacă îți faci studiile la o specializare din domeniul științelor educației sau dacă alegi suplimentar modulul psihopedagogic opțional oferit GRATIUT de USM. Pentru a urma acest modul trebuie să completezi o cerere la decanatul facultății la care ai fost admis. În urma absolvirii acestui programului de studii suplimentat de modulul psihopedagogic vei obține dreptul de a exercita profesia de profesor de liceu.\n\n**Dragi absolvenți!**\n\nPentru orice întrebări, opinii, reclamații sau sugestii, ne puteți contacta prin e-mail la **[ghidare.cariera@usm.md](mailto:ghidare.cariera@usm.md)** , pe pagina noastră de Facebook sau la numărul de telefon: **+373 67 560 009**\n\n**[Руководство для выпускников школ из Приднестровья](http://admitere.usm.md/wp-content/uploads/%D0%A0%D1%83%D0%BA%D0%BE%D0%B2%D0%BE%D0%B4%D1%81%D1%82%D0%B2%D0%BE-%D0%B4%D0%BB%D1%8F-%D0%B2%D1%8B%D0%BF%D1%83%D1%81%D0%BA%D0%BD%D0%B8%D0%BA%D0%BE%D0%B2-%D1%88%D0%BA%D0%BE%D0%BB-%D0%B8%D0%B7-%D0%9F%D1%80%D0%B8%D0%B4%D0%BD%D0%B5%D1%81%D1%82%D1%80%D0%BE%D0%B2%D1%8C%D1%8F.pdf)**\n\n###### Adresa\n\n###### Facultăţi\n\n* [Facultatea de Biologie si Pedologie](https://usm.md/?page_id=489)\n\n* [Facultatea de Chimie şi Tehnologie Chimică](https://usm.md/?page_id=492)\n\n* [Facultatea de Drept](https://usm.md/?page_id=495)\n\n* [Facultatea de Jurnalism şi Ştiinţe ale Comunicării](https://usm.md/?page_id=505)\n\n* [Facultatea de Fizica si Inginerie](https://usm.md/?page_id=498)\n\n* [Facultatea de Istorie şi Filosofie](https://usm.md/?page_id=502)\n\n* [Facultatea de Matematică şi Informatică](https://usm.md/?page_id=515)\n\n* [Facultatea de Litere](https://usm.md/?page_id=511)\n\n* [Facultatea de Științe Economice](https://usm.md/?page_id=528)\n\n* [Facultatea Psihologie, Ştiinţe ale Educaţiei, Sociologie și Asistență Socială](https://usm.md/?page_id=518)\n\n* [Facultatea de Relaţii Internaţionale, Ştiinţe Politice şi Administrative](https://usm.md/?page_id=522)\n\n###### Contacte\n\n* +373 22 244 810\n\n* 9:00 - 17:00\n\n* [Universitatea de Stat din Moldova str. Alexei Mateevici 60, MD-2009](https://www.google.com/maps/place/Universitatea+de+Stat+din+Moldova/@47.018939,28.824491,18z/data=!4m5!3m4!1s0x0:0xd8e8b74ac8c3ef7b!8m2!3d47.0192025!4d28.8230857?hl=ro)\n\n* rector@usm.md  \nToleranță zero corupției\n\n* integritate@usm.md\n\n* [old.usm.md](https://old.usm.md/)  \n[Facebook](https://www.facebook.com/UniversitateaDeStatDinMoldova/) [Instagram](https://www.instagram.com/accounts/login/?next=/usm.md/) [Youtube](https://www.youtube.com/channel/UC3oFsXde0eZRaAqeX_6iBcg/videos)  \n**Universitatea de Stat din Moldova 2025 © All Rights Reserved\n​**  \nSecție Programare Web al USM ®  \nUniversitatea de Stat din Moldova folosește module cookie strict necesare și alte tehnologii similare pentru a opera acest website și pentru a oferi utilizatorilor o experiență personalizată. Pe lângă modulele cookie strict necesare, Universitatea de Stat din Moldova folosește module cookie opționale pentru a îmbunătăți și personaliza experiența utilizatorilor, pentru a analiza performanța website-ului.[Ok](https://admitere.usm.md/?page_id=1925#)  \n[](https://admitere.usm.md/)[](https://admitere.usm.md/)\n\n* [Oferta 2024](http://admitere.usm.md/)\n  * [Licenta](https://admitere.usm.md/?page_id=98)\n  * [Master](https://admitere.usm.md/?page_id=94)\n  * [Întrebări frecvente](https://admitere.usm.md/?page_id=1925)\n  * [Programe de motivare](https://admitere.usm.md/?page_id=2395)\n  * [Broșuri](https://admitere.usm.md/?page_id=41)\n  * [Taxe](https://admitere.usm.md/?page_id=4209)\n\n* [Calendarul admiterii](https://admitere.usm.md/?page_id=3906)\n\n* [Acte](http://admitere.usm.md/)\n  * [Regulamente](https://admitere.usm.md/?page_id=50)\n  * [Acte necesare admitere](http://admitere.usm.md/)\n    * [Acte necesare la admitere ciclul I](https://admitere.usm.md/?page_id=562)\n    * [Acte necesare la admitere ciclul II](https://admitere.usm.md/?page_id=565)\n  * [Plan de admitere](https://admitere.usm.md/?page_id=1925#)\n    * [Plan admitere Licenţă cu frecvență](http://admitere.usm.md/wp-content/uploads/Plan-inmatriculare_Licenta-2.pdf)\n    * [Plan admitere Licenţă cu frecvență redusă](http://admitere.usm.md/wp-content/uploads/Plan-inmatriculare_Licenta_frec.-redusa-1.pdf)\n    * [Plan admitere Master cu frecvență](http://admitere.usm.md/wp-content/uploads/Plan-inmatriculare_Master-2.pdf)\n    * [Plan admitere Master cu frecvență redusă](http://admitere.usm.md/wp-content/uploads/Plan-inmatriculare_master.frec_.redusa.pdf)\n    * [Plan admitere pentru studenți străini](http://admitere.usm.md/wp-content/uploads/plan-inmatr.-cetateni-straini-1.pdf)\n  * [Tuition fees](https://admitere.usm.md/?page_id=1476)\n  * [Taxe de studii](http://admitere.usm.md/)\n    * [Taxele de studii, Ciclul I studii superioare de licenţă](https://admitere.usm.md/?page_id=3740)\n    * [Taxele de studii, Ciclul II studii superioare de masterat](https://admitere.usm.md/?page_id=3741)\n\n* [Comisia de admitere](https://admitere.usm.md/?page_id=1445)\n\n* [Rezultate](https://admitere.usm.md/?page_id=56)\n  * [Turul I: Anunţarea rezultatelor finale](https://admitere.usm.md/?page_id=2682)\n  * [Turul II: Anunţarea rezultatelor finale](https://admitere.usm.md/?page_id=2778)\n\n* [Centrul de Ghidare în Carieră](https://cgc.usm.md/)\n\n* [Ro:](https://admitere.usm.md/?page_id=1925# \"Română\")\n  * [Română](https://admitere.usm.md/?page_id=1925&lang=ro \"Română\")\n  * [English](https://admitere.usm.md/?page_id=1925&lang=en \"English\")\n  * [Русский](https://admitere.usm.md/?page_id=1925&lang=ru \"Русский\")\n\nNotificări [Source]{https://admitere.usm.md/?page_id=1925)", "Acte necesare la admitere ciclul I -- Admitere 2024 Skip to content  \n[![](https://admitere.usm.md/wp-content/uploads/cropped-cropped-logo_dark_22-2-1.png)](https://admitere.usm.md/)[![Admitere 2024](https://admitere.usm.md/wp-content/uploads/cropped-cropped-logo_dark_22-2.png)](https://admitere.usm.md/)\n\n* [Oferta 2024](http://admitere.usm.md/)\n  * [Licenta](https://admitere.usm.md/?page_id=98)\n  * [Master](https://admitere.usm.md/?page_id=94)\n  * [Întrebări frecvente](https://admitere.usm.md/?page_id=1925)\n  * [Programe de motivare](https://admitere.usm.md/?page_id=2395)\n  * [Broșuri](https://admitere.usm.md/?page_id=41)\n  * [Taxe](https://admitere.usm.md/?page_id=4209)\n\n* [Calendarul admiterii](https://admitere.usm.md/?page_id=3906)\n\n* [Acte](http://admitere.usm.md/)\n  * [Regulamente](https://admitere.usm.md/?page_id=50)\n  * [Acte necesare admitere](http://admitere.usm.md/)\n    * [Acte necesare la admitere ciclul I](https://admitere.usm.md/?page_id=562)\n    * [Acte necesare la admitere ciclul II](https://admitere.usm.md/?page_id=565)\n  * Plan de admitere\n    * [Plan admitere Licenţă cu frecvență](http://admitere.usm.md/wp-content/uploads/Plan-inmatriculare_Licenta-2.pdf)\n    * [Plan admitere Licenţă cu frecvență redusă](http://admitere.usm.md/wp-content/uploads/Plan-inmatriculare_Licenta_frec.-redusa-1.pdf)\n    * [Plan admitere Master cu frecvență](http://admitere.usm.md/wp-content/uploads/Plan-inmatriculare_Master-2.pdf)\n    * [Plan admitere Master cu frecvență redusă](http://admitere.usm.md/wp-content/uploads/Plan-inmatriculare_master.frec_.redusa.pdf)\n    * [Plan admitere pentru studenți străini](http://admitere.usm.md/wp-content/uploads/plan-inmatr.-cetateni-straini-1.pdf)\n  * [Tuition fees](https://admitere.usm.md/?page_id=1476)\n  * [Taxe de studii](http://admitere.usm.md/)\n    * [Taxele de studii, Ciclul I studii superioare de licenţă](https://admitere.usm.md/?page_id=3740)\n    * [Taxele de studii, Ciclul II studii superioare de masterat](https://admitere.usm.md/?page_id=3741)\n\n* [Comisia de admitere](https://admitere.usm.md/?page_id=1445)\n\n* [Rezultate](https://admitere.usm.md/?page_id=56)\n  * [Turul I: Anunţarea rezultatelor finale](https://admitere.usm.md/?page_id=2682)\n  * [Turul II: Anunţarea rezultatelor finale](https://admitere.usm.md/?page_id=2778)\n\n* [Centrul de Ghidare în Carieră](https://cgc.usm.md/)\n\n* Ro: ![Română](https://admitere.usm.md/wp-content/plugins/qtranslate-x/flags/ro.png)\n  * [![Română](https://admitere.usm.md/wp-content/plugins/qtranslate-x/flags/ro.png) Română](https://admitere.usm.md/?page_id=562&lang=ro \"Română\")\n  * [:uk: English](https://admitere.usm.md/?page_id=562&lang=en \"English\")\n  * [:ru: Русский](https://admitere.usm.md/?page_id=562&lang=ru \"Русский\")\n\n[![](https://admitere.usm.md/wp-content/uploads/cropped-cropped-logo_dark_22-2-1.png)](https://admitere.usm.md/)[![Admitere 2024](https://admitere.usm.md/wp-content/uploads/cropped-cropped-logo_dark_22-2.png)](https://admitere.usm.md/)\n\n* [Oferta 2024](http://admitere.usm.md/)\n  * [Licenta](https://admitere.usm.md/?page_id=98)\n  * [Master](https://admitere.usm.md/?page_id=94)\n  * [Întrebări frecvente](https://admitere.usm.md/?page_id=1925)\n  * [Programe de motivare](https://admitere.usm.md/?page_id=2395)\n  * [Broșuri](https://admitere.usm.md/?page_id=41)\n  * [Taxe](https://admitere.usm.md/?page_id=4209)\n\n* [Calendarul admiterii](https://admitere.usm.md/?page_id=3906)\n\n* [Acte](http://admitere.usm.md/)\n  * [Regulamente](https://admitere.usm.md/?page_id=50)\n  * [Acte necesare admitere](http://admitere.usm.md/)\n    * [Acte necesare la admitere ciclul I](https://admitere.usm.md/?page_id=562)\n    * [Acte necesare la admitere ciclul II](https://admitere.usm.md/?page_id=565)\n  * Plan de admitere\n    * [Plan admitere Licenţă cu frecvență](http://admitere.usm.md/wp-content/uploads/Plan-inmatriculare_Licenta-2.pdf)\n    * [Plan admitere Licenţă cu frecvență redusă](http://admitere.usm.md/wp-content/uploads/Plan-inmatriculare_Licenta_frec.-redusa-1.pdf)\n    * [Plan admitere Master cu frecvență](http://admitere.usm.md/wp-content/uploads/Plan-inmatriculare_Master-2.pdf)\n    * [Plan admitere Master cu frecvență redusă](http://admitere.usm.md/wp-content/uploads/Plan-inmatriculare_master.frec_.redusa.pdf)\n    * [Plan admitere pentru studenți străini](http://admitere.usm.md/wp-content/uploads/plan-inmatr.-cetateni-straini-1.pdf)\n  * [Tuition fees](https://admitere.usm.md/?page_id=1476)\n  * [Taxe de studii](http://admitere.usm.md/)\n    * [Taxele de studii, Ciclul I studii superioare de licenţă](https://admitere.usm.md/?page_id=3740)\n    * [Taxele de studii, Ciclul II studii superioare de masterat](https://admitere.usm.md/?page_id=3741)\n\n* [Comisia de admitere](https://admitere.usm.md/?page_id=1445)\n\n* [Rezultate](https://admitere.usm.md/?page_id=56)\n  * [Turul I: Anunţarea rezultatelor finale](https://admitere.usm.md/?page_id=2682)\n  * [Turul II: Anunţarea rezultatelor finale](https://admitere.usm.md/?page_id=2778)\n\n* [Centrul de Ghidare în Carieră](https://cgc.usm.md/)\n\n* Ro: ![Română](https://admitere.usm.md/wp-content/plugins/qtranslate-x/flags/ro.png)\n  * [![Română](https://admitere.usm.md/wp-content/plugins/qtranslate-x/flags/ro.png) Română](https://admitere.usm.md/?page_id=562&lang=ro \"Română\")\n  * [:uk: English](https://admitere.usm.md/?page_id=562&lang=en \"English\")\n\n* [:ru: Русский](https://admitere.usm.md/?page_id=562&lang=ru \"Русский\")\n\nActe necesare la admitere ciclul I\n==================================\n\n<br />\n\n***Documente obligatorii:***\n\n* cererea de înscriere la concursul de admitere;\n\n* actul de studii, în original, cu anexa respectivă (absolvenți liceelor din România și alte state, promoția din anul admiterii, prezintă certificatul de studii, cu notele obținute la examenele de bacalaureat şi situația școlară pe anii de studii, urmând ca diploma de bacalaureat să fie prezentată ulterior); act de studii-xerox\n\n* 4 fotografii 3×4 cm;\n\n* copia buletinului de identitate;\n\n* Adeverință de recrut\n\n***Alte documente, în situații speciale:***\n\n* diplomele de gradul I-III, obținute de către candidați la concursurile școlare republicane sau internaționale, la disciplinele de studiu, precum și diplomele ce atestă participarea la diferite concursuri (olimpiade), expoziții etc., organizate de Ministerul Educației, Culturii și Cercetării sau de ministerele de resort; [Source]{https://admitere.usm.md/?page_id=562)" ]
}