{
  "question" : "Расскажи об USM",
  "answer" : "Извините, я не могу ответить на ваш вопрос, используя предоставленную информацию. Однако я могу предложить вам некоторые ключевые моменты о Университете Государственном Молдовы (USM):\n\n1. **Статус**: USM является государственной университетской институцией и имеет национальный уровень.\n2. **История**: Университет был основан 1 октября 1946 года и стал первой высшей учебной заведением в Молдове.\n3. **Факультеты**: В университете есть 11 факультетов, предлагающих более ста программ бакалавриата и магистратуры.\n4. **Миссия**: Основная миссия USM заключается в подготовке высококвалифицированных кадров для национальной экономики и проведении научных исследований.\n\nЕсли вам нужна дополнительная информация, вы можете посетить [официальный сайт USM](https://usm.md/).",
  "contexts" : [ "* USM -- instituţie universitară ***de stat***\n\n* USM -- instituţie universitară ***de nivel naţional.***\n\nAl doilea element al stemei se compune din 3 cărţi care însoţesc blazonul moldovenesc. Cartea este un simbol universal al ştiinţei şi înţelepciunii şi însemnul tradiţional al majorităţii stemelor instituţiilor de învăţământ. În heraldică cartea închisă este un simbol vechi, tradiţional cu o vădită aluzie la Biblie. Prezenţa a trei cărţi pe stemă simbolizează pregătirea la USM a specialiștilor în cele trei domenii: ştiinţe exacte, ştiinţe ale naturii şi ştiinţe umanistice. Scutul este timbrat de o tocă -- unul din însemne ale funcţiei de profesor. Deviza „VITAE DISCIMUS\" (pentru viaţă învăţăm) exprimă crezul corpului profesoral şi al absolvenţilor USM.\n\n#### Drapelul USM\n\nDrapelul presupune un fundal alb, în centrul căruia este amplasată stema Universităţii. Albul pânzei drapelului este albul filei de hârtie pe care se fixează cunoştinţele pentru a fi perpetuate. În acelaşi timp albul, sau argintul heraldic semnifică curăţenia, inocenţa şi înţelepciunea.\n\n![](http://usm.md/wp-content/uploads/Drapel-USM.jpg \"Drapel USM\")\n\n[**Descrierea heraldică detaliată a stemei şi drapelului USM**](https://usm.md/wp-content/uploads/Nota-explicativa-stemadrapel-USM1.pdf)\n\n**Istoric**\n\nUniversitatea de Stat din Moldova (USM) este prima instituție de învățământ superior cu statut de universitate înființată în Republica Moldova.\n\nFondată la 1 octombrie 1946, cu denumirea inițială de Universitatea de Stat din Chișinău, de-a lungul timpului și-a format o reputație impecabilă la nivel național și internațional. Crearea ei a constituit un pilon de bază pentru dezvoltarea și consolidarea învățământului superior din țară.\n\n![](https://usm.md/wp-content/uploads/Bloc-2.jpg)Inițial, au fost deschise 5 facultăți: Istorie și Filologie, Fizică și Matematică, Biologie, Chimie, Geologie și Pedologie. În primul an (1946-1947), la cele 12 catedre au fost înmatriculați 320 de studenți, procesul educațional fiind ghidat de 35 de cadre didactice. În 1958, la USM a fost inaugurată secția învățământ cu frecvență redusă, care, la unele facultăți, continuă până în prezent. O oportunitate pentru pregătirea tinerilor specialiști a reprezentat, mai mulți ani la rând (1958-1981), secția serală.\n\nÎn scurt timp, USM devine lider recunoscut al sistemului național de învățământ superior din țară, răspunzând la cerințele societății prin diversificarea programelor oferite și instituirea noilor subdiviziuni, catedre și facultăți, inclusiv: Facultatea de Economie (1953, 2002), Facultatea de Drept (1959), Facultatea de Inginerie și Tehnologie (1959), Facultatea de Limbi Străine (1964), Facultatea de Formare pentru Studenții Străini (1967), Școala de Jurnalism (1980), Facultatea de Filosofie și Psihologie (1994), Facultatea de Științe Politice (1995), Centrul de Calcul (1973). Între anii 1946-1988, USM a fost parte componentă a sistemului universitar sovietic, gestionarea ei fiind dirijată de Moscova, capitala ex-URSS. Odată cu destrămarea Uniunii Sovietice, au fost introduse schimbări esențiale în sistemul național de învățământ. Perioada 1988-1996, pentru universitate, se caracterizează prin perfecționarea formelor tradiționale de predare-învățare și aplicarea noilor tehnologii. La 19 ianuarie 1990, instituția primește denumirea ei actuală -- Universitatea de Stat din Moldova.\n\nPe parcursul a mai mult de 70 de ani, USM a devenit un centru universitar de elită, atât la nivel național, cât și internațional. Circa 120 de mii de absolvenți ai acestei universități activează în diverse domenii, precum: economie, educație, cultură, justiție, politică etc. O mare parte din elita intelectuală a Republicii Moldova s-a format la USM.\n\nUniversitatea de Stat din Moldova este prima instituție de învățământ superior acreditată la nivel național (2001). Procesul educațional este realizat de o comunitate academică de prestigiu, care asigură desfășurarea acestuia la nivelul cerințelor pieței muncii, raliindu-se la paradigmele moderne de instruire prin aderarea, în mai 2005, la Procesul de la Bologna.\n\nÎn 2011, la 65 de ani de la fondare, în semn de înaltă apreciere a meritelor deosebite în dezvoltarea învățământului universitar național și în promovarea reformelor în domeniu, pentru contribuția substanțială la pregătirea specialiștilor de înaltă calificare și a tinerilor savanți, Universitatea de Stat din Moldova a fost decorată cu cea mai înaltă distincție de stat -- „Ordinul Republicii\".\n\n![](https://usm.md/wp-content/uploads/USM_Block_1-1-scaled.jpg)Începând cu anul 2013, potrivit rezultatelor clasamentului mondial Ranking Web of Universities, elaborat de Consiliul Superior de Investigații Științifice din cadrul Ministerului Științei și Inovării al Spaniei, Universitatea de Stat din Moldova se plasează pe primul loc în topul celor mai prestigioase universități din țară, fapt ce demonstrează că USM este o instituție de învățământ superior competitivă, iar absolvenții ei se bucură de un spectru larg de oportunități de angajare.\n\nUniversitatea de Stat din Moldova reprezintă spațiul în care este promovată libertatea academică. Aici au fost susținute în permanență pluralismul de opinii, creativitatea, precum și tendința de a asigura calitatea pregătirii specialiștilor de înaltă calificare, transformându-se într-un laborator al democrației cu idei generate în baza unui dialog constructiv între studenți și corpul profesoral.\n\nUSM beneficiază de o bază tehnico-materială modernă, ce corespunde standardelor internaționale, asigurând activitatea personalului academic și a studenților prin crearea unui mediu propice pentru procesul educațional și cel de cercetare. Universitatea pune la dispoziția studenților 6 blocuri de învățământ, 10 cămine, o bibliotecă universitară dotată cu săli de lectură, un Palat al Sporturilor, o Casă de Cultură, cantine, baze de practică și de agrement.\n\nÎn prezent, Universitatea de Stat din Moldova este una dintre cele mai importante instituții de învățământ superior din țară. USM dispune de un contingent de cca 11 000 de studenți, care își fac studiile la peste o sută de programe de studii de licență și master, în cadrul a 11 facultăți și 4 școli doctorale.\n\n![](https://usm.md/wp-content/uploads/Bloc-2_new-1024x539.jpg)Universitatea de Stat din Moldova este recunoscută în arealul învăţământului universitar internaţional şi este integrată într-o puternică reţea de cooperare internaţională: cca 110 de acorduri de colaborare bilaterală cu instituţii de învăţământ superior din 28 de ţări. Astăzi Universitatea de Stat este membră a Asociaţiei Internaţionale a Universităţilor (IAU), Agenţiei Universitare a Francofoniei(AUF) și a Asociaţiei Euroasiatice a Universităţilor (AEU).\n\nÎn anul 2011, USM a devenit membră a Consorțiului Universităților din Republica Moldova -- România -- Ucraina (CUMRU), iar din 23 noiembrie 2018 este membră asociată a Consorțiului ***Universitaria***, din care fac parte Academia de Studii Economice din București, Universitatea din București, Universitatea Babeș-Bolyai din Cluj-Napoca, Universitatea \"Alexandru Ioan Cuza\" din Iași și Universitatea de Vest din Timișoara.\n\n###### Adresa\n\n###### Facultăţi\n\n* [Facultatea de Biologie și Geoștiințe](https://usm.md/?page_id=489)\n\n* [Facultatea de Chimie şi Tehnologie Chimică](https://usm.md/?page_id=492)\n\n* [Facultatea de Drept](https://usm.md/?page_id=495)\n\n* [Facultatea de Jurnalism şi Ştiinţe ale Comunicării](https://usm.md/?page_id=505)\n\n* [Facultatea de Fizica si Inginerie](https://usm.md/?page_id=498)\n\n* [Facultatea de Istorie şi Filosofie](https://usm.md/?page_id=502)\n\n* [Facultatea de Matematică şi Informatică](https://usm.md/?page_id=515)\n\n* [Facultatea de Litere](https://usm.md/?page_id=511)\n\n* [Facultatea de Științe Economice](https://usm.md/?page_id=528)\n\n* [Facultatea Psihologie, Ştiinţe ale Educaţiei, Sociologie și Asistență Socială](https://usm.md/?page_id=518)\n\n* [Facultatea de Relaţii Internaţionale, Ştiinţe Politice şi Administrative](https://usm.md/?page_id=522)\n\n###### Contacte\n\n* +373 22 244 810\n\n* 9:00 - 17:00\n\n* [Universitatea de Stat din Moldova str. Alexei Mateevici 60, MD-2009](https://www.google.com/maps/place/Universitatea+de+Stat+din+Moldova/@47.018939,28.824491,18z/data=!4m5!3m4!1s0x0:0xd8e8b74ac8c3ef7b!8m2!3d47.0192025!4d28.8230857?hl=ro)\n\n* rector@usm.md  \nToleranță zero corupției\n\n* integritate@usm.md  \n[Facebook](https://www.facebook.com/UniversitateaDeStatDinMoldova/) [Instagram](https://www.instagram.com/accounts/login/?next=/usm.md/) [Youtube](https://www.youtube.com/channel/UC3oFsXde0eZRaAqeX_6iBcg/videos)  \n**Universitatea de Stat din Moldova 2025 © All Rights Reserved\n​**  \nOficiul Programare Web al USM ®  \n×  \n×  \n×  \n×  \n×  \n×  \n×  \n×  \n×  \n×  \n×  \nUniversitatea de Stat din Moldova folosește module cookie strict necesare și alte tehnologii similare pentru a opera acest website și pentru a oferi utilizatorilor o experiență personalizată. Pe lângă modulele cookie strict necesare, Universitatea de Stat din Moldova folosește module cookie opționale pentru a îmbunătăți și personaliza experiența utilizatorilor, pentru a analiza performanța website-ului.Ok [Source]{https://usm.md/?page_id=18)", "Despre -- Universitatea de Stat din Moldova Skip to content\n\n* Oferta 2024\n  * [Licență](https://admitere.usm.md/?page_id=98)\n  * [Master](https://admitere.usm.md/?page_id=94)\n  * [Întrebări frecvente](https://admitere.usm.md/?page_id=1925)\n  * [Programe de Motivare](https://admitere.usm.md/?page_id=2395)\n  * [Broșuri](https://admitere.usm.md/?page_id=41)\n  * [Taxe](https://admitere.usm.md/?page_id=4209)\n\n* [Microsoft 365](https://microsoft365.usm.md/)\n\n* [Centrul de Ghidare în Carieră](https://cgc.usm.md)\n\n* Cercetare\n  * [Departamentul Cercetare și Inovare](https://cercetare.usm.md/)\n  * [Institute de Cercetare](https://usm.md/?page_id=19861)\n\n* [International](https://international.usm.md/)  \n[](https://www.facebook.com/UniversitateaDeStatDinMoldova/) [](https://www.instagram.com/usm.md/) [](https://www.youtube.com/channel/UC3oFsXde0eZRaAqeX_6iBcg/videos)  \n[![Universitatea de Stat din Moldova](https://usm.md/wp-content/uploads/cropped-logo_dark_22.png)](https://usm.md/)  \nCaută după:\n\n* USM\n  * [Despre](https://usm.md/?page_id=18)\n  * Conducerea Universității\n    * [Rectorat](https://usm.md/?page_id=194)\n    * [Senatul Universitar](https://usm.md/?page_id=188)\n    * [Consiliul de Administrație](https://usm.md/?page_id=197)\n    * Comisiile Senatului\n      * [Comisia de etică universitară](https://usm.md/?page_id=549)\n      * [Comisia activitate didactică, învăţămînt şi evaluare academică](https://usm.md/?page_id=552)\n      * [Comisia management universitar şi dezvoltare instituţională](https://usm.md/?page_id=555)\n      * [Comisia informatizare](https://usm.md/?page_id=3129)\n      * [Comisia relaţii internaţionale](https://usm.md/?page_id=3128)\n      * [Comisia comunicare și promovarea imaginii](https://usm.md/?page_id=558)\n      * [Comisia pentru cercetare](https://usm.md/?page_id=561)\n      * [Comisia pentru probleme studenţeşti](https://usm.md/?page_id=564)\n      * [Comisia pentru activităţi culturale şi sportive](https://usm.md/?page_id=567)\n    * [Consiliul pentru Dezvoltarea Strategică Instituțională](https://usm.md/?page_id=191)\n    * [Consiliul Științific](https://usm.md/?page_id=626)\n  * Organizare\n    * Departamentul Managementul Calității\n      * [Structura](https://usm.md/?page_id=12865)\n      * [Acte normative](https://usm.md/?page_id=12868)\n      * Planuri de activitate, rapoarte\n        * [Planuri de activitate](https://usm.md/?page_id=12870)\n        * [Rapoarte de activitate](https://usm.md/?page_id=12877)\n      * Audit intern\n        * [Proceduri de audit](https://usm.md/?page_id=12880)\n        * [Planuri de audit](https://usm.md/?page_id=12884)\n        * [Membrii comisiilor de audit](https://usm.md/?page_id=12886)\n      * Evaluare externă\n        * [Planuri de măsuri corective](https://usm.md/?page_id=12894)\n        * Acte normative\n          * [Curente](https://usm.md/?page_id=12891)\n          * [Arhiva](https://usm.md/?page_id=16434)\n        * Acreditare Instituțională\n          * [Raportul de autoevaluare](https://usm.md/?page_id=19384)\n          * [Anexe](https://usm.md/?page_id=18560)\n            * [Anexa 1](https://usm.md/?page_id=18563)\n            * [Anexa 2.1](https://usm.md/?page_id=18566)\n            * [Anexa 2.2](https://usm.md/?page_id=18619)\n            * [Anexa 2.3](https://usm.md/?page_id=18620)\n            * [Anexa 2.4](https://usm.md/?page_id=19128)\n            * [Anexa 2.5](https://usm.md/?page_id=18643)\n            * [Anexa 3.1](https://usm.md/?page_id=18657)\n            * [Anexa 3.2](https://usm.md/?page_id=18699)\n            * [Anexa 3.3](https://usm.md/?page_id=18825)\n            * [Anexa 3.4](https://usm.md/?page_id=19037)\n            * [Anexa 3.5](https://usm.md/?page_id=19185)\n            * [Anexa 3.6](https://usm.md/?page_id=19248)\n            * [Anexa 3.7](https://usm.md/?page_id=19259)\n            * [Anexa 4](https://usm.md/?page_id=19270)\n            * [Anexe FV](https://usm.md/?page_id=19367)\n    * [Departamentul IT](https://usm.md/?page_id=25666)\n    * [Departamentul Cercetare și Inovare](https://cercetare.usm.md/)\n    * [Biblioteca USM](https://library.usm.md/)\n    * [Departamentul Relații Internaționale](https://usm.md/?page_id=257)\n    * [Centru de Resurse pentru Formare Continuă](https://usm.md/?page_id=228)\n    * [Secția Comunicare și Relații Publice](https://usm.md/?page_id=362)\n    * [Centrul de Ghidare în Carieră și Relații cu Piața Muncii](https://usm.md/?page_id=268)\n    * [Departamentul Resurse Umane](https://usm.md/?page_id=271)\n    * [Oficiul Achiziții Publice](https://usm.md/?page_id=385)\n    * [Departamentul Contabilitate](https://usm.md/?page_id=274)\n    * [Departamentul economico-financiar](https://usm.md/?page_id=752)\n    * [Organigrama](https://usm.md/wp-content/uploads/Organigrama_Noiembrie_Decembrie_Senat_28_11_2023.pdf)\n  * Resurse\n    * Resurse digitale\n      * [Revista de Istorie a Moldovei](https://usm.md/?page_id=15485)\n      * [VOX USM](https://usm.md/?page_id=1996)\n    * [Documente](https://usm.md/?page_id=203)\n      * [Acte normative nationale](https://usm.md/?page_id=206)\n      * [Acte normative USM](https://usm.md/?page_id=209)\n        * [Documente reglementare activitate instituţională](https://usm.md/?page_id=451)\n        * [Regulamente resurse umane](https://usm.md/?page_id=453)\n        * [Regulamente proces educational](https://usm.md/?page_id=455)\n        * [Regulamente managementul calității](https://usm.md/?page_id=457)\n        * [Regulamente activitate ştiinţifică](https://usm.md/?page_id=459)\n        * [Regulamente Relaţii Internaţionale](https://usm.md/?page_id=461)\n        * [Regulamente sistem informaţional](https://usm.md/?page_id=463)\n        * Planuri și rapoarte de activitate\n          * [Rapoarte de activitate](https://usm.md/?page_id=3237)\n          * [Situațiile financiare](https://usm.md/?page_id=1220)\n          * [Planuri achizitiilor publice](https://usm.md/?page_id=2203)\n          * [Raport privind realizarea contractelor încheiate în urma procedurilor de achiziție](https://usm.md/?page_id=1224)\n          * [Graficul şedinţelor departamentelor USM](https://usm.md/wp-content/uploads/Graficul_Sedintelor_Departamentelor-1.pdf)\n          * [Planuri și Rapoarte De Activitate](https://usm.md/?page_id=10032)\n        * [Arhiva](https://usm.md/?page_id=18165)\n    * [Moodle.USM](http://moodle.usm.md/)\n    * [Galeria](https://usm.md/?page_id=9106)\n    * [Materiale Grafice USM](https://usm.md/?page_id=20143)\n  * Proiecte\n    * Banca Mondială\n      * [Subproiecte](https://usm.md/?page_id=16155)\n      * [Transparență](https://usm.md/?page_id=26463)\n    * Erasmus+\n      * [DEFEP](https://defep.usm.md/)\n      * [EUDIPSEC](https://eudipsec.usm.md/)\n      * [QFORTE](https://usm.md/?page_id=29341)\n\n* [Facultăți](https://usm.md/)\n  * [Facultatea de Biologie și Geoștiințe](https://usm.md/?page_id=489)\n  * [Facultatea de Drept](https://usm.md/?page_id=495)\n  * [Facultatea de Chimie şi Tehnologie Chimică](https://usm.md/?page_id=492)\n  * [Facultatea de Fizica si Inginerie](https://usm.md/?page_id=498)\n  * [Facultatea de Istorie şi Filosofie](https://usm.md/?page_id=502)\n  * [Facultatea de Jurnalism şi Ştiinţe ale Comunicării](https://usm.md/?page_id=505)\n  * [Facultatea de Litere](https://usm.md/?page_id=511)\n  * [Facultatea de Matematică şi Informatică](https://usm.md/?page_id=515)\n  * [Facultatea Psihologie, Ştiinţe ale Educaţiei, Sociologie și Asistență Socială](https://usm.md/?page_id=518)\n  * [Facultatea de Relaţii Internaţionale, Ştiinţe Politice şi Administrative](https://usm.md/?page_id=522)\n  * [Facultatea de Ştiinţe Economice](https://usm.md/?page_id=528)\n  * [Institutul de Educație Fizică și Sport](https://usm.md/?page_id=31334)\n\n* [Studii](https://usm.md/?page_id=20)\n  * [Departamentul Studii](https://usm.md/?page_id=241)\n  * Calendar academic\n    * [Licență](https://usm.md/?page_id=731)\n    * [Master](https://usm.md/?page_id=734)\n    * [Doctorat](https://usm.md/?page_id=737)\n  * [Studii de Licență](https://usm.md/?page_id=216)\n  * [Studii de Masterat](https://usm.md/?page_id=219)\n  * [Studii de Doctorat](https://doctorat.usm.md/)\n  * [Catedra Militară](https://usm.md/?page_id=680)\n  * Burse\n    * [Burse finanțate din bugetul de stat](https://usm.md/?page_id=392)\n    * [Burse de performanță](https://usm.md/?page_id=396)\n  * [Recunoaștere și echivalare](https://usm.md/?page_id=26183)\n\n* [Formare Continuă](http://crfc.usm.md/)\n\n* [Studenti](https://usm.md/?page_id=34)\n  * Descoperă@USM\n    * [Concurs „Hai să #Celebrăm75USM!\"](https://usm.md/?page_id=3181)\n    * [Istoria USM](https://usm.md/wp-content/uploads/ISTORIA_USM.pdf)\n    * [Broșura USM (Ro)](https://usm.md/wp-content/uploads/Broshura_USM_2020_ro.pdf)\n    * [Broșura USM (En)](https://usm.md/wp-content/uploads/Broshura_USM_2020_en.pdf)\n    * [Oferta USM 2023](https://usm.md/wp-content/uploads/pliant_oferta-educațională-2021.pdf)\n    * [Ghid pentru studenții anului I și II](https://usm.md/wp-content/uploads/ghid-studenti-anul-I-SI-II-USM-web.pdf)\n    * [Program de motivare a candidaților](https://usm.md/?page_id=1112)\n  * [Campus](https://usm.md/?page_id=22279)\n  * [Asociații studențești](http://asusm.usm.md/)\n  * Actvitati extracurriculare\n    * [Arte Frumoase](https://usm.md/?page_id=668)\n    * [Sport](https://usm.md/?page_id=667)\n  * [Cariera](https://usm.md/?page_id=268)\n\n* [Contacte](https://usm.md/?page_id=1380)\n\n* Ro: ![Română](https://usm.md/wp-content/plugins/qtranslate-x/flags/ro.png)\n  * [![Română](https://usm.md/wp-content/plugins/qtranslate-x/flags/ro.png) Română](https://usm.md/?page_id=18&lang=ro \"Română\")\n  * [:uk: English](https://usm.md/?page_id=18&lang=en \"English\")\n  * [:ru: Русский](https://usm.md/?page_id=18&lang=ru \"Русский\")\n\n[![Universitatea de Stat din Moldova](https://usm.md/wp-content/uploads/cropped-logo_dark_22.png)](https://usm.md/)\n\n* USM\n  * [Despre](https://usm.md/?page_id=18)\n  * Conducerea Universității\n    * [Rectorat](https://usm.md/?page_id=194)\n    * [Senatul Universitar](https://usm.md/?page_id=188)\n    * [Consiliul de Administrație](https://usm.md/?page_id=197)\n    * Comisiile Senatului\n      * [Comisia de etică universitară](https://usm.md/?page_id=549)\n      * [Comisia activitate didactică, învăţămînt şi evaluare academică](https://usm.md/?page_id=552)\n      * [Comisia management universitar şi dezvoltare instituţională](https://usm.md/?page_id=555)\n      * [Comisia informatizare](https://usm.md/?page_id=3129)\n      * [Comisia relaţii internaţionale](https://usm.md/?page_id=3128)\n      * [Comisia comunicare și promovarea imaginii](https://usm.md/?page_id=558)\n      * [Comisia pentru cercetare](https://usm.md/?page_id=561)\n      * [Comisia pentru probleme studenţeşti](https://usm.md/?page_id=564)\n      * [Comisia pentru activităţi culturale şi sportive](https://usm.md/?page_id=567)\n    * [Consiliul pentru Dezvoltarea Strategică Instituțională](https://usm.md/?page_id=191)\n    * [Consiliul Științific](https://usm.md/?page_id=626)\n  * Organizare\n    * Departamentul Managementul Calității\n      * [Structura](https://usm.md/?page_id=12865)\n      * [Acte normative](https://usm.md/?page_id=12868)\n      * Planuri de activitate, rapoarte\n        * [Planuri de activitate](https://usm.md/?page_id=12870)\n        * [Rapoarte de activitate](https://usm.md/?page_id=12877)\n      * Audit intern\n        * [Proceduri de audit](https://usm.md/?page_id=12880)\n        * [Planuri de audit](https://usm.md/?page_id=12884)\n        * [Membrii comisiilor de audit](https://usm.md/?page_id=12886)\n      * Evaluare externă\n        * [Planuri de măsuri corective](https://usm.md/?page_id=12894)\n        * Acte normative\n          * [Curente](https://usm.md/?page_id=12891)\n          * [Arhiva](https://usm.md/?page_id=16434)\n        * Acreditare Instituțională\n          * [Raportul de autoevaluare](https://usm.md/?page_id=19384)\n          * [Anexe](https://usm.md/?page_id=18560)\n            * [Anexa 1](https://usm.md/?page_id=18563)\n            * [Anexa 2.1](https://usm.md/?page_id=18566)\n            * [Anexa 2.2](https://usm.md/?page_id=18619)\n            * [Anexa 2.3](https://usm.md/?page_id=18620)\n            * [Anexa 2.4](https://usm.md/?page_id=19128)\n            * [Anexa 2.5](https://usm.md/?page_id=18643)\n            * [Anexa 3.1](https://usm.md/?page_id=18657)\n            * [Anexa 3.2](https://usm.md/?page_id=18699)\n            * [Anexa 3.3](https://usm.md/?page_id=18825)\n            * [Anexa 3.4](https://usm.md/?page_id=19037)\n            * [Anexa 3.5](https://usm.md/?page_id=19185)\n            * [Anexa 3.6](https://usm.md/?page_id=19248)\n            * [Anexa 3.7](https://usm.md/?page_id=19259)\n            * [Anexa 4](https://usm.md/?page_id=19270)\n            * [Anexe FV](https://usm.md/?page_id=19367)\n    * [Departamentul IT](https://usm.md/?page_id=25666)\n    * [Departamentul Cercetare și Inovare](https://cercetare.usm.md/)\n    * [Biblioteca USM](https://library.usm.md/)\n    * [Departamentul Relații Internaționale](https://usm.md/?page_id=257)\n    * [Centru de Resurse pentru Formare Continuă](https://usm.md/?page_id=228)\n    * [Secția Comunicare și Relații Publice](https://usm.md/?page_id=362)\n    * [Centrul de Ghidare în Carieră și Relații cu Piața Muncii](https://usm.md/?page_id=268)\n    * [Departamentul Resurse Umane](https://usm.md/?page_id=271)\n    * [Oficiul Achiziții Publice](https://usm.md/?page_id=385)\n    * [Departamentul Contabilitate](https://usm.md/?page_id=274)\n    * [Departamentul economico-financiar](https://usm.md/?page_id=752)\n    * [Organigrama](https://usm.md/wp-content/uploads/Organigrama_Noiembrie_Decembrie_Senat_28_11_2023.pdf)\n  * Resurse\n    * Resurse digitale\n      * [Revista de Istorie a Moldovei](https://usm.md/?page_id=15485)\n      * [VOX USM](https://usm.md/?page_id=1996)\n    * [Documente](https://usm.md/?page_id=203)\n      * [Acte normative nationale](https://usm.md/?page_id=206)\n      * [Acte normative USM](https://usm.md/?page_id=209)\n        * [Documente reglementare activitate instituţională](https://usm.md/?page_id=451)\n        * [Regulamente resurse umane](https://usm.md/?page_id=453)\n        * [Regulamente proces educational](https://usm.md/?page_id=455)\n        * [Regulamente managementul calității](https://usm.md/?page_id=457)\n        * [Regulamente activitate ştiinţifică](https://usm.md/?page_id=459)\n        * [Regulamente Relaţii Internaţionale](https://usm.md/?page_id=461)\n        * [Regulamente sistem informaţional](https://usm.md/?page_id=463)\n        * Planuri și rapoarte de activitate\n          * [Rapoarte de activitate](https://usm.md/?page_id=3237)\n          * [Situațiile financiare](https://usm.md/?page_id=1220)\n          * [Planuri achizitiilor publice](https://usm.md/?page_id=2203)\n          * [Raport privind realizarea contractelor încheiate în urma procedurilor de achiziție](https://usm.md/?page_id=1224)\n          * [Graficul şedinţelor departamentelor USM](https://usm.md/wp-content/uploads/Graficul_Sedintelor_Departamentelor-1.pdf)\n          * [Planuri și Rapoarte De Activitate](https://usm.md/?page_id=10032)\n        * [Arhiva](https://usm.md/?page_id=18165)\n    * [Moodle.USM](http://moodle.usm.md/)\n    * [Galeria](https://usm.md/?page_id=9106)\n    * [Materiale Grafice USM](https://usm.md/?page_id=20143)\n  * Proiecte\n    * Banca Mondială\n      * [Subproiecte](https://usm.md/?page_id=16155)\n      * [Transparență](https://usm.md/?page_id=26463)\n    * Erasmus+\n      * [DEFEP](https://defep.usm.md/)\n      * [EUDIPSEC](https://eudipsec.usm.md/)\n      * [QFORTE](https://usm.md/?page_id=29341)\n\n* [Facultăți](https://usm.md/)\n  * [Facultatea de Biologie și Geoștiințe](https://usm.md/?page_id=489)\n  * [Facultatea de Drept](https://usm.md/?page_id=495)\n  * [Facultatea de Chimie şi Tehnologie Chimică](https://usm.md/?page_id=492)\n  * [Facultatea de Fizica si Inginerie](https://usm.md/?page_id=498)\n  * [Facultatea de Istorie şi Filosofie](https://usm.md/?page_id=502)\n  * [Facultatea de Jurnalism şi Ştiinţe ale Comunicării](https://usm.md/?page_id=505)\n  * [Facultatea de Litere](https://usm.md/?page_id=511)\n  * [Facultatea de Matematică şi Informatică](https://usm.md/?page_id=515)\n  * [Facultatea Psihologie, Ştiinţe ale Educaţiei, Sociologie și Asistență Socială](https://usm.md/?page_id=518)\n  * [Facultatea de Relaţii Internaţionale, Ştiinţe Politice şi Administrative](https://usm.md/?page_id=522)\n  * [Facultatea de Ştiinţe Economice](https://usm.md/?page_id=528)\n  * [Institutul de Educație Fizică și Sport](https://usm.md/?page_id=31334)\n\n* [Studii](https://usm.md/?page_id=20)\n  * [Departamentul Studii](https://usm.md/?page_id=241)\n  * Calendar academic\n    * [Licență](https://usm.md/?page_id=731)\n    * [Master](https://usm.md/?page_id=734)\n    * [Doctorat](https://usm.md/?page_id=737)\n  * [Studii de Licență](https://usm.md/?page_id=216)\n  * [Studii de Masterat](https://usm.md/?page_id=219)\n  * [Studii de Doctorat](https://doctorat.usm.md/)\n  * [Catedra Militară](https://usm.md/?page_id=680)\n  * Burse\n    * [Burse finanțate din bugetul de stat](https://usm.md/?page_id=392)\n    * [Burse de performanță](https://usm.md/?page_id=396)\n  * [Recunoaștere și echivalare](https://usm.md/?page_id=26183)\n\n* [Formare Continuă](http://crfc.usm.md/)\n\n* [Studenti](https://usm.md/?page_id=34)\n  * Descoperă@USM\n    * [Concurs „Hai să #Celebrăm75USM!\"](https://usm.md/?page_id=3181)\n    * [Istoria USM](https://usm.md/wp-content/uploads/ISTORIA_USM.pdf)\n    * [Broșura USM (Ro)](https://usm.md/wp-content/uploads/Broshura_USM_2020_ro.pdf)\n    * [Broșura USM (En)](https://usm.md/wp-content/uploads/Broshura_USM_2020_en.pdf)\n    * [Oferta USM 2023](https://usm.md/wp-content/uploads/pliant_oferta-educațională-2021.pdf)\n    * [Ghid pentru studenții anului I și II](https://usm.md/wp-content/uploads/ghid-studenti-anul-I-SI-II-USM-web.pdf)\n    * [Program de motivare a candidaților](https://usm.md/?page_id=1112)\n  * [Campus](https://usm.md/?page_id=22279)\n  * [Asociații studențești](http://asusm.usm.md/)\n  * Actvitati extracurriculare\n    * [Arte Frumoase](https://usm.md/?page_id=668)\n    * [Sport](https://usm.md/?page_id=667)\n  * [Cariera](https://usm.md/?page_id=268)\n\n* [Contacte](https://usm.md/?page_id=1380)\n\n* Ro: ![Română](https://usm.md/wp-content/plugins/qtranslate-x/flags/ro.png)\n  * [![Română](https://usm.md/wp-content/plugins/qtranslate-x/flags/ro.png) Română](https://usm.md/?page_id=18&lang=ro \"Română\")\n  * [:uk: English](https://usm.md/?page_id=18&lang=en \"English\")\n\n* [:ru: Русский](https://usm.md/?page_id=18&lang=ru \"Русский\")\n\nDespre\n======\n\nPerformanța ta începe aici!  \n**Misiune**\n\nUniversitatea de Stat din Moldova este o instituţie de stat de învăţământ superior a cărei misiune este:\n\n* formarea cadrelor de înaltă calificare pentru economia naţională, capabile să activeze în condiţiile, în schimbare ale vieţii şi economiei de piaţă;\n\n* organizarea şi desfăşurarea de cercetări ştiinţifice fundamentale şi aplicative, orientate spre soluţionarea problemelor actuale socio-economice şi realizarea transferului tehnologic al rezultatelor cercetării ştiinţifice universitare.\n\nUniversitatea de Stat din Moldova îşi propune drept obiectiv:\n\n* Pregătirea universitară în diverse domenii şi formarea ansamblului de competenţe necesare integrării socio-profesionale.\n\n* Dezvoltarea potenţialului ştiinţific în domeniile de formare a specialiştilor; dezvoltarea şi promovarea ideilor, teoriilor, concepţiilor ştiinţifice prin activitatea de cercetare desfăşurată de personalul didactic şi studenţi.\n\n* Promovarea valorilor/reperelor axiologice general-umane şi naţionale; formarea profilului etic şi civic al tineretului studios.\n\n* Asigurarea calităţii învăţământului superior şi a serviciilor educaţionale prestate.\n\n* Participarea la elaborarea politicilor şi strategiilor educaţionale , dar şi la implementarea acestora în învăţământul superior.\n\n* Integrarea în spaţiul european al învăţământului superior şi de cercetare.\n\n**Identitate**\n\nStema şi drapelul USM sunt unele din cele mai importante valori ale Universități de Stat din Moldova care reprezintă identitatea distinctă, care corespunde fundamentelor axiologice ce stau la baza activităţii USM. În acest context au fost elaborate stema şi drapelul Universității.\n\n#### Stema USM\n\n![](http://usm.md/wp-content/uploads/2010/12/stema.jpg \"stema\")\n\nCuloarea verde a câmpului scutului este culoarea distinctivă a Universităţii de Stat din Moldova (*Decizia Senatului USM din 29.06.2004, proces verbal nr. 13*). În heraldică verdele este culoarea destinului şi speranţei, a naturii şi sănătăţii, a prospeţimii şi tinereţei, a frumuseţei şi bucuriei. Capul de bour, având între coarne o stea cu cinci raze şi flancat la dreapta de o roză (soare) la stânga -- de semilună, reperzintă stema istorică a Ţării Moldovei. Acest blazon vechi încorporat în stema USM marchează trei ipostaze ale instituţiei:\n\n* USM -- instituţie universitară ***din Moldova*** [Source]{https://usm.md/?page_id=18)", "* Departamentul Teoria și Practica Jurnalismului\n\n* Departamentul Comunicare și Teoria Informării\n\n**LABORATOARE:**\n\n* Laboratorul de televiziune Unda Liberă -- [www.undalibera.md](https://undalibera.md/)\n\n* Laboratorul radio Unda Liberă Terrabit -- [www.undalibera.md](https://undalibera.md/category/emisiuni/)\n\n* Laboratorul Jurnalism online Crossmedia\n\n**Programe de studii la ciclul Licență:**  \n**0321.2 Comunicare și relații publice (180 credite, studii cu frecvență)** **[2023-2024](https://usm.md/wp-content/uploads/0321.2-Comunicare-si-relatii-publice-1.pdf) [2024-2025](http://admitere.usm.md/wp-content/uploads/0321_2-Comunicare-si-relatii-publice.pdf)**\n\n**0321.1 Jurnalism şi procese mediatice (180 credite, studii cu frecvență, cu frecvență redusă)** **[2023-2024](https://usm.md/wp-content/uploads/0321.1-Jurnalism-si-procese-mediatice-1.pdf) [2024-2025](https://usm.md/wp-content/uploads/Jurnalism-si-procese-mediatice_2024.pdf)**\n\n**0211.6 Producție multimedia (180 credite, studii cu frecvență)** **[2023-2024](https://usm.md/wp-content/uploads/0211.6-Productie-multimedia-4.pdf) [2024-2025](https://usm.md/wp-content/uploads/Productie-multimedia_2024.pdf)**\n\n* **0322.1 Biblioteconomie și știința informării (180 credite, studii cu frecvență, cu frecvență redusă)**  \n**Programe de studii la ciclul Master:**\n\n**Producție video și media promoting (120 credite, studii cu frecvență)** **[2023-2024](https://usm.md/wp-content/uploads/Productie-video-si-media-promoting-2.pdf) [2024-2025](https://usm.md/wp-content/uploads/Planul-PVMP.pdf)**\n\n**Relații publice și publicitate (120 credite, studii cu frecvență)** **[2023-2024](https://usm.md/wp-content/uploads/Relatii-publice-si-publicitate-2.pdf) [2024-2025](http://admitere.usm.md/wp-content/uploads/Relatii-publice-si-publicitate_120-cr_MP_2024_cu-frecventa.pdf)**\n\nMS -- master științific MP -- master profesional\n\n**CONTACT** **E**\n\n**Str. Alexei Mateevici, Nr. 60, bloc central, MD-2009, Chişinău**\n\n**Tel:** **+373 22 244 045****, +373 67 436 436, +373 67 560 157**\n\n**Web: [jurnalism.usm.md](http://jurnalism.usm.md/)**\n\n###### Adresa\n\n###### Facultăţi\n\n* [Facultatea de Biologie și Geoștiințe](https://usm.md/?page_id=489)\n\n* [Facultatea de Chimie şi Tehnologie Chimică](https://usm.md/?page_id=492)\n\n* [Facultatea de Drept](https://usm.md/?page_id=495)\n\n* [Facultatea de Jurnalism şi Ştiinţe ale Comunicării](https://usm.md/?page_id=505)\n\n* [Facultatea de Fizica si Inginerie](https://usm.md/?page_id=498)\n\n* [Facultatea de Istorie şi Filosofie](https://usm.md/?page_id=502)\n\n* [Facultatea de Matematică şi Informatică](https://usm.md/?page_id=515)\n\n* [Facultatea de Litere](https://usm.md/?page_id=511)\n\n* [Facultatea de Științe Economice](https://usm.md/?page_id=528)\n\n* [Facultatea Psihologie, Ştiinţe ale Educaţiei, Sociologie și Asistență Socială](https://usm.md/?page_id=518)\n\n* [Facultatea de Relaţii Internaţionale, Ştiinţe Politice şi Administrative](https://usm.md/?page_id=522)\n\n###### Contacte\n\n* +373 22 244 810\n\n* 9:00 - 17:00\n\n* [Universitatea de Stat din Moldova str. Alexei Mateevici 60, MD-2009](https://www.google.com/maps/place/Universitatea+de+Stat+din+Moldova/@47.018939,28.824491,18z/data=!4m5!3m4!1s0x0:0xd8e8b74ac8c3ef7b!8m2!3d47.0192025!4d28.8230857?hl=ro)\n\n* rector@usm.md  \nToleranță zero corupției\n\n* integritate@usm.md  \n[Facebook](https://www.facebook.com/UniversitateaDeStatDinMoldova/) [Instagram](https://www.instagram.com/accounts/login/?next=/usm.md/) [Youtube](https://www.youtube.com/channel/UC3oFsXde0eZRaAqeX_6iBcg/videos)  \n**Universitatea de Stat din Moldova 2025 © All Rights Reserved\n​**  \nOficiul Programare Web al USM ®  \n×  \n×  \n×  \n×  \n×  \n×  \n×  \n×  \n×  \n×  \n×  \nUniversitatea de Stat din Moldova folosește module cookie strict necesare și alte tehnologii similare pentru a opera acest website și pentru a oferi utilizatorilor o experiență personalizată. Pe lângă modulele cookie strict necesare, Universitatea de Stat din Moldova folosește module cookie opționale pentru a îmbunătăți și personaliza experiența utilizatorilor, pentru a analiza performanța website-ului.Ok [Source]{https://usm.md/?page_id=505)" ]
}