{
  "question" : "Ce facultati sunt in USM",
  "answer" : "Universitatea de Stat din Moldova (USM) are următoarele facultăți:\n\n1. [Facultatea de Biologie și Geoștiințe](https://usm.md/?page_id=489)\n2. [Facultatea de Chimie şi Tehnologie Chimică](https://usm.md/?page_id=492)\n3. [Facultatea de Drept](https://usm.md/?page_id=495)\n4. [Facultatea de Jurnalism şi Ştiinţe ale Comunicării](https://usm.md/?page_id=505)\n5. [Facultatea de Fizica si Inginerie](https://usm.md/?page_id=498)\n6. [Facultatea de Istorie şi Filosofie](https://usm.md/?page_id=502)\n7. [Facultatea de Matematică şi Informatică](https://usm.md/?page_id=515)\n8. [Facultatea de Litere](https://usm.md/?page_id=511)\n9. [Facultatea de Științe Economice](https://usm.md/?page_id=528)\n10. [Facultatea Psihologie, Ştiinţe ale Educaţiei, Sociologie și Asistență Socială](https://usm.md/?page_id=518)\n11. [Facultatea de Relaţii Internaţionale, Ştiinţe Politice şi Administrative](https://usm.md/?page_id=522)\n\nDacă ai nevoie de informații suplimentare despre o facultate anume, te rog să îmi spui!",
  "contexts" : [ "* adeverința eliberată de organul teritorial de tutelă și curatelă, pentru copiii orfani și copiii rămași fără ocrotire părintească;\n\n* certificatele medicale corespunzătoare, care atestă gradul de dizabilitate al candidatului sau al părinților acestuia;\n\n* certificatul care confirmă că unul din părinții candidatului a participat la acțiunile militare pentru apărarea integrității și independenței Republicii Moldova sau în războiul din Afganistan ori la lichidarea consecințelor avariei de la Cernobîl, eliberat de organele abilitate; adeverință care confirmă participarea candidatului la operațiunile militare post-conflict cu caracter umanitar în Irak;\n\n* certificatul despre componența familiei și copiile certificatelor de naștere ale fraților/surorilor (pentru candidații care provin din familii cu trei și mai mulți copii);\n\n* confirmarea apartenenței la familii de romi;\n\n* recomandarea organului local de specialitate în domeniul învățământului sau adeverința de la locul de muncă al părinților -- cadre didactice pentru înscrierea la concursul de admitere la specialitățile din domeniul general de studiu *Ştiinţe ale educaţiei;*\n\n* după caz certificatul medical (pentru programele care necesită capacități/rezistență fizică)\n\n###### Adresa\n\n###### Facultăţi\n\n* [Facultatea de Biologie si Pedologie](https://usm.md/?page_id=489)\n\n* [Facultatea de Chimie şi Tehnologie Chimică](https://usm.md/?page_id=492)\n\n* [Facultatea de Drept](https://usm.md/?page_id=495)\n\n* [Facultatea de Jurnalism şi Ştiinţe ale Comunicării](https://usm.md/?page_id=505)\n\n* [Facultatea de Fizica si Inginerie](https://usm.md/?page_id=498)\n\n* [Facultatea de Istorie şi Filosofie](https://usm.md/?page_id=502)\n\n* [Facultatea de Matematică şi Informatică](https://usm.md/?page_id=515)\n\n* [Facultatea de Litere](https://usm.md/?page_id=511)\n\n* [Facultatea de Științe Economice](https://usm.md/?page_id=528)\n\n* [Facultatea Psihologie, Ştiinţe ale Educaţiei, Sociologie și Asistență Socială](https://usm.md/?page_id=518)\n\n* [Facultatea de Relaţii Internaţionale, Ştiinţe Politice şi Administrative](https://usm.md/?page_id=522)\n\n###### Contacte\n\n* +373 22 244 810\n\n* 9:00 - 17:00\n\n* [Universitatea de Stat din Moldova str. Alexei Mateevici 60, MD-2009](https://www.google.com/maps/place/Universitatea+de+Stat+din+Moldova/@47.018939,28.824491,18z/data=!4m5!3m4!1s0x0:0xd8e8b74ac8c3ef7b!8m2!3d47.0192025!4d28.8230857?hl=ro)\n\n* rector@usm.md  \nToleranță zero corupției\n\n* integritate@usm.md\n\n* [old.usm.md](https://old.usm.md)  \n[Facebook](https://www.facebook.com/UniversitateaDeStatDinMoldova/) [Instagram](https://www.instagram.com/accounts/login/?next=/usm.md/) [Youtube](https://www.youtube.com/channel/UC3oFsXde0eZRaAqeX_6iBcg/videos)  \n**Universitatea de Stat din Moldova 2025 © All Rights Reserved\n​**  \nSecție Programare Web al USM ®  \nUniversitatea de Stat din Moldova folosește module cookie strict necesare și alte tehnologii similare pentru a opera acest website și pentru a oferi utilizatorilor o experiență personalizată. Pe lângă modulele cookie strict necesare, Universitatea de Stat din Moldova folosește module cookie opționale pentru a îmbunătăți și personaliza experiența utilizatorilor, pentru a analiza performanța website-ului.Ok [Source]{https://admitere.usm.md/?page_id=562)", "* USM -- instituţie universitară ***de stat***\n\n* USM -- instituţie universitară ***de nivel naţional.***\n\nAl doilea element al stemei se compune din 3 cărţi care însoţesc blazonul moldovenesc. Cartea este un simbol universal al ştiinţei şi înţelepciunii şi însemnul tradiţional al majorităţii stemelor instituţiilor de învăţământ. În heraldică cartea închisă este un simbol vechi, tradiţional cu o vădită aluzie la Biblie. Prezenţa a trei cărţi pe stemă simbolizează pregătirea la USM a specialiștilor în cele trei domenii: ştiinţe exacte, ştiinţe ale naturii şi ştiinţe umanistice. Scutul este timbrat de o tocă -- unul din însemne ale funcţiei de profesor. Deviza „VITAE DISCIMUS\" (pentru viaţă învăţăm) exprimă crezul corpului profesoral şi al absolvenţilor USM.\n\n#### Drapelul USM\n\nDrapelul presupune un fundal alb, în centrul căruia este amplasată stema Universităţii. Albul pânzei drapelului este albul filei de hârtie pe care se fixează cunoştinţele pentru a fi perpetuate. În acelaşi timp albul, sau argintul heraldic semnifică curăţenia, inocenţa şi înţelepciunea.\n\n![](http://usm.md/wp-content/uploads/Drapel-USM.jpg \"Drapel USM\")\n\n[**Descrierea heraldică detaliată a stemei şi drapelului USM**](https://usm.md/wp-content/uploads/Nota-explicativa-stemadrapel-USM1.pdf)\n\n**Istoric**\n\nUniversitatea de Stat din Moldova (USM) este prima instituție de învățământ superior cu statut de universitate înființată în Republica Moldova.\n\nFondată la 1 octombrie 1946, cu denumirea inițială de Universitatea de Stat din Chișinău, de-a lungul timpului și-a format o reputație impecabilă la nivel național și internațional. Crearea ei a constituit un pilon de bază pentru dezvoltarea și consolidarea învățământului superior din țară.\n\n![](https://usm.md/wp-content/uploads/Bloc-2.jpg)Inițial, au fost deschise 5 facultăți: Istorie și Filologie, Fizică și Matematică, Biologie, Chimie, Geologie și Pedologie. În primul an (1946-1947), la cele 12 catedre au fost înmatriculați 320 de studenți, procesul educațional fiind ghidat de 35 de cadre didactice. În 1958, la USM a fost inaugurată secția învățământ cu frecvență redusă, care, la unele facultăți, continuă până în prezent. O oportunitate pentru pregătirea tinerilor specialiști a reprezentat, mai mulți ani la rând (1958-1981), secția serală.\n\nÎn scurt timp, USM devine lider recunoscut al sistemului național de învățământ superior din țară, răspunzând la cerințele societății prin diversificarea programelor oferite și instituirea noilor subdiviziuni, catedre și facultăți, inclusiv: Facultatea de Economie (1953, 2002), Facultatea de Drept (1959), Facultatea de Inginerie și Tehnologie (1959), Facultatea de Limbi Străine (1964), Facultatea de Formare pentru Studenții Străini (1967), Școala de Jurnalism (1980), Facultatea de Filosofie și Psihologie (1994), Facultatea de Științe Politice (1995), Centrul de Calcul (1973). Între anii 1946-1988, USM a fost parte componentă a sistemului universitar sovietic, gestionarea ei fiind dirijată de Moscova, capitala ex-URSS. Odată cu destrămarea Uniunii Sovietice, au fost introduse schimbări esențiale în sistemul național de învățământ. Perioada 1988-1996, pentru universitate, se caracterizează prin perfecționarea formelor tradiționale de predare-învățare și aplicarea noilor tehnologii. La 19 ianuarie 1990, instituția primește denumirea ei actuală -- Universitatea de Stat din Moldova.\n\nPe parcursul a mai mult de 70 de ani, USM a devenit un centru universitar de elită, atât la nivel național, cât și internațional. Circa 120 de mii de absolvenți ai acestei universități activează în diverse domenii, precum: economie, educație, cultură, justiție, politică etc. O mare parte din elita intelectuală a Republicii Moldova s-a format la USM.\n\nUniversitatea de Stat din Moldova este prima instituție de învățământ superior acreditată la nivel național (2001). Procesul educațional este realizat de o comunitate academică de prestigiu, care asigură desfășurarea acestuia la nivelul cerințelor pieței muncii, raliindu-se la paradigmele moderne de instruire prin aderarea, în mai 2005, la Procesul de la Bologna.\n\nÎn 2011, la 65 de ani de la fondare, în semn de înaltă apreciere a meritelor deosebite în dezvoltarea învățământului universitar național și în promovarea reformelor în domeniu, pentru contribuția substanțială la pregătirea specialiștilor de înaltă calificare și a tinerilor savanți, Universitatea de Stat din Moldova a fost decorată cu cea mai înaltă distincție de stat -- „Ordinul Republicii\".\n\n![](https://usm.md/wp-content/uploads/USM_Block_1-1-scaled.jpg)Începând cu anul 2013, potrivit rezultatelor clasamentului mondial Ranking Web of Universities, elaborat de Consiliul Superior de Investigații Științifice din cadrul Ministerului Științei și Inovării al Spaniei, Universitatea de Stat din Moldova se plasează pe primul loc în topul celor mai prestigioase universități din țară, fapt ce demonstrează că USM este o instituție de învățământ superior competitivă, iar absolvenții ei se bucură de un spectru larg de oportunități de angajare.\n\nUniversitatea de Stat din Moldova reprezintă spațiul în care este promovată libertatea academică. Aici au fost susținute în permanență pluralismul de opinii, creativitatea, precum și tendința de a asigura calitatea pregătirii specialiștilor de înaltă calificare, transformându-se într-un laborator al democrației cu idei generate în baza unui dialog constructiv între studenți și corpul profesoral.\n\nUSM beneficiază de o bază tehnico-materială modernă, ce corespunde standardelor internaționale, asigurând activitatea personalului academic și a studenților prin crearea unui mediu propice pentru procesul educațional și cel de cercetare. Universitatea pune la dispoziția studenților 6 blocuri de învățământ, 10 cămine, o bibliotecă universitară dotată cu săli de lectură, un Palat al Sporturilor, o Casă de Cultură, cantine, baze de practică și de agrement.\n\nÎn prezent, Universitatea de Stat din Moldova este una dintre cele mai importante instituții de învățământ superior din țară. USM dispune de un contingent de cca 11 000 de studenți, care își fac studiile la peste o sută de programe de studii de licență și master, în cadrul a 11 facultăți și 4 școli doctorale.\n\n![](https://usm.md/wp-content/uploads/Bloc-2_new-1024x539.jpg)Universitatea de Stat din Moldova este recunoscută în arealul învăţământului universitar internaţional şi este integrată într-o puternică reţea de cooperare internaţională: cca 110 de acorduri de colaborare bilaterală cu instituţii de învăţământ superior din 28 de ţări. Astăzi Universitatea de Stat este membră a Asociaţiei Internaţionale a Universităţilor (IAU), Agenţiei Universitare a Francofoniei(AUF) și a Asociaţiei Euroasiatice a Universităţilor (AEU).\n\nÎn anul 2011, USM a devenit membră a Consorțiului Universităților din Republica Moldova -- România -- Ucraina (CUMRU), iar din 23 noiembrie 2018 este membră asociată a Consorțiului ***Universitaria***, din care fac parte Academia de Studii Economice din București, Universitatea din București, Universitatea Babeș-Bolyai din Cluj-Napoca, Universitatea \"Alexandru Ioan Cuza\" din Iași și Universitatea de Vest din Timișoara.\n\n###### Adresa\n\n###### Facultăţi\n\n* [Facultatea de Biologie și Geoștiințe](https://usm.md/?page_id=489)\n\n* [Facultatea de Chimie şi Tehnologie Chimică](https://usm.md/?page_id=492)\n\n* [Facultatea de Drept](https://usm.md/?page_id=495)\n\n* [Facultatea de Jurnalism şi Ştiinţe ale Comunicării](https://usm.md/?page_id=505)\n\n* [Facultatea de Fizica si Inginerie](https://usm.md/?page_id=498)\n\n* [Facultatea de Istorie şi Filosofie](https://usm.md/?page_id=502)\n\n* [Facultatea de Matematică şi Informatică](https://usm.md/?page_id=515)\n\n* [Facultatea de Litere](https://usm.md/?page_id=511)\n\n* [Facultatea de Științe Economice](https://usm.md/?page_id=528)\n\n* [Facultatea Psihologie, Ştiinţe ale Educaţiei, Sociologie și Asistență Socială](https://usm.md/?page_id=518)\n\n* [Facultatea de Relaţii Internaţionale, Ştiinţe Politice şi Administrative](https://usm.md/?page_id=522)\n\n###### Contacte\n\n* +373 22 244 810\n\n* 9:00 - 17:00\n\n* [Universitatea de Stat din Moldova str. Alexei Mateevici 60, MD-2009](https://www.google.com/maps/place/Universitatea+de+Stat+din+Moldova/@47.018939,28.824491,18z/data=!4m5!3m4!1s0x0:0xd8e8b74ac8c3ef7b!8m2!3d47.0192025!4d28.8230857?hl=ro)\n\n* rector@usm.md  \nToleranță zero corupției\n\n* integritate@usm.md  \n[Facebook](https://www.facebook.com/UniversitateaDeStatDinMoldova/) [Instagram](https://www.instagram.com/accounts/login/?next=/usm.md/) [Youtube](https://www.youtube.com/channel/UC3oFsXde0eZRaAqeX_6iBcg/videos)  \n**Universitatea de Stat din Moldova 2025 © All Rights Reserved\n​**  \nOficiul Programare Web al USM ®  \n×  \n×  \n×  \n×  \n×  \n×  \n×  \n×  \n×  \n×  \n×  \nUniversitatea de Stat din Moldova folosește module cookie strict necesare și alte tehnologii similare pentru a opera acest website și pentru a oferi utilizatorilor o experiență personalizată. Pe lângă modulele cookie strict necesare, Universitatea de Stat din Moldova folosește module cookie opționale pentru a îmbunătăți și personaliza experiența utilizatorilor, pentru a analiza performanța website-ului.Ok [Source]{https://usm.md/?page_id=18)", "* *[**Facultatea de Fizica şi Inginerie**](http://admitere.usm.md/?page_id=512)*\n\n* *[**Facultatea de Istorie și Filozofie**](http://admitere.usm.md/?page_id=515)*\n\n* *[**Facultatea de Jurnalism și Științe ale Comunicării**](http://admitere.usm.md/?page_id=520)*\n\n* *[**Facultatea de Litere**](http://admitere.usm.md/?page_id=524)*\n\n* *[**Facultatea de Matematică şi Informatică**](http://admitere.usm.md/?page_id=529)*\n\n* *[**Facultatea de Psihologie, Ştiinţe ale Educaţiei, Sociologie şi Asistenţă Socială**](http://admitere.usm.md/?page_id=540)*\n\n* *[**Facultatea Relaţii Internaţionale, Ştiinţe Politice şi Administrative**](http://admitere.usm.md/?page_id=545)*\n\n* *[**Facultatea de Știinte Economice**](http://admitere.usm.md/?page_id=550)*\n\n###### Adresa\n\n###### Facultăţi\n\n* [Facultatea de Biologie și Geoștiințe](https://usm.md/?page_id=489)\n\n* [Facultatea de Chimie şi Tehnologie Chimică](https://usm.md/?page_id=492)\n\n* [Facultatea de Drept](https://usm.md/?page_id=495)\n\n* [Facultatea de Jurnalism şi Ştiinţe ale Comunicării](https://usm.md/?page_id=505)\n\n* [Facultatea de Fizica si Inginerie](https://usm.md/?page_id=498)\n\n* [Facultatea de Istorie şi Filosofie](https://usm.md/?page_id=502)\n\n* [Facultatea de Matematică şi Informatică](https://usm.md/?page_id=515)\n\n* [Facultatea de Litere](https://usm.md/?page_id=511)\n\n* [Facultatea de Științe Economice](https://usm.md/?page_id=528)\n\n* [Facultatea Psihologie, Ştiinţe ale Educaţiei, Sociologie și Asistență Socială](https://usm.md/?page_id=518)\n\n* [Facultatea de Relaţii Internaţionale, Ştiinţe Politice şi Administrative](https://usm.md/?page_id=522)\n\n###### Contacte\n\n* +373 22 244 810\n\n* 9:00 - 17:00\n\n* [Universitatea de Stat din Moldova str. Alexei Mateevici 60, MD-2009](https://www.google.com/maps/place/Universitatea+de+Stat+din+Moldova/@47.018939,28.824491,18z/data=!4m5!3m4!1s0x0:0xd8e8b74ac8c3ef7b!8m2!3d47.0192025!4d28.8230857?hl=ro)\n\n* rector@usm.md  \nToleranță zero corupției\n\n* integritate@usm.md  \n[Facebook](https://www.facebook.com/UniversitateaDeStatDinMoldova/) [Instagram](https://www.instagram.com/accounts/login/?next=/usm.md/) [Youtube](https://www.youtube.com/channel/UC3oFsXde0eZRaAqeX_6iBcg/videos)  \n**Universitatea de Stat din Moldova 2025 © All Rights Reserved\n​**  \nOficiul Programare Web al USM ®  \n×  \n×  \n×  \n×  \n×  \n×  \n×  \n×  \n×  \n×  \n×  \nUniversitatea de Stat din Moldova folosește module cookie strict necesare și alte tehnologii similare pentru a opera acest website și pentru a oferi utilizatorilor o experiență personalizată. Pe lângă modulele cookie strict necesare, Universitatea de Stat din Moldova folosește module cookie opționale pentru a îmbunătăți și personaliza experiența utilizatorilor, pentru a analiza performanța website-ului.Ok [Source]{https://usm.md/?page_id=219)", "* *[**Facultatea de Fizica şi Inginerie**](http://admitere.usm.md/?page_id=437)*\n\n* *[**Facultatea de Istorie și Filozofie**](http://admitere.usm.md/?page_id=440)*\n\n* *[**Facultatea de Jurnalism și Științe ale Comunicării**](http://admitere.usm.md/?page_id=443)*\n\n* *[**Facultatea de Litere**](http://admitere.usm.md/?page_id=446)*\n\n* *[**Facultatea de Matematică şi Informatică**](http://admitere.usm.md/?page_id=450)*\n\n* *[**Facultatea de Psihologie, Ştiinţe ale Educaţiei, Sociologie şi Asistenţă Socială**](http://admitere.usm.md/?page_id=454)*\n\n* *[**Facultatea Relaţii Internaţionale, Ştiinţe Politice şi Administrative**](http://admitere.usm.md/?page_id=458)*\n\n* *[**Facultatea de Știinte Economice**](http://admitere.usm.md/?page_id=461)*\n\n###### Adresa\n\n###### Facultăţi\n\n* [Facultatea de Biologie și Geoștiințe](https://usm.md/?page_id=489)\n\n* [Facultatea de Chimie şi Tehnologie Chimică](https://usm.md/?page_id=492)\n\n* [Facultatea de Drept](https://usm.md/?page_id=495)\n\n* [Facultatea de Jurnalism şi Ştiinţe ale Comunicării](https://usm.md/?page_id=505)\n\n* [Facultatea de Fizica si Inginerie](https://usm.md/?page_id=498)\n\n* [Facultatea de Istorie şi Filosofie](https://usm.md/?page_id=502)\n\n* [Facultatea de Matematică şi Informatică](https://usm.md/?page_id=515)\n\n* [Facultatea de Litere](https://usm.md/?page_id=511)\n\n* [Facultatea de Științe Economice](https://usm.md/?page_id=528)\n\n* [Facultatea Psihologie, Ştiinţe ale Educaţiei, Sociologie și Asistență Socială](https://usm.md/?page_id=518)\n\n* [Facultatea de Relaţii Internaţionale, Ştiinţe Politice şi Administrative](https://usm.md/?page_id=522)\n\n###### Contacte\n\n* +373 22 244 810\n\n* 9:00 - 17:00\n\n* [Universitatea de Stat din Moldova str. Alexei Mateevici 60, MD-2009](https://www.google.com/maps/place/Universitatea+de+Stat+din+Moldova/@47.018939,28.824491,18z/data=!4m5!3m4!1s0x0:0xd8e8b74ac8c3ef7b!8m2!3d47.0192025!4d28.8230857?hl=ro)\n\n* rector@usm.md  \nToleranță zero corupției\n\n* integritate@usm.md  \n[Facebook](https://www.facebook.com/UniversitateaDeStatDinMoldova/) [Instagram](https://www.instagram.com/accounts/login/?next=/usm.md/) [Youtube](https://www.youtube.com/channel/UC3oFsXde0eZRaAqeX_6iBcg/videos)  \n**Universitatea de Stat din Moldova 2025 © All Rights Reserved\n​**  \nOficiul Programare Web al USM ®  \n×  \n×  \n×  \n×  \n×  \n×  \n×  \n×  \n×  \n×  \n×  \nUniversitatea de Stat din Moldova folosește module cookie strict necesare și alte tehnologii similare pentru a opera acest website și pentru a oferi utilizatorilor o experiență personalizată. Pe lângă modulele cookie strict necesare, Universitatea de Stat din Moldova folosește module cookie opționale pentru a îmbunătăți și personaliza experiența utilizatorilor, pentru a analiza performanța website-ului.Ok [Source]{https://usm.md/?page_id=216)" ]
}