{
  "question" : "Care sunt taxe la facultatea Matematica si Informatica Ciclul I? Tabel",
  "answer" : "Iată taxele pentru facultatea Matematică și Informatică, Ciclul I (Licență):\n\n| Nr. crt. | Cod specialitate |      Facultatea, specialitatea      | Forma de învățământ |   Taxa (lei)    |\n|----------|------------------|-------------------------------------|---------------------|-----------------|\n| 1        | 0114.1           | Matematica (științe ale educației)  | zi                  | 7.800           |\n| 2        | 0114.2           | Informatică (științe ale educației) | zi, fr              | 7.800 / 6.000   |\n| 3        | 0211.7           | Designul jocurilor                  | zi                  | 14.000          |\n| 4        | 0541.1           | Matematică                          | zi                  | 7.800           |\n| 5        | 0541.2           | Matematici aplicate                 | zi                  | 7.800           |\n| 6        | 0613.4           | Informatică                         | zi                  | 13.000          |\n| 7        | 0613.5           | Informatică aplicată                | zi, fr              | 13.000 / 10.000 |\n\nDacă ai nevoie de mai multe informații sau detalii, nu ezita să întrebi!",
  "contexts" : [ "Taxe Admitere 2024 - Master\n\nTaxe de studii - Admiterea 2024 (Master)\n========================================\n\nBiologie și Geoștiințe\n----------------------\n\n| Nr. | Cod domeniu |         Program de studiu          | Forma | Taxa (lei) |\n|-----|-------------|------------------------------------|-------|------------|\n| 1   | 081         | Design de landşaft şi spaţii verzi | zi    | 7.500      |\n| 2   | 052         | Managementul mediului              | zi    | 7.500      |\n| 3   | 051         | Biologie moleculară                | zi    | 7.500      |\n| 4   | 051         | Științe biologice aplicate         | zi    | 7.500      |\n\nChimie și Tehnologie Chimică\n----------------------------\n\n| Nr. | Cod domeniu |                               Program de studiu                               | Forma | Taxa (lei) |\n|-----|-------------|-------------------------------------------------------------------------------|-------|------------|\n| 1   | 071         | Tehnologii moderne în industria cosmetică, farmaceutică și protecția mediului | zi    | 7.700      |\n| 2   | 050         | Materiale avansate în chimie şi biofarmaceutică                               | zi    | 7.700      |\n\nDrept\n-----\n\n| Nr. | Cod domeniu |                  Program de studiu                   | Forma  |   Taxa (lei)    |\n|-----|-------------|------------------------------------------------------|--------|-----------------|\n| 1   | 042         | Proces penal şi criminalistică                       | zi     | 15.000          |\n| 2   | 042         | Proceduri judiciare civile                           | zi     | 15.000          |\n| 3   | 042         | Drept penal                                          | zi     | 15.000          |\n| 4   | 042         | Drept civil                                          | zi     | 15.000          |\n| 5   | 042         | Drept internaţional                                  | zi     | 15.000          |\n| 6   | 042         | Dreptul relaţiilor de muncă şi comerciale în afaceri | zi     | 15.000          |\n| 7   | 042         | Drept public și guvernare electronică                | zi     | 15.000          |\n| 8   | 042         | Drept fiscal și vamal                                | zi     | 15.000          |\n| 9   | 042         | Drept fiscal și activitate vamală                    | zi     | 15.000          |\n| 10  | 042         | Drepturile omului                                    | zi     | 15.000          |\n| 11  | 042         | Științe penale aplicative                            | zi     | 15.000          |\n| 12  | 040         | Drept public                                         | zi, fr | 15.000 / 13.000 |\n| 13  | 042         | Anticorupție                                         | zi, fr | 15.000 / 13.000 |\n\nFizică și Inginerie\n-------------------\n\n| Nr. | Cod domeniu |           Program de studiu           | Forma | Taxa (lei) |\n|-----|-------------|---------------------------------------|-------|------------|\n| 1   | 053         | Fizică                                | zi    | 7.700      |\n| 2   | 061         | Tehnologii informaţionale în modelare | zi    | 12.000     |\n\nIstorie și Filosofie\n--------------------\n\n| Nr. | Cod domeniu |               Program de studiu                | Forma | Taxa (lei) |\n|-----|-------------|------------------------------------------------|-------|------------|\n| 1   | 022         | Managementul patrimoniului cultural            | zi    | 7.900      |\n| 2   | 022         | Istoria și cultura religiilor                  | zi    | 7.900      |\n| 3   | 022         | Stat și societate din perspectivă istorică     | zi    | 7.900      |\n| 4   | 022         | Filosofie, antropologie și management cultural | zi    | 7.900      |\n| 5   | 022         | Filosofii contemporane                         | zi    | 7.900      |\n\nJurnalism și Științe ale Comunicării\n------------------------------------\n\n| Nr. | Cod domeniu |         Program de studiu          | Forma | Taxa (lei) |\n|-----|-------------|------------------------------------|-------|------------|\n| 1   | 032         | Relaţii publice şi publicitate     | zi    | 10.000     |\n| 2   | 032         | Producție video și media promoting | zi    | 9.000      | [Source]{https://admitere.usm.md/?page_id=3741)", "Litere\n------\n\n| Nr. | Cod domeniu |                           Program de studiu                            | Forma | Taxa (lei) |\n|-----|-------------|------------------------------------------------------------------------|-------|------------|\n| 1   | 023         | Traducere și interpretare de conferințe                                | zi    | 10.000     |\n| 2   | 023         | Comunicare multilingvă, management intercultural și limbaje de afaceri | zi    | 9.000      |\n| 3   | 023         | Studii de filologie română și strategii educaționale                   | zi    | 8.000      |\n| 4   | 023         | Limba și literatura rusă                                               | zi    | 8.000      |\n\nPsihologie și Științe ale Educației, Sociologie și Asistență Socială\n--------------------------------------------------------------------\n\n| Nr. | Cod domeniu |              Program de studiu              | Forma | Taxa (lei) |\n|-----|-------------|---------------------------------------------|-------|------------|\n| 1   | 031         | Psihologie clinică                          | zi    | 14.000     |\n| 2   | 031         | Psihologia muncii și organizațională        | zi    | 9.000      |\n| 3   | 031         | Psihologie judiciară                        | zi    | 9.000      |\n| 4   | 011         | Managementul educațional                    | zi    | 8.000      |\n| 5   | 011         | Consilierea pentru probleme de familie      | zi    | 8.000      |\n| 6   | 011         | Formarea formatorilor                       | zi    | 8.000      |\n| 7   | 011         | Managementul serviciilor sociale            | zi    | 8.000      |\n| 8   | 031         | Sondaje de opinie, marketing și publicitate | zi    | 8.000      |\n\nMatematică și Informatică\n-------------------------\n\n| Nr. | Cod domeniu |                           Program de studiu                            | Forma | Taxa (lei) |\n|-----|-------------|------------------------------------------------------------------------|-------|------------|\n| 1   | 054         | Structuri matematice și metode de soluționare a problemelor aplicative | zi    | 7.700      |\n| 2   | 061         | Informatică aplicată                                                   | zi    | 12.000     |\n| 3   | 061         | Inteligența artificială și știința datelor                             | zi    | 12.000     |\n| 4   | 011         | Performanță matematică și STEAM                                        | zi    | 8.000      |\n\nRelații Internaționale, Științe Politice și Administrative\n----------------------------------------------------------\n\n| Nr. | Cod domeniu |       Program de studiu        | Forma  |   Taxa (lei)    |\n|-----|-------------|--------------------------------|--------|-----------------|\n| 1   | 031         | Studii de Securitate Națională | zi     | 11.000          |\n| 2   | 040         | Politici și servicii publice   | zi     | 9.000           |\n| 3   | 031         | Studii diplomatice             | zi     | 10.000          |\n| 4   | 031         | Studii europene                | zi     | 10.000          |\n| 5   | 031         | Relații internaționale         | zi, fr | 11.000 / 10.000 |\n| 6   | 040         | Administrare publică           | zi, fr | 10.000 / 9.000  |\n\nȘtiințe Economice\n-----------------\n\n| Nr. | Cod domeniu |                 Program de studiu                 | Forma  |   Taxa (lei)    |\n|-----|-------------|---------------------------------------------------|--------|-----------------|\n| 1   | 041         | Administrarea afacerilor                          | zi     | 12.000          |\n| 2   | 041         | Administrare bancară                              | zi     | 12.000          |\n| 3   | 041         | Audit și expertiza financiară                     | zi     | 12.000          |\n| 4   | 041         | Gestiunea finanțelor și contabilitatea în afaceri | zi     | 12.000          |\n| 5   | 041         | Finanțe publice și fiscalitate                    | zi     | 12.000          |\n| 6   | 041         | Studii în marketing                               | zi     | 12.000          |\n| 7   | 101         | Management și marketing hotelier și turism        | zi     | 10.000          |\n| 8   | 041         | Managementul resurselor umane                     | zi     | 12.000          |\n| 9   | 041         | Management                                        | zi, fr | 12.000 / 10.000 |\n| 10  | 041         | Baze de date și tehnici actuariale                | zi     | 14.000          |\n| 11  | 041         | Contabilitatea întreprinderii                     | zi     | 12.000          |\n\nEducație Fizică și Sport\n------------------------\n\n| Nr. | Cod domeniu |                          Program de studiu                          | Forma | Taxa (lei) |\n|-----|-------------|---------------------------------------------------------------------|-------|------------|\n| 1   | 014         | Psihopedagogia educației fizice și a activităților extracurriculare | zi    | 9.000      |\n| 2   | 100         | Cercetare în științe ale sportului                                  | zi    | 9.000      |\n| 3   | 100         | Tehnologia antrenamentului sportiv (90/120 c)                       | zi    | 9.000      |\n| 4   | 100         | Management sportiv                                                  | zi    | 9.000      |\n| 5   | 100         | Fitness și nutriție                                                 | zi    | 9.000      |\n| 6   | 100         | Kinetoterapie și terapie manuală în recuperarea funcțională         | zi    | 14.000     |\n| 7   | 101         | Tehnologii și management în turism                                  | zi    | 10.000     |\n| 8   | 100         | Managementul securității persoanelor și a proprietății              | zi    | 11.000     |\n\nNote\n----\n\nPentru studenții cetățeni ai altor state taxa de studii constituie **1.800 Euro**, cu excepția cetățenilor României și Ucrainei, taxa pentru aceștia fiind similară celei achitate de cetățenii Republicii Moldova. [Source]{https://admitere.usm.md/?page_id=3741)", "Taxe Admitere 2024 - Licență\n\nTaxe de studii - Admiterea 2024 (Licență)\n=========================================\n\nBiologie și Geoștiințe\n----------------------\n\n| Nr. crt. | Cod specialitate |    Facultatea, specialitatea     | Forma de învățământ |  Taxa (lei)   |\n|----------|------------------|----------------------------------|---------------------|---------------|\n| 1        | 0114.6           | Biologie (Științe ale educației) | zi                  | 7.800         |\n| 2        | 0511.1           | Biologie                         | zi                  | 7.800         |\n| 3        | 0511.2           | Biologie moleculară              | zi                  | 7.800         |\n| 4        | 0521.1           | Ecologie și protecția mediului   | zi, fr              | 7.800 / 6.000 |\n| 5        | 0531.1           | Geografie                        | zi, fr              | 7.800 / 6.000 |\n| 6        | 0731.5           | Arhitectură peisajeră            | zi                  | 7.800         |\n| 7        | 0821.1           | Silvicultură şi grădini publice  | zi, fr              | 7.800 / 6.000 |\n\nChimie și Tehnologie Chimică\n----------------------------\n\n| Nr. crt. | Cod specialitate |           Facultatea, specialitatea           | Forma de învățământ |  Taxa (lei)   |\n|----------|------------------|-----------------------------------------------|---------------------|---------------|\n| 1        | 0114.5           | Chimie (științe ale educației)                | zi, fr              | 7.800 / 6.000 |\n| 2        | 0500.1           | Chimie                                        | zi                  | 7.800         |\n| 3        | 0500.2           | Chimie biofarmaceutică                        | zi, fr              | 8.500 / 6.000 |\n| 4        | 0711.1           | Tehnologia chimică industrială                | zi, fr              | 7.800 / 6.000 |\n| 5        | 0711.3           | Tehnologia produselor cosmetice şi medicinale | zi, fr              | 8.500 / 6.000 |\n\nDrept\n-----\n\n| Nr. crt. | Cod specialitate | Facultatea, specialitatea | Forma de învățământ |   Taxa (lei)    |\n|----------|------------------|---------------------------|---------------------|-----------------|\n| 1        | 0421.1           | Drept                     | zi, fr              | 15.000 / 10.000 |\n\nFizică și Inginerie\n-------------------\n\n| Nr. crt. | Cod specialitate |       Facultatea, specialitatea       | Forma de învățământ |   Taxa (lei)    |\n|----------|------------------|---------------------------------------|---------------------|-----------------|\n| 1        | 0533.1           | Fizică                                | zi, fr              | 7.800 / 6.000   |\n| 2        | 0613.1           | Tehnologia informaţiei                | zi, fr              | 12.000 / 10.000 |\n| 3        | 0710.2           | Metrologie și instrumentație virtuală | zi, fr              | 7.800 / 6.000   |\n\nIstorie și Filosofie\n--------------------\n\n| Nr. crt. | Cod specialitate |            Facultatea, specialitatea             | Forma de învățământ |  Taxa (lei)   |\n|----------|------------------|--------------------------------------------------|---------------------|---------------|\n| 1        | 0220.1           | Antropologie                                     | zi                  | 7.500         |\n| 2        | 0223.1           | Filozofie                                        | zi                  | 7.500         |\n| 3        | 0222.1           | Istorie                                          | zi, fr              | 7.800 / 6.000 |\n| 4        | 0114.11          | Istorie (științe ale educației)                  | zi, fr              | 7.800 / 6.000 |\n| 5        | 0114.11, 0114.10 | Istoria și limba engleză (științe ale educației) | zi                  | 7.800         |\n\nJurnalism și Științe ale Comunicării\n------------------------------------\n\n| Nr. crt. | Cod specialitate |                Facultatea, specialitatea                 | Forma de învățământ |   Taxa (lei)   |\n|----------|------------------|----------------------------------------------------------|---------------------|----------------|\n| 1        | 0211.6           | Producție multimedia                                     | zi                  | 14.000         |\n| 2        | 0321.1           | Jurnalism și procese mediatice                           | zi, fr              | 10.000 / 8.000 |\n| 3        | 0321.2           | Comunicare și relații publice                            | zi                  | 10.000         |\n| 4        | 0322.1           | Biblioteconomie, asistenţă informaţională și arhivistică | zi, fr              | 7.800 / 7.000  |\n\nLitere\n------\n\n| Nr. crt. | Cod specialitate |                    Facultatea, specialitatea                    | Forma de învățământ |  Taxa (lei)   |\n|----------|------------------|-----------------------------------------------------------------|---------------------|---------------|\n| 1        | 0114.8           | Limba și literatura română (științe ale educației)              | zi, fr              | 7.800 / 6.000 |\n| 2        | 0114.10          | Limba și literatura engleză și franceză (științe ale educației) | zi                  | 9.500         |\n| 3        | 0114.10          | Limba și literatura franceză și engleză (științe ale educației) | zi                  | 9.500         |\n| 4        | 0114.10          | Limba și literatura germană și engleză (științe ale educației)  | zi                  | 9.500         |\n| 5        | 0114.8, 0114.10  | Limba și literatura română și franceză (științe ale educației)  | zi                  | 7.800         |\n| 6        | 0114.8, 0114.10  | Limba și literatura română și engleză (științe ale educației)   | zi                  | 7.800         |\n| 7        | 0114.9, 0114.10  | Limba și literatura rusă și engleză (științe ale educației)     | zi                  | 7.800         |\n| 8        | 0232.1, 0114.8   | Limba și literatura română                                      | zi, fr              | 7.800 / 6.000 |\n| 9        | 0231.2           | Limba și literatura spaniolă și engleză                         | zi                  | 12.000        |\n| 10       | 0231.3           | Traducere și interpretare: limba engleză și franceză            | zi                  | 12.000        |\n| 11       | 0231.3           | Traducere și interpretare: limba engleză și italiană            | zi                  | 12.000        |\n| 12       | 0231.3           | Traducere și interpretare: limba engleză și germană             | zi                  | 12.000        |\n| 13       | 0231.3           | Traducere și interpretare: limba franceză și engleză            | zi                  | 12.000        | [Source]{https://admitere.usm.md/?page_id=3740)", "Psihologie și Științe ale Educației, Sociologie și Asistență Socială\n--------------------------------------------------------------------\n\n| Nr. crt. | Cod specialitate |             Facultatea, specialitatea             | Forma de învățământ |  Taxa (lei)   |\n|----------|------------------|---------------------------------------------------|---------------------|---------------|\n| 1        | 0111.1           | Psihopedagogie                                    | zi, fr              | 7.800 / 6.000 |\n| 2        | 0113.1, 0114.10  | Pedagogie în învățământul primar și limba engleză | zi                  | 7.800         |\n| 3        | 0313.1           | Psihologie                                        | zi                  | 12.000        |\n| 4        | 0319.1           | Asistență socială                                 | zi, fr              | 7.800 / 6.000 |\n| 5        | 0314.1           | Sociologie                                        | zi                  | 7.800         |\n\nMatematică și Informatică\n-------------------------\n\n| Nr. crt. | Cod specialitate |      Facultatea, specialitatea      | Forma de învățământ |   Taxa (lei)    |\n|----------|------------------|-------------------------------------|---------------------|-----------------|\n| 1        | 0114.1           | Matematica (științe ale educației)  | zi                  | 7.800           |\n| 2        | 0114.2           | Informatică (științe ale educației) | zi, fr              | 7.800 / 6.000   |\n| 3        | 0211.7           | Designul jocurilor                  | zi                  | 14.000          |\n| 4        | 0541.1           | Matematică                          | zi                  | 7.800           |\n| 5        | 0541.2           | Matematici aplicate                 | zi                  | 7.800           |\n| 6        | 0613.4           | Informatică                         | zi                  | 13.000          |\n| 7        | 0613.5           | Informatică aplicată                | zi, fr              | 13.000 / 10.000 |\n\nRelații Internaționale, Științe Politice și Administrative\n----------------------------------------------------------\n\n| Nr. crt. | Cod specialitate | Facultatea, specialitatea | Forma de învățământ |   Taxa (lei)   |\n|----------|------------------|---------------------------|---------------------|----------------|\n| 1        | 0312.1           | Politologie               | zi                  | 7.800          |\n| 2        | 0312.2           | Relații internaționale    | zi, fr              | 12.000 / 8.000 |\n| 3        | 0400.1           | Administrație publică     | zi, fr              | 9.000 / 7.000  |\n\nȘtiințe Economice\n-----------------\n\n| Nr. crt. | Cod specialitate |       Facultatea, specialitatea        | Forma de învățământ |   Taxa (lei)    |\n|----------|------------------|----------------------------------------|---------------------|-----------------|\n| 1        | 0411.1           | Contabilitate                          | zi, fr              | 12.000 / 10.000 |\n| 2        | 0412.1           | Finanțe și bănci                       | zi, fr              | 12.000 / 10.000 |\n| 3        | 0413.1           | Business și administrare               | zi, fr              | 12.000 / 10.000 |\n| 4        | 0414.1           | Marketing și logistică                 | zi, fr              | 12.000 / 10.000 |\n| 5        | 1013.1           | Servicii hoteliere, turism și agrement | zi, fr              | 11.000 / 9.000  |\n\nEducație Fizică și Sport\n------------------------\n\n| Nr. crt. | Cod specialitate |       Facultatea, specialitatea       | Forma de învățământ |   Taxa (lei)   |\n|----------|------------------|---------------------------------------|---------------------|----------------|\n| 1        | 0141.17          | Educație fizică                       | zi, fr              | 8.000 / 7.500  |\n| 2        | 1000.1           | Antrenament sportiv                   | zi, fr              | 8.000 / 7.500  |\n| 3        | 1000.3           | Fitness și programe de recreare       | zi, fr              | 8.000 / 7.500  |\n| 4        | 1001.1           | Kinetoterapie și terapie ocupațională | zi                  | 13.000         |\n| 5        | 1039.1           | Securitatea civilă și publică         | zi, fr              | 11.000 / 9.000 |\n\nNote\n----\n\n-- Taxa de studii pentru anul compensator constituie **10.000 lei**.\n\n-- Pentru studenții cetățeni ai altor state, taxa de studii, învățământ cu frecvență și frecvență redusă, constituie:\n\n* An pregătitor -- **1.000 Euro**\n\n* Ciclul I, Licență -- **1.800 Euro**\n\n*Cu excepția cetățenilor României și Ucrainei, taxa pentru aceștia fiind similară celei achitate de cetățenii Republicii Moldova.* [Source]{https://admitere.usm.md/?page_id=3740)" ]
}