{
  "question" : "asdasd",
  "answer" : "Îmi pare rău, dar nu pot răspunde la întrebarea ta deoarece nu am informații suficiente. Te rog să formulezi o întrebare specifică despre Universitatea de Stat din Moldova sau despre facultățile și programele de studii disponibile, și voi fi bucuros să te ajut!",
  "contexts" : [ "Facultatea de Chimie şi Tehnologie Chimică -- Universitatea de Stat din Moldova Skip to content\n\n* Oferta 2024\n  * [Licență](https://admitere.usm.md/?page_id=98)\n  * [Master](https://admitere.usm.md/?page_id=94)\n  * [Întrebări frecvente](https://admitere.usm.md/?page_id=1925)\n  * [Programe de Motivare](https://admitere.usm.md/?page_id=2395)\n  * [Broșuri](https://admitere.usm.md/?page_id=41)\n  * [Taxe](https://admitere.usm.md/?page_id=4209)\n\n* [Microsoft 365](https://microsoft365.usm.md/)\n\n* [Centrul de Ghidare în Carieră](https://cgc.usm.md)\n\n* Cercetare\n  * [Departamentul Cercetare și Inovare](https://cercetare.usm.md/)\n  * [Institute de Cercetare](https://usm.md/?page_id=19861)\n\n* [International](https://international.usm.md/)  \n[](https://www.facebook.com/UniversitateaDeStatDinMoldova/) [](https://www.instagram.com/usm.md/) [](https://www.youtube.com/channel/UC3oFsXde0eZRaAqeX_6iBcg/videos)  \n[![Universitatea de Stat din Moldova](https://usm.md/wp-content/uploads/cropped-logo_dark_22.png)](https://usm.md/)  \nCaută după:\n\n* USM\n  * [Despre](https://usm.md/?page_id=18)\n  * Conducerea Universității\n    * [Rectorat](https://usm.md/?page_id=194)\n    * [Senatul Universitar](https://usm.md/?page_id=188)\n    * [Consiliul de Administrație](https://usm.md/?page_id=197)\n    * Comisiile Senatului\n      * [Comisia de etică universitară](https://usm.md/?page_id=549)\n      * [Comisia activitate didactică, învăţămînt şi evaluare academică](https://usm.md/?page_id=552)\n      * [Comisia management universitar şi dezvoltare instituţională](https://usm.md/?page_id=555)\n      * [Comisia informatizare](https://usm.md/?page_id=3129)\n      * [Comisia relaţii internaţionale](https://usm.md/?page_id=3128)\n      * [Comisia comunicare și promovarea imaginii](https://usm.md/?page_id=558)\n      * [Comisia pentru cercetare](https://usm.md/?page_id=561)\n      * [Comisia pentru probleme studenţeşti](https://usm.md/?page_id=564)\n      * [Comisia pentru activităţi culturale şi sportive](https://usm.md/?page_id=567)\n    * [Consiliul pentru Dezvoltarea Strategică Instituțională](https://usm.md/?page_id=191)\n    * [Consiliul Științific](https://usm.md/?page_id=626)\n  * Organizare\n    * Departamentul Managementul Calității\n      * [Structura](https://usm.md/?page_id=12865)\n      * [Acte normative](https://usm.md/?page_id=12868)\n      * Planuri de activitate, rapoarte\n        * [Planuri de activitate](https://usm.md/?page_id=12870)\n        * [Rapoarte de activitate](https://usm.md/?page_id=12877)\n      * Audit intern\n        * [Proceduri de audit](https://usm.md/?page_id=12880)\n        * [Planuri de audit](https://usm.md/?page_id=12884)\n        * [Membrii comisiilor de audit](https://usm.md/?page_id=12886)\n      * Evaluare externă\n        * [Planuri de măsuri corective](https://usm.md/?page_id=12894)\n        * Acte normative\n          * [Curente](https://usm.md/?page_id=12891)\n          * [Arhiva](https://usm.md/?page_id=16434)\n        * Acreditare Instituțională\n          * [Raportul de autoevaluare](https://usm.md/?page_id=19384)\n          * [Anexe](https://usm.md/?page_id=18560)\n            * [Anexa 1](https://usm.md/?page_id=18563)\n            * [Anexa 2.1](https://usm.md/?page_id=18566)\n            * [Anexa 2.2](https://usm.md/?page_id=18619)\n            * [Anexa 2.3](https://usm.md/?page_id=18620)\n            * [Anexa 2.4](https://usm.md/?page_id=19128)\n            * [Anexa 2.5](https://usm.md/?page_id=18643)\n            * [Anexa 3.1](https://usm.md/?page_id=18657)\n            * [Anexa 3.2](https://usm.md/?page_id=18699)\n            * [Anexa 3.3](https://usm.md/?page_id=18825)\n            * [Anexa 3.4](https://usm.md/?page_id=19037)\n            * [Anexa 3.5](https://usm.md/?page_id=19185)\n            * [Anexa 3.6](https://usm.md/?page_id=19248)\n            * [Anexa 3.7](https://usm.md/?page_id=19259)\n            * [Anexa 4](https://usm.md/?page_id=19270)\n            * [Anexe FV](https://usm.md/?page_id=19367)\n    * [Departamentul IT](https://usm.md/?page_id=25666)\n    * [Departamentul Cercetare și Inovare](https://cercetare.usm.md/)\n    * [Biblioteca USM](https://library.usm.md/)\n    * [Departamentul Relații Internaționale](https://usm.md/?page_id=257)\n    * [Centru de Resurse pentru Formare Continuă](https://usm.md/?page_id=228)\n    * [Secția Comunicare și Relații Publice](https://usm.md/?page_id=362)\n    * [Centrul de Ghidare în Carieră și Relații cu Piața Muncii](https://usm.md/?page_id=268)\n    * [Departamentul Resurse Umane](https://usm.md/?page_id=271)\n    * [Oficiul Achiziții Publice](https://usm.md/?page_id=385)\n    * [Departamentul Contabilitate](https://usm.md/?page_id=274)\n    * [Departamentul economico-financiar](https://usm.md/?page_id=752)\n    * [Organigrama](https://usm.md/wp-content/uploads/Organigrama_Noiembrie_Decembrie_Senat_28_11_2023.pdf)\n  * Resurse\n    * Resurse digitale\n      * [Revista de Istorie a Moldovei](https://usm.md/?page_id=15485)\n      * [VOX USM](https://usm.md/?page_id=1996)\n    * [Documente](https://usm.md/?page_id=203)\n      * [Acte normative nationale](https://usm.md/?page_id=206)\n      * [Acte normative USM](https://usm.md/?page_id=209)\n        * [Documente reglementare activitate instituţională](https://usm.md/?page_id=451)\n        * [Regulamente resurse umane](https://usm.md/?page_id=453)\n        * [Regulamente proces educational](https://usm.md/?page_id=455)\n        * [Regulamente managementul calității](https://usm.md/?page_id=457)\n        * [Regulamente activitate ştiinţifică](https://usm.md/?page_id=459)\n        * [Regulamente Relaţii Internaţionale](https://usm.md/?page_id=461)\n        * [Regulamente sistem informaţional](https://usm.md/?page_id=463)\n        * Planuri și rapoarte de activitate\n          * [Rapoarte de activitate](https://usm.md/?page_id=3237)\n          * [Situațiile financiare](https://usm.md/?page_id=1220)\n          * [Planuri achizitiilor publice](https://usm.md/?page_id=2203)\n          * [Raport privind realizarea contractelor încheiate în urma procedurilor de achiziție](https://usm.md/?page_id=1224)\n          * [Graficul şedinţelor departamentelor USM](https://usm.md/wp-content/uploads/Graficul_Sedintelor_Departamentelor-1.pdf)\n          * [Planuri și Rapoarte De Activitate](https://usm.md/?page_id=10032)\n        * [Arhiva](https://usm.md/?page_id=18165)\n    * [Moodle.USM](http://moodle.usm.md/)\n    * [Galeria](https://usm.md/?page_id=9106)\n    * [Materiale Grafice USM](https://usm.md/?page_id=20143)\n  * Proiecte\n    * Banca Mondială\n      * [Subproiecte](https://usm.md/?page_id=16155)\n      * [Transparență](https://usm.md/?page_id=26463)\n    * Erasmus+\n      * [DEFEP](https://defep.usm.md/)\n      * [EUDIPSEC](https://eudipsec.usm.md/)\n      * [QFORTE](https://usm.md/?page_id=29341)\n\n* [Facultăți](https://usm.md/)\n  * [Facultatea de Biologie și Geoștiințe](https://usm.md/?page_id=489)\n  * [Facultatea de Drept](https://usm.md/?page_id=495)\n  * [Facultatea de Chimie şi Tehnologie Chimică](https://usm.md/?page_id=492)\n  * [Facultatea de Fizica si Inginerie](https://usm.md/?page_id=498)\n  * [Facultatea de Istorie şi Filosofie](https://usm.md/?page_id=502)\n  * [Facultatea de Jurnalism şi Ştiinţe ale Comunicării](https://usm.md/?page_id=505)\n  * [Facultatea de Litere](https://usm.md/?page_id=511)\n  * [Facultatea de Matematică şi Informatică](https://usm.md/?page_id=515)\n  * [Facultatea Psihologie, Ştiinţe ale Educaţiei, Sociologie și Asistență Socială](https://usm.md/?page_id=518)\n  * [Facultatea de Relaţii Internaţionale, Ştiinţe Politice şi Administrative](https://usm.md/?page_id=522)\n  * [Facultatea de Ştiinţe Economice](https://usm.md/?page_id=528)\n  * [Institutul de Educație Fizică și Sport](https://usm.md/?page_id=31334)\n\n* [Studii](https://usm.md/?page_id=20)\n  * [Departamentul Studii](https://usm.md/?page_id=241)\n  * Calendar academic\n    * [Licență](https://usm.md/?page_id=731)\n    * [Master](https://usm.md/?page_id=734)\n    * [Doctorat](https://usm.md/?page_id=737)\n  * [Studii de Licență](https://usm.md/?page_id=216)\n  * [Studii de Masterat](https://usm.md/?page_id=219)\n  * [Studii de Doctorat](https://doctorat.usm.md/)\n  * [Catedra Militară](https://usm.md/?page_id=680)\n  * Burse\n    * [Burse finanțate din bugetul de stat](https://usm.md/?page_id=392)\n    * [Burse de performanță](https://usm.md/?page_id=396)\n  * [Recunoaștere și echivalare](https://usm.md/?page_id=26183)\n\n* [Formare Continuă](http://crfc.usm.md/)\n\n* [Studenti](https://usm.md/?page_id=34)\n  * Descoperă@USM\n    * [Concurs „Hai să #Celebrăm75USM!\"](https://usm.md/?page_id=3181)\n    * [Istoria USM](https://usm.md/wp-content/uploads/ISTORIA_USM.pdf)\n    * [Broșura USM (Ro)](https://usm.md/wp-content/uploads/Broshura_USM_2020_ro.pdf)\n    * [Broșura USM (En)](https://usm.md/wp-content/uploads/Broshura_USM_2020_en.pdf)\n    * [Oferta USM 2023](https://usm.md/wp-content/uploads/pliant_oferta-educațională-2021.pdf)\n    * [Ghid pentru studenții anului I și II](https://usm.md/wp-content/uploads/ghid-studenti-anul-I-SI-II-USM-web.pdf)\n    * [Program de motivare a candidaților](https://usm.md/?page_id=1112)\n  * [Campus](https://usm.md/?page_id=22279)\n  * [Asociații studențești](http://asusm.usm.md/)\n  * Actvitati extracurriculare\n    * [Arte Frumoase](https://usm.md/?page_id=668)\n    * [Sport](https://usm.md/?page_id=667)\n  * [Cariera](https://usm.md/?page_id=268)\n\n* [Contacte](https://usm.md/?page_id=1380)\n\n* Ro: ![Română](https://usm.md/wp-content/plugins/qtranslate-x/flags/ro.png)\n  * [![Română](https://usm.md/wp-content/plugins/qtranslate-x/flags/ro.png) Română](https://usm.md/?page_id=492&lang=ro \"Română\")\n  * [:uk: English](https://usm.md/?page_id=492&lang=en \"English\")\n  * [:ru: Русский](https://usm.md/?page_id=492&lang=ru \"Русский\")\n\n[![Universitatea de Stat din Moldova](https://usm.md/wp-content/uploads/cropped-logo_dark_22.png)](https://usm.md/)\n\n* USM\n  * [Despre](https://usm.md/?page_id=18)\n  * Conducerea Universității\n    * [Rectorat](https://usm.md/?page_id=194)\n    * [Senatul Universitar](https://usm.md/?page_id=188)\n    * [Consiliul de Administrație](https://usm.md/?page_id=197)\n    * Comisiile Senatului\n      * [Comisia de etică universitară](https://usm.md/?page_id=549)\n      * [Comisia activitate didactică, învăţămînt şi evaluare academică](https://usm.md/?page_id=552)\n      * [Comisia management universitar şi dezvoltare instituţională](https://usm.md/?page_id=555)\n      * [Comisia informatizare](https://usm.md/?page_id=3129)\n      * [Comisia relaţii internaţionale](https://usm.md/?page_id=3128)\n      * [Comisia comunicare și promovarea imaginii](https://usm.md/?page_id=558)\n      * [Comisia pentru cercetare](https://usm.md/?page_id=561)\n      * [Comisia pentru probleme studenţeşti](https://usm.md/?page_id=564)\n      * [Comisia pentru activităţi culturale şi sportive](https://usm.md/?page_id=567)\n    * [Consiliul pentru Dezvoltarea Strategică Instituțională](https://usm.md/?page_id=191)\n    * [Consiliul Științific](https://usm.md/?page_id=626)\n  * Organizare\n    * Departamentul Managementul Calității\n      * [Structura](https://usm.md/?page_id=12865)\n      * [Acte normative](https://usm.md/?page_id=12868)\n      * Planuri de activitate, rapoarte\n        * [Planuri de activitate](https://usm.md/?page_id=12870)\n        * [Rapoarte de activitate](https://usm.md/?page_id=12877)\n      * Audit intern\n        * [Proceduri de audit](https://usm.md/?page_id=12880)\n        * [Planuri de audit](https://usm.md/?page_id=12884)\n        * [Membrii comisiilor de audit](https://usm.md/?page_id=12886)\n      * Evaluare externă\n        * [Planuri de măsuri corective](https://usm.md/?page_id=12894)\n        * Acte normative\n          * [Curente](https://usm.md/?page_id=12891)\n          * [Arhiva](https://usm.md/?page_id=16434)\n        * Acreditare Instituțională\n          * [Raportul de autoevaluare](https://usm.md/?page_id=19384)\n          * [Anexe](https://usm.md/?page_id=18560)\n            * [Anexa 1](https://usm.md/?page_id=18563)\n            * [Anexa 2.1](https://usm.md/?page_id=18566)\n            * [Anexa 2.2](https://usm.md/?page_id=18619)\n            * [Anexa 2.3](https://usm.md/?page_id=18620)\n            * [Anexa 2.4](https://usm.md/?page_id=19128)\n            * [Anexa 2.5](https://usm.md/?page_id=18643)\n            * [Anexa 3.1](https://usm.md/?page_id=18657)\n            * [Anexa 3.2](https://usm.md/?page_id=18699)\n            * [Anexa 3.3](https://usm.md/?page_id=18825)\n            * [Anexa 3.4](https://usm.md/?page_id=19037)\n            * [Anexa 3.5](https://usm.md/?page_id=19185)\n            * [Anexa 3.6](https://usm.md/?page_id=19248)\n            * [Anexa 3.7](https://usm.md/?page_id=19259)\n            * [Anexa 4](https://usm.md/?page_id=19270)\n            * [Anexe FV](https://usm.md/?page_id=19367)\n    * [Departamentul IT](https://usm.md/?page_id=25666)\n    * [Departamentul Cercetare și Inovare](https://cercetare.usm.md/)\n    * [Biblioteca USM](https://library.usm.md/)\n    * [Departamentul Relații Internaționale](https://usm.md/?page_id=257)\n    * [Centru de Resurse pentru Formare Continuă](https://usm.md/?page_id=228)\n    * [Secția Comunicare și Relații Publice](https://usm.md/?page_id=362)\n    * [Centrul de Ghidare în Carieră și Relații cu Piața Muncii](https://usm.md/?page_id=268)\n    * [Departamentul Resurse Umane](https://usm.md/?page_id=271)\n    * [Oficiul Achiziții Publice](https://usm.md/?page_id=385)\n    * [Departamentul Contabilitate](https://usm.md/?page_id=274)\n    * [Departamentul economico-financiar](https://usm.md/?page_id=752)\n    * [Organigrama](https://usm.md/wp-content/uploads/Organigrama_Noiembrie_Decembrie_Senat_28_11_2023.pdf)\n  * Resurse\n    * Resurse digitale\n      * [Revista de Istorie a Moldovei](https://usm.md/?page_id=15485)\n      * [VOX USM](https://usm.md/?page_id=1996)\n    * [Documente](https://usm.md/?page_id=203)\n      * [Acte normative nationale](https://usm.md/?page_id=206)\n      * [Acte normative USM](https://usm.md/?page_id=209)\n        * [Documente reglementare activitate instituţională](https://usm.md/?page_id=451)\n        * [Regulamente resurse umane](https://usm.md/?page_id=453)\n        * [Regulamente proces educational](https://usm.md/?page_id=455)\n        * [Regulamente managementul calității](https://usm.md/?page_id=457)\n        * [Regulamente activitate ştiinţifică](https://usm.md/?page_id=459)\n        * [Regulamente Relaţii Internaţionale](https://usm.md/?page_id=461)\n        * [Regulamente sistem informaţional](https://usm.md/?page_id=463)\n        * Planuri și rapoarte de activitate\n          * [Rapoarte de activitate](https://usm.md/?page_id=3237)\n          * [Situațiile financiare](https://usm.md/?page_id=1220)\n          * [Planuri achizitiilor publice](https://usm.md/?page_id=2203)\n          * [Raport privind realizarea contractelor încheiate în urma procedurilor de achiziție](https://usm.md/?page_id=1224)\n          * [Graficul şedinţelor departamentelor USM](https://usm.md/wp-content/uploads/Graficul_Sedintelor_Departamentelor-1.pdf)\n          * [Planuri și Rapoarte De Activitate](https://usm.md/?page_id=10032)\n        * [Arhiva](https://usm.md/?page_id=18165)\n    * [Moodle.USM](http://moodle.usm.md/)\n    * [Galeria](https://usm.md/?page_id=9106)\n    * [Materiale Grafice USM](https://usm.md/?page_id=20143)\n  * Proiecte\n    * Banca Mondială\n      * [Subproiecte](https://usm.md/?page_id=16155)\n      * [Transparență](https://usm.md/?page_id=26463)\n    * Erasmus+\n      * [DEFEP](https://defep.usm.md/)\n      * [EUDIPSEC](https://eudipsec.usm.md/)\n      * [QFORTE](https://usm.md/?page_id=29341)\n\n* [Facultăți](https://usm.md/)\n  * [Facultatea de Biologie și Geoștiințe](https://usm.md/?page_id=489)\n  * [Facultatea de Drept](https://usm.md/?page_id=495)\n  * [Facultatea de Chimie şi Tehnologie Chimică](https://usm.md/?page_id=492)\n  * [Facultatea de Fizica si Inginerie](https://usm.md/?page_id=498)\n  * [Facultatea de Istorie şi Filosofie](https://usm.md/?page_id=502)\n  * [Facultatea de Jurnalism şi Ştiinţe ale Comunicării](https://usm.md/?page_id=505)\n  * [Facultatea de Litere](https://usm.md/?page_id=511)\n  * [Facultatea de Matematică şi Informatică](https://usm.md/?page_id=515)\n  * [Facultatea Psihologie, Ştiinţe ale Educaţiei, Sociologie și Asistență Socială](https://usm.md/?page_id=518)\n  * [Facultatea de Relaţii Internaţionale, Ştiinţe Politice şi Administrative](https://usm.md/?page_id=522)\n  * [Facultatea de Ştiinţe Economice](https://usm.md/?page_id=528)\n  * [Institutul de Educație Fizică și Sport](https://usm.md/?page_id=31334)\n\n* [Studii](https://usm.md/?page_id=20)\n  * [Departamentul Studii](https://usm.md/?page_id=241)\n  * Calendar academic\n    * [Licență](https://usm.md/?page_id=731)\n    * [Master](https://usm.md/?page_id=734)\n    * [Doctorat](https://usm.md/?page_id=737)\n  * [Studii de Licență](https://usm.md/?page_id=216)\n  * [Studii de Masterat](https://usm.md/?page_id=219)\n  * [Studii de Doctorat](https://doctorat.usm.md/)\n  * [Catedra Militară](https://usm.md/?page_id=680)\n  * Burse\n    * [Burse finanțate din bugetul de stat](https://usm.md/?page_id=392)\n    * [Burse de performanță](https://usm.md/?page_id=396)\n  * [Recunoaștere și echivalare](https://usm.md/?page_id=26183)\n\n* [Formare Continuă](http://crfc.usm.md/)\n\n* [Studenti](https://usm.md/?page_id=34)\n  * Descoperă@USM\n    * [Concurs „Hai să #Celebrăm75USM!\"](https://usm.md/?page_id=3181)\n    * [Istoria USM](https://usm.md/wp-content/uploads/ISTORIA_USM.pdf)\n    * [Broșura USM (Ro)](https://usm.md/wp-content/uploads/Broshura_USM_2020_ro.pdf)\n    * [Broșura USM (En)](https://usm.md/wp-content/uploads/Broshura_USM_2020_en.pdf)\n    * [Oferta USM 2023](https://usm.md/wp-content/uploads/pliant_oferta-educațională-2021.pdf)\n    * [Ghid pentru studenții anului I și II](https://usm.md/wp-content/uploads/ghid-studenti-anul-I-SI-II-USM-web.pdf)\n    * [Program de motivare a candidaților](https://usm.md/?page_id=1112)\n  * [Campus](https://usm.md/?page_id=22279)\n  * [Asociații studențești](http://asusm.usm.md/)\n  * Actvitati extracurriculare\n    * [Arte Frumoase](https://usm.md/?page_id=668)\n    * [Sport](https://usm.md/?page_id=667)\n  * [Cariera](https://usm.md/?page_id=268)\n\n* [Contacte](https://usm.md/?page_id=1380)\n\n* Ro: ![Română](https://usm.md/wp-content/plugins/qtranslate-x/flags/ro.png)\n  * [![Română](https://usm.md/wp-content/plugins/qtranslate-x/flags/ro.png) Română](https://usm.md/?page_id=492&lang=ro \"Română\")\n  * [:uk: English](https://usm.md/?page_id=492&lang=en \"English\")\n\n* [:ru: Русский](https://usm.md/?page_id=492&lang=ru \"Русский\")\n\nFacultatea de Chimie şi Tehnologie Chimică\n==========================================\n\nPerformanța ta începe aici!  \n**CONTACTE**\n\n**Str. Alexei Mateevici, Nr. 60, bloc 4, MD-2009,Chişinău**\n\n**Tel: +373 22 244 355** , **+373 67 560 046**\n\n**Fax: +373 22 244 355**\n\n**E-mail: [fctc@usm.md](mailto:fctc@usm.md)**\n\n**Web: [chimie.usm.md](http://chimie.usm.md/)**\n\n**PREZENTARE**\n\nFacultatea de Chimie şi Tehnologie Chimică a fost inaugurată în 1946 cu denumirea Facultatea de Chimie, menţinându-se de-a lungul a şase decenii ca o forjerie de specialişti de înaltă calificare în domeniul pedagogic şi tehnologic.\n\nPrin activităţile sale facultatea asigură o continuitate eficientă a învăţământului liceal, universitar şi postuniversitar pentru domeniile de formare profesională: Chimie, Tehnologie Chimică, Protecţia Mediului. Până în prezent la facultate au fost pregătiţi peste 3000 de specialişti care activează cu succes în republică şi peste hotarele ei.\n\n**Misiunea**Facultăţii de Chimie şi Tehnologie Chimică constă în formarea specialiştilor de înaltă calificare în domeniul chimiei, tehnologiilor chimice şi protecţiei mediului ambiant. Acest proces prevede studiul compoziţiei, structurii şi proprietăţilor compuşilor, elaborarea metodelor de obţinere a unor substanţe noi cu proprietăţi dirijate, a tehnologiilor performante de producere a materialelor finale cu competitivităţi avansate şi impact negativ redus asupra mediului ambiant.\n\n**DECAN:** Dr. conf.univ. Viorica GLADCHI [Source]{https://usm.md/?page_id=492)", "Acte necesare la admitere ciclul II -- Admitere 2024 Skip to content  \n[![](https://admitere.usm.md/wp-content/uploads/cropped-cropped-logo_dark_22-2-1.png)](https://admitere.usm.md/)[![Admitere 2024](https://admitere.usm.md/wp-content/uploads/cropped-cropped-logo_dark_22-2.png)](https://admitere.usm.md/)\n\n* [Oferta 2024](http://admitere.usm.md/)\n  * [Licenta](https://admitere.usm.md/?page_id=98)\n  * [Master](https://admitere.usm.md/?page_id=94)\n  * [Întrebări frecvente](https://admitere.usm.md/?page_id=1925)\n  * [Programe de motivare](https://admitere.usm.md/?page_id=2395)\n  * [Broșuri](https://admitere.usm.md/?page_id=41)\n  * [Taxe](https://admitere.usm.md/?page_id=4209)\n\n* [Calendarul admiterii](https://admitere.usm.md/?page_id=3906)\n\n* [Acte](http://admitere.usm.md/)\n  * [Regulamente](https://admitere.usm.md/?page_id=50)\n  * [Acte necesare admitere](http://admitere.usm.md/)\n    * [Acte necesare la admitere ciclul I](https://admitere.usm.md/?page_id=562)\n    * [Acte necesare la admitere ciclul II](https://admitere.usm.md/?page_id=565)\n  * Plan de admitere\n    * [Plan admitere Licenţă cu frecvență](http://admitere.usm.md/wp-content/uploads/Plan-inmatriculare_Licenta-2.pdf)\n    * [Plan admitere Licenţă cu frecvență redusă](http://admitere.usm.md/wp-content/uploads/Plan-inmatriculare_Licenta_frec.-redusa-1.pdf)\n    * [Plan admitere Master cu frecvență](http://admitere.usm.md/wp-content/uploads/Plan-inmatriculare_Master-2.pdf)\n    * [Plan admitere Master cu frecvență redusă](http://admitere.usm.md/wp-content/uploads/Plan-inmatriculare_master.frec_.redusa.pdf)\n    * [Plan admitere pentru studenți străini](http://admitere.usm.md/wp-content/uploads/plan-inmatr.-cetateni-straini-1.pdf)\n  * [Tuition fees](https://admitere.usm.md/?page_id=1476)\n  * [Taxe de studii](http://admitere.usm.md/)\n    * [Taxele de studii, Ciclul I studii superioare de licenţă](https://admitere.usm.md/?page_id=3740)\n    * [Taxele de studii, Ciclul II studii superioare de masterat](https://admitere.usm.md/?page_id=3741)\n\n* [Comisia de admitere](https://admitere.usm.md/?page_id=1445)\n\n* [Rezultate](https://admitere.usm.md/?page_id=56)\n  * [Turul I: Anunţarea rezultatelor finale](https://admitere.usm.md/?page_id=2682)\n  * [Turul II: Anunţarea rezultatelor finale](https://admitere.usm.md/?page_id=2778)\n\n* [Centrul de Ghidare în Carieră](https://cgc.usm.md/)\n\n* Ro: ![Română](https://admitere.usm.md/wp-content/plugins/qtranslate-x/flags/ro.png)\n  * [![Română](https://admitere.usm.md/wp-content/plugins/qtranslate-x/flags/ro.png) Română](https://admitere.usm.md/?page_id=565&lang=ro \"Română\")\n  * [:uk: English](https://admitere.usm.md/?page_id=565&lang=en \"English\")\n  * [:ru: Русский](https://admitere.usm.md/?page_id=565&lang=ru \"Русский\")\n\n[![](https://admitere.usm.md/wp-content/uploads/cropped-cropped-logo_dark_22-2-1.png)](https://admitere.usm.md/)[![Admitere 2024](https://admitere.usm.md/wp-content/uploads/cropped-cropped-logo_dark_22-2.png)](https://admitere.usm.md/)\n\n* [Oferta 2024](http://admitere.usm.md/)\n  * [Licenta](https://admitere.usm.md/?page_id=98)\n  * [Master](https://admitere.usm.md/?page_id=94)\n  * [Întrebări frecvente](https://admitere.usm.md/?page_id=1925)\n  * [Programe de motivare](https://admitere.usm.md/?page_id=2395)\n  * [Broșuri](https://admitere.usm.md/?page_id=41)\n  * [Taxe](https://admitere.usm.md/?page_id=4209)\n\n* [Calendarul admiterii](https://admitere.usm.md/?page_id=3906)\n\n* [Acte](http://admitere.usm.md/)\n  * [Regulamente](https://admitere.usm.md/?page_id=50)\n  * [Acte necesare admitere](http://admitere.usm.md/)\n    * [Acte necesare la admitere ciclul I](https://admitere.usm.md/?page_id=562)\n    * [Acte necesare la admitere ciclul II](https://admitere.usm.md/?page_id=565)\n  * Plan de admitere\n    * [Plan admitere Licenţă cu frecvență](http://admitere.usm.md/wp-content/uploads/Plan-inmatriculare_Licenta-2.pdf)\n    * [Plan admitere Licenţă cu frecvență redusă](http://admitere.usm.md/wp-content/uploads/Plan-inmatriculare_Licenta_frec.-redusa-1.pdf)\n    * [Plan admitere Master cu frecvență](http://admitere.usm.md/wp-content/uploads/Plan-inmatriculare_Master-2.pdf)\n    * [Plan admitere Master cu frecvență redusă](http://admitere.usm.md/wp-content/uploads/Plan-inmatriculare_master.frec_.redusa.pdf)\n    * [Plan admitere pentru studenți străini](http://admitere.usm.md/wp-content/uploads/plan-inmatr.-cetateni-straini-1.pdf)\n  * [Tuition fees](https://admitere.usm.md/?page_id=1476)\n  * [Taxe de studii](http://admitere.usm.md/)\n    * [Taxele de studii, Ciclul I studii superioare de licenţă](https://admitere.usm.md/?page_id=3740)\n    * [Taxele de studii, Ciclul II studii superioare de masterat](https://admitere.usm.md/?page_id=3741)\n\n* [Comisia de admitere](https://admitere.usm.md/?page_id=1445)\n\n* [Rezultate](https://admitere.usm.md/?page_id=56)\n  * [Turul I: Anunţarea rezultatelor finale](https://admitere.usm.md/?page_id=2682)\n  * [Turul II: Anunţarea rezultatelor finale](https://admitere.usm.md/?page_id=2778)\n\n* [Centrul de Ghidare în Carieră](https://cgc.usm.md/)\n\n* Ro: ![Română](https://admitere.usm.md/wp-content/plugins/qtranslate-x/flags/ro.png)\n  * [![Română](https://admitere.usm.md/wp-content/plugins/qtranslate-x/flags/ro.png) Română](https://admitere.usm.md/?page_id=565&lang=ro \"Română\")\n  * [:uk: English](https://admitere.usm.md/?page_id=565&lang=en \"English\")\n\n* [:ru: Русский](https://admitere.usm.md/?page_id=565&lang=ru \"Русский\")\n\nActe necesare la admitere ciclul II\n===================================\n\n<br />\n\n***Documente obligatorii:***\n\n* cererea de înscriere la concursul de admitere;\n\n* actul de studii, în original, cu anexa respectivă (absolvenți liceelor din România și alte state, promoția din anul admiterii, prezintă certificatul de studii, cu notele obținute la examenele de bacalaureat şi situația școlară pe anii de studii, urmând ca diploma de bacalaureat să fie prezentată ulterior); act de studii-xerox\n\n* 4 fotografii 3×4 cm;\n\n* copia buletinului de identitate;\n\n* Adeverință de recrut\n\nNOTĂ: **Candidații care aspiră la programele de master destinate funcționarilor publici:**\n\n**[*Anticorupție (90 credite, studii cu frecvență)*](http://admitere.usm.md/wp-content/uploads/Anticoruptie_90-cr_MP_2024_cu-frecventa.pdf)** ***;***\n\n[***Anticorupție (90 credite, studii cu frecvență redusă)***](http://admitere.usm.md/wp-content/uploads/Anticoruptie_90-cr_MP_2024_cu-frecventa-redusa.pdf)***;***\n\n[***Drept public (90 credite, studii cu frecvență)***](http://admitere.usm.md/wp-content/uploads/Drept-public_90-cr_MP_2024_cu-frecventa.pdf)***;*** [Source]{https://admitere.usm.md/?page_id=565)", "Institutul de Educație Fizică și Sport -- Universitatea de Stat din Moldova Skip to content\n\n* Oferta 2024\n  * [Licență](https://admitere.usm.md/?page_id=98)\n  * [Master](https://admitere.usm.md/?page_id=94)\n  * [Întrebări frecvente](https://admitere.usm.md/?page_id=1925)\n  * [Programe de Motivare](https://admitere.usm.md/?page_id=2395)\n  * [Broșuri](https://admitere.usm.md/?page_id=41)\n  * [Taxe](https://admitere.usm.md/?page_id=4209)\n\n* [Microsoft 365](https://microsoft365.usm.md/)\n\n* [Centrul de Ghidare în Carieră](https://cgc.usm.md)\n\n* Cercetare\n  * [Departamentul Cercetare și Inovare](https://cercetare.usm.md/)\n  * [Institute de Cercetare](https://usm.md/?page_id=19861)\n\n* [International](https://international.usm.md/)  \n[](https://www.facebook.com/UniversitateaDeStatDinMoldova/) [](https://www.instagram.com/usm.md/) [](https://www.youtube.com/channel/UC3oFsXde0eZRaAqeX_6iBcg/videos)  \n[![Universitatea de Stat din Moldova](https://usm.md/wp-content/uploads/cropped-logo_dark_22.png)](https://usm.md/)  \nCaută după:\n\n* USM\n  * [Despre](https://usm.md/?page_id=18)\n  * Conducerea Universității\n    * [Rectorat](https://usm.md/?page_id=194)\n    * [Senatul Universitar](https://usm.md/?page_id=188)\n    * [Consiliul de Administrație](https://usm.md/?page_id=197)\n    * Comisiile Senatului\n      * [Comisia de etică universitară](https://usm.md/?page_id=549)\n      * [Comisia activitate didactică, învăţămînt şi evaluare academică](https://usm.md/?page_id=552)\n      * [Comisia management universitar şi dezvoltare instituţională](https://usm.md/?page_id=555)\n      * [Comisia informatizare](https://usm.md/?page_id=3129)\n      * [Comisia relaţii internaţionale](https://usm.md/?page_id=3128)\n      * [Comisia comunicare și promovarea imaginii](https://usm.md/?page_id=558)\n      * [Comisia pentru cercetare](https://usm.md/?page_id=561)\n      * [Comisia pentru probleme studenţeşti](https://usm.md/?page_id=564)\n      * [Comisia pentru activităţi culturale şi sportive](https://usm.md/?page_id=567)\n    * [Consiliul pentru Dezvoltarea Strategică Instituțională](https://usm.md/?page_id=191)\n    * [Consiliul Științific](https://usm.md/?page_id=626)\n  * Organizare\n    * Departamentul Managementul Calității\n      * [Structura](https://usm.md/?page_id=12865)\n      * [Acte normative](https://usm.md/?page_id=12868)\n      * Planuri de activitate, rapoarte\n        * [Planuri de activitate](https://usm.md/?page_id=12870)\n        * [Rapoarte de activitate](https://usm.md/?page_id=12877)\n      * Audit intern\n        * [Proceduri de audit](https://usm.md/?page_id=12880)\n        * [Planuri de audit](https://usm.md/?page_id=12884)\n        * [Membrii comisiilor de audit](https://usm.md/?page_id=12886)\n      * Evaluare externă\n        * [Planuri de măsuri corective](https://usm.md/?page_id=12894)\n        * Acte normative\n          * [Curente](https://usm.md/?page_id=12891)\n          * [Arhiva](https://usm.md/?page_id=16434)\n        * Acreditare Instituțională\n          * [Raportul de autoevaluare](https://usm.md/?page_id=19384)\n          * [Anexe](https://usm.md/?page_id=18560)\n            * [Anexa 1](https://usm.md/?page_id=18563)\n            * [Anexa 2.1](https://usm.md/?page_id=18566)\n            * [Anexa 2.2](https://usm.md/?page_id=18619)\n            * [Anexa 2.3](https://usm.md/?page_id=18620)\n            * [Anexa 2.4](https://usm.md/?page_id=19128)\n            * [Anexa 2.5](https://usm.md/?page_id=18643)\n            * [Anexa 3.1](https://usm.md/?page_id=18657)\n            * [Anexa 3.2](https://usm.md/?page_id=18699)\n            * [Anexa 3.3](https://usm.md/?page_id=18825)\n            * [Anexa 3.4](https://usm.md/?page_id=19037)\n            * [Anexa 3.5](https://usm.md/?page_id=19185)\n            * [Anexa 3.6](https://usm.md/?page_id=19248)\n            * [Anexa 3.7](https://usm.md/?page_id=19259)\n            * [Anexa 4](https://usm.md/?page_id=19270)\n            * [Anexe FV](https://usm.md/?page_id=19367)\n    * [Departamentul IT](https://usm.md/?page_id=25666)\n    * [Departamentul Cercetare și Inovare](https://cercetare.usm.md/)\n    * [Biblioteca USM](https://library.usm.md/)\n    * [Departamentul Relații Internaționale](https://usm.md/?page_id=257)\n    * [Centru de Resurse pentru Formare Continuă](https://usm.md/?page_id=228)\n    * [Secția Comunicare și Relații Publice](https://usm.md/?page_id=362)\n    * [Centrul de Ghidare în Carieră și Relații cu Piața Muncii](https://usm.md/?page_id=268)\n    * [Departamentul Resurse Umane](https://usm.md/?page_id=271)\n    * [Oficiul Achiziții Publice](https://usm.md/?page_id=385)\n    * [Departamentul Contabilitate](https://usm.md/?page_id=274)\n    * [Departamentul economico-financiar](https://usm.md/?page_id=752)\n    * [Organigrama](https://usm.md/wp-content/uploads/Organigrama_Noiembrie_Decembrie_Senat_28_11_2023.pdf)\n  * Resurse\n    * Resurse digitale\n      * [Revista de Istorie a Moldovei](https://usm.md/?page_id=15485)\n      * [VOX USM](https://usm.md/?page_id=1996)\n    * [Documente](https://usm.md/?page_id=203)\n      * [Acte normative nationale](https://usm.md/?page_id=206)\n      * [Acte normative USM](https://usm.md/?page_id=209)\n        * [Documente reglementare activitate instituţională](https://usm.md/?page_id=451)\n        * [Regulamente resurse umane](https://usm.md/?page_id=453)\n        * [Regulamente proces educational](https://usm.md/?page_id=455)\n        * [Regulamente managementul calității](https://usm.md/?page_id=457)\n        * [Regulamente activitate ştiinţifică](https://usm.md/?page_id=459)\n        * [Regulamente Relaţii Internaţionale](https://usm.md/?page_id=461)\n        * [Regulamente sistem informaţional](https://usm.md/?page_id=463)\n        * Planuri și rapoarte de activitate\n          * [Rapoarte de activitate](https://usm.md/?page_id=3237)\n          * [Situațiile financiare](https://usm.md/?page_id=1220)\n          * [Planuri achizitiilor publice](https://usm.md/?page_id=2203)\n          * [Raport privind realizarea contractelor încheiate în urma procedurilor de achiziție](https://usm.md/?page_id=1224)\n          * [Graficul şedinţelor departamentelor USM](https://usm.md/wp-content/uploads/Graficul_Sedintelor_Departamentelor-1.pdf)\n          * [Planuri și Rapoarte De Activitate](https://usm.md/?page_id=10032)\n        * [Arhiva](https://usm.md/?page_id=18165)\n    * [Moodle.USM](http://moodle.usm.md/)\n    * [Galeria](https://usm.md/?page_id=9106)\n    * [Materiale Grafice USM](https://usm.md/?page_id=20143)\n  * Proiecte\n    * Banca Mondială\n      * [Subproiecte](https://usm.md/?page_id=16155)\n      * [Transparență](https://usm.md/?page_id=26463)\n    * Erasmus+\n      * [DEFEP](https://defep.usm.md/)\n      * [EUDIPSEC](https://eudipsec.usm.md/)\n      * [QFORTE](https://usm.md/?page_id=29341)\n\n* [Facultăți](https://usm.md/)\n  * [Facultatea de Biologie și Geoștiințe](https://usm.md/?page_id=489)\n  * [Facultatea de Drept](https://usm.md/?page_id=495)\n  * [Facultatea de Chimie şi Tehnologie Chimică](https://usm.md/?page_id=492)\n  * [Facultatea de Fizica si Inginerie](https://usm.md/?page_id=498)\n  * [Facultatea de Istorie şi Filosofie](https://usm.md/?page_id=502)\n  * [Facultatea de Jurnalism şi Ştiinţe ale Comunicării](https://usm.md/?page_id=505)\n  * [Facultatea de Litere](https://usm.md/?page_id=511)\n  * [Facultatea de Matematică şi Informatică](https://usm.md/?page_id=515)\n  * [Facultatea Psihologie, Ştiinţe ale Educaţiei, Sociologie și Asistență Socială](https://usm.md/?page_id=518)\n  * [Facultatea de Relaţii Internaţionale, Ştiinţe Politice şi Administrative](https://usm.md/?page_id=522)\n  * [Facultatea de Ştiinţe Economice](https://usm.md/?page_id=528)\n  * [Institutul de Educație Fizică și Sport](https://usm.md/?page_id=31334)\n\n* [Studii](https://usm.md/?page_id=20)\n  * [Departamentul Studii](https://usm.md/?page_id=241)\n  * Calendar academic\n    * [Licență](https://usm.md/?page_id=731)\n    * [Master](https://usm.md/?page_id=734)\n    * [Doctorat](https://usm.md/?page_id=737)\n  * [Studii de Licență](https://usm.md/?page_id=216)\n  * [Studii de Masterat](https://usm.md/?page_id=219)\n  * [Studii de Doctorat](https://doctorat.usm.md/)\n  * [Catedra Militară](https://usm.md/?page_id=680)\n  * Burse\n    * [Burse finanțate din bugetul de stat](https://usm.md/?page_id=392)\n    * [Burse de performanță](https://usm.md/?page_id=396)\n  * [Recunoaștere și echivalare](https://usm.md/?page_id=26183)\n\n* [Formare Continuă](http://crfc.usm.md/)\n\n* [Studenti](https://usm.md/?page_id=34)\n  * Descoperă@USM\n    * [Concurs „Hai să #Celebrăm75USM!\"](https://usm.md/?page_id=3181)\n    * [Istoria USM](https://usm.md/wp-content/uploads/ISTORIA_USM.pdf)\n    * [Broșura USM (Ro)](https://usm.md/wp-content/uploads/Broshura_USM_2020_ro.pdf)\n    * [Broșura USM (En)](https://usm.md/wp-content/uploads/Broshura_USM_2020_en.pdf)\n    * [Oferta USM 2023](https://usm.md/wp-content/uploads/pliant_oferta-educațională-2021.pdf)\n    * [Ghid pentru studenții anului I și II](https://usm.md/wp-content/uploads/ghid-studenti-anul-I-SI-II-USM-web.pdf)\n    * [Program de motivare a candidaților](https://usm.md/?page_id=1112)\n  * [Campus](https://usm.md/?page_id=22279)\n  * [Asociații studențești](http://asusm.usm.md/)\n  * Actvitati extracurriculare\n    * [Arte Frumoase](https://usm.md/?page_id=668)\n    * [Sport](https://usm.md/?page_id=667)\n  * [Cariera](https://usm.md/?page_id=268)\n\n* [Contacte](https://usm.md/?page_id=1380)\n\n* Ro: ![Română](https://usm.md/wp-content/plugins/qtranslate-x/flags/ro.png)\n  * [![Română](https://usm.md/wp-content/plugins/qtranslate-x/flags/ro.png) Română](https://usm.md/?page_id=31334&lang=ro \"Română\")\n  * [:uk: English](https://usm.md/?page_id=31334&lang=en \"English\")\n  * [:ru: Русский](https://usm.md/?page_id=31334&lang=ru \"Русский\")\n\n[![Universitatea de Stat din Moldova](https://usm.md/wp-content/uploads/cropped-logo_dark_22.png)](https://usm.md/)\n\n* USM\n  * [Despre](https://usm.md/?page_id=18)\n  * Conducerea Universității\n    * [Rectorat](https://usm.md/?page_id=194)\n    * [Senatul Universitar](https://usm.md/?page_id=188)\n    * [Consiliul de Administrație](https://usm.md/?page_id=197)\n    * Comisiile Senatului\n      * [Comisia de etică universitară](https://usm.md/?page_id=549)\n      * [Comisia activitate didactică, învăţămînt şi evaluare academică](https://usm.md/?page_id=552)\n      * [Comisia management universitar şi dezvoltare instituţională](https://usm.md/?page_id=555)\n      * [Comisia informatizare](https://usm.md/?page_id=3129)\n      * [Comisia relaţii internaţionale](https://usm.md/?page_id=3128)\n      * [Comisia comunicare și promovarea imaginii](https://usm.md/?page_id=558)\n      * [Comisia pentru cercetare](https://usm.md/?page_id=561)\n      * [Comisia pentru probleme studenţeşti](https://usm.md/?page_id=564)\n      * [Comisia pentru activităţi culturale şi sportive](https://usm.md/?page_id=567)\n    * [Consiliul pentru Dezvoltarea Strategică Instituțională](https://usm.md/?page_id=191)\n    * [Consiliul Științific](https://usm.md/?page_id=626)\n  * Organizare\n    * Departamentul Managementul Calității\n      * [Structura](https://usm.md/?page_id=12865)\n      * [Acte normative](https://usm.md/?page_id=12868)\n      * Planuri de activitate, rapoarte\n        * [Planuri de activitate](https://usm.md/?page_id=12870)\n        * [Rapoarte de activitate](https://usm.md/?page_id=12877)\n      * Audit intern\n        * [Proceduri de audit](https://usm.md/?page_id=12880)\n        * [Planuri de audit](https://usm.md/?page_id=12884)\n        * [Membrii comisiilor de audit](https://usm.md/?page_id=12886)\n      * Evaluare externă\n        * [Planuri de măsuri corective](https://usm.md/?page_id=12894)\n        * Acte normative\n          * [Curente](https://usm.md/?page_id=12891)\n          * [Arhiva](https://usm.md/?page_id=16434)\n        * Acreditare Instituțională\n          * [Raportul de autoevaluare](https://usm.md/?page_id=19384)\n          * [Anexe](https://usm.md/?page_id=18560)\n            * [Anexa 1](https://usm.md/?page_id=18563)\n            * [Anexa 2.1](https://usm.md/?page_id=18566)\n            * [Anexa 2.2](https://usm.md/?page_id=18619)\n            * [Anexa 2.3](https://usm.md/?page_id=18620)\n            * [Anexa 2.4](https://usm.md/?page_id=19128)\n            * [Anexa 2.5](https://usm.md/?page_id=18643)\n            * [Anexa 3.1](https://usm.md/?page_id=18657)\n            * [Anexa 3.2](https://usm.md/?page_id=18699)\n            * [Anexa 3.3](https://usm.md/?page_id=18825)\n            * [Anexa 3.4](https://usm.md/?page_id=19037)\n            * [Anexa 3.5](https://usm.md/?page_id=19185)\n            * [Anexa 3.6](https://usm.md/?page_id=19248)\n            * [Anexa 3.7](https://usm.md/?page_id=19259)\n            * [Anexa 4](https://usm.md/?page_id=19270)\n            * [Anexe FV](https://usm.md/?page_id=19367)\n    * [Departamentul IT](https://usm.md/?page_id=25666)\n    * [Departamentul Cercetare și Inovare](https://cercetare.usm.md/)\n    * [Biblioteca USM](https://library.usm.md/)\n    * [Departamentul Relații Internaționale](https://usm.md/?page_id=257)\n    * [Centru de Resurse pentru Formare Continuă](https://usm.md/?page_id=228)\n    * [Secția Comunicare și Relații Publice](https://usm.md/?page_id=362)\n    * [Centrul de Ghidare în Carieră și Relații cu Piața Muncii](https://usm.md/?page_id=268)\n    * [Departamentul Resurse Umane](https://usm.md/?page_id=271)\n    * [Oficiul Achiziții Publice](https://usm.md/?page_id=385)\n    * [Departamentul Contabilitate](https://usm.md/?page_id=274)\n    * [Departamentul economico-financiar](https://usm.md/?page_id=752)\n    * [Organigrama](https://usm.md/wp-content/uploads/Organigrama_Noiembrie_Decembrie_Senat_28_11_2023.pdf)\n  * Resurse\n    * Resurse digitale\n      * [Revista de Istorie a Moldovei](https://usm.md/?page_id=15485)\n      * [VOX USM](https://usm.md/?page_id=1996)\n    * [Documente](https://usm.md/?page_id=203)\n      * [Acte normative nationale](https://usm.md/?page_id=206)\n      * [Acte normative USM](https://usm.md/?page_id=209)\n        * [Documente reglementare activitate instituţională](https://usm.md/?page_id=451)\n        * [Regulamente resurse umane](https://usm.md/?page_id=453)\n        * [Regulamente proces educational](https://usm.md/?page_id=455)\n        * [Regulamente managementul calității](https://usm.md/?page_id=457)\n        * [Regulamente activitate ştiinţifică](https://usm.md/?page_id=459)\n        * [Regulamente Relaţii Internaţionale](https://usm.md/?page_id=461)\n        * [Regulamente sistem informaţional](https://usm.md/?page_id=463)\n        * Planuri și rapoarte de activitate\n          * [Rapoarte de activitate](https://usm.md/?page_id=3237)\n          * [Situațiile financiare](https://usm.md/?page_id=1220)\n          * [Planuri achizitiilor publice](https://usm.md/?page_id=2203)\n          * [Raport privind realizarea contractelor încheiate în urma procedurilor de achiziție](https://usm.md/?page_id=1224)\n          * [Graficul şedinţelor departamentelor USM](https://usm.md/wp-content/uploads/Graficul_Sedintelor_Departamentelor-1.pdf)\n          * [Planuri și Rapoarte De Activitate](https://usm.md/?page_id=10032)\n        * [Arhiva](https://usm.md/?page_id=18165)\n    * [Moodle.USM](http://moodle.usm.md/)\n    * [Galeria](https://usm.md/?page_id=9106)\n    * [Materiale Grafice USM](https://usm.md/?page_id=20143)\n  * Proiecte\n    * Banca Mondială\n      * [Subproiecte](https://usm.md/?page_id=16155)\n      * [Transparență](https://usm.md/?page_id=26463)\n    * Erasmus+\n      * [DEFEP](https://defep.usm.md/)\n      * [EUDIPSEC](https://eudipsec.usm.md/)\n      * [QFORTE](https://usm.md/?page_id=29341)\n\n* [Facultăți](https://usm.md/)\n  * [Facultatea de Biologie și Geoștiințe](https://usm.md/?page_id=489)\n  * [Facultatea de Drept](https://usm.md/?page_id=495)\n  * [Facultatea de Chimie şi Tehnologie Chimică](https://usm.md/?page_id=492)\n  * [Facultatea de Fizica si Inginerie](https://usm.md/?page_id=498)\n  * [Facultatea de Istorie şi Filosofie](https://usm.md/?page_id=502)\n  * [Facultatea de Jurnalism şi Ştiinţe ale Comunicării](https://usm.md/?page_id=505)\n  * [Facultatea de Litere](https://usm.md/?page_id=511)\n  * [Facultatea de Matematică şi Informatică](https://usm.md/?page_id=515)\n  * [Facultatea Psihologie, Ştiinţe ale Educaţiei, Sociologie și Asistență Socială](https://usm.md/?page_id=518)\n  * [Facultatea de Relaţii Internaţionale, Ştiinţe Politice şi Administrative](https://usm.md/?page_id=522)\n  * [Facultatea de Ştiinţe Economice](https://usm.md/?page_id=528)\n  * [Institutul de Educație Fizică și Sport](https://usm.md/?page_id=31334)\n\n* [Studii](https://usm.md/?page_id=20)\n  * [Departamentul Studii](https://usm.md/?page_id=241)\n  * Calendar academic\n    * [Licență](https://usm.md/?page_id=731)\n    * [Master](https://usm.md/?page_id=734)\n    * [Doctorat](https://usm.md/?page_id=737)\n  * [Studii de Licență](https://usm.md/?page_id=216)\n  * [Studii de Masterat](https://usm.md/?page_id=219)\n  * [Studii de Doctorat](https://doctorat.usm.md/)\n  * [Catedra Militară](https://usm.md/?page_id=680)\n  * Burse\n    * [Burse finanțate din bugetul de stat](https://usm.md/?page_id=392)\n    * [Burse de performanță](https://usm.md/?page_id=396)\n  * [Recunoaștere și echivalare](https://usm.md/?page_id=26183)\n\n* [Formare Continuă](http://crfc.usm.md/)\n\n* [Studenti](https://usm.md/?page_id=34)\n  * Descoperă@USM\n    * [Concurs „Hai să #Celebrăm75USM!\"](https://usm.md/?page_id=3181)\n    * [Istoria USM](https://usm.md/wp-content/uploads/ISTORIA_USM.pdf)\n    * [Broșura USM (Ro)](https://usm.md/wp-content/uploads/Broshura_USM_2020_ro.pdf)\n    * [Broșura USM (En)](https://usm.md/wp-content/uploads/Broshura_USM_2020_en.pdf)\n    * [Oferta USM 2023](https://usm.md/wp-content/uploads/pliant_oferta-educațională-2021.pdf)\n    * [Ghid pentru studenții anului I și II](https://usm.md/wp-content/uploads/ghid-studenti-anul-I-SI-II-USM-web.pdf)\n    * [Program de motivare a candidaților](https://usm.md/?page_id=1112)\n  * [Campus](https://usm.md/?page_id=22279)\n  * [Asociații studențești](http://asusm.usm.md/)\n  * Actvitati extracurriculare\n    * [Arte Frumoase](https://usm.md/?page_id=668)\n    * [Sport](https://usm.md/?page_id=667)\n  * [Cariera](https://usm.md/?page_id=268)\n\n* [Contacte](https://usm.md/?page_id=1380)\n\n* Ro: ![Română](https://usm.md/wp-content/plugins/qtranslate-x/flags/ro.png)\n  * [![Română](https://usm.md/wp-content/plugins/qtranslate-x/flags/ro.png) Română](https://usm.md/?page_id=31334&lang=ro \"Română\")\n  * [:uk: English](https://usm.md/?page_id=31334&lang=en \"English\")\n\n* [:ru: Русский](https://usm.md/?page_id=31334&lang=ru \"Русский\")\n\nInstitutul de Educație Fizică și Sport\n======================================\n\nPerformanța ta începe aici!  \n**Contacte**\n\nAdresa: str. Andrei Doga 22, Universitatea de Educaţie Fizică şi Sport\n\nTelefon de contact: +373 22 49 40 81\n\nE-mail: [isefs@usm.md](mailto:isefs@usm.md)\n\nWeb: [www.usefs.md](http://www.usefs.md)\n\n**PREZENTARE**\n\n**Misiunea**Institutului de Educaţie Fizică şi Sport este de a realiza activitatea de cercetare şi de învăţământ la standarde de excelenţă naţionale şi internaţionale prin;\n\n* formarea, dezvoltarea şi diseminarea valorilor noii societăţi bazate pe cunoaştere;\n\n* formarea specialiştilor în domeniul culturii fizice, de înaltă performanţă, prin oferirea de programe de studii creative, care să integreze rezultatele cercetării ştiinţifice şi să contribuie la dezvoltarea intelectuală a studenţilor, masteranzilor şi doctoranzilor;\n\n* generarea de calificări competitive în formarea universitară şi postuniversitară;\n\n* realizarea de parteneriate durabile cu alte organizaţii din mediul academic şi de afaceri;\n\n* integrarea Centrului Ştiinţific al IEFS, a şcolilor doctorale în reţele europene de excelenţă şi realizarea de cercetări fundamentale şi aplicative generatoare de cunoştinţe;\n\n* dezvoltarea unui corp profesoral şi de cercetare de înaltă responsabilitate profesională şi civică;\n\n* promovarea valorilor ştiinţifice, culturale şi etice în comunitatea naţională şi internaţională.\n\n**Viziunea** IEFS este de a fi lider în învăţământul şi cercetarea ştiinţifică din domeniul culturii fizice în Republica Moldova, de a se identifica printre instituţiile de referinţă la nivel naţional şi european în realizarea, formarea şi dezvoltarea competenţelor profesionale, a aptitudinilor şi abilităţilor necesare unui traseu profesional performant.\n\n**[Regulamentul cu privire la organizarea şi funcţionarea Institutului de Educaţie Fizică şi Sport](https://usm.md/wp-content/uploads/Regulament-IEFS-aprobat.pdf)**\n\nDorgan Viorel [Source]{https://usm.md/?page_id=31334)", "**SCUTIRI DE TAXE**\n\n**Universitatea de Stat din Moldova poate oferi scutiri de taxe de studii pentru**\n\n* studenții performanți, cu scopul promovării calității în educație, consolidării potențialului USM și asigurării pieți imuncii cu cadre calificate;\n\n* studenţii, reprezentând cazuri sociale.\n\n**PROGRAM DE MOTIVARE A CANDIDAȚILOR**\n\n**MASTER**\n\nUniversitatea de Stat din Moldova pentru anul de studii 2020-2021 propune următoarele programe comune de studii superioare de master (două diplome):\n\n* Facultatea de Matematică și Informatică, în colaborare cu University of West Attica, Athens, Grecia, pentru programul „Informatică aplicată\", traseul -- securitatea informației.\n\n* Facultatea de Litere, masterat francofon cu diplomă dublă, pentru programul „Traducere și interpretare de conferințe\", în colaborare cu Universitatea „Ștefan cel Mare\" Suceava, România;\n\n* Facultatea de Istorie și Filosofie, programul „Istorie, resurse culturale și patrimoniu în societatea contemporană\" la Universitatea din București, România și programul „Managementul patrimoniului cultural\" la Universitatea de Stat din Moldova; programul „Istoria și circulația ideilor filosofice\" la Universitatea din București, România și programul „Filosofii contemporane\" la Universitatea de Stat din Moldova.\n\n* Facultatea de Științe Economice, programul „Management şi marketing hotelier şi turism\" cu Universitatea din Girona (UdG), Spania și programul „Audit și expertiză financiară\" cu Universitatea „Ştefan cel Mare\" din Suceava, România.\n\n**Avantajele programelor comune de masterat:**\n\n* valorifică parteneriatele regionale în domeniile de interes comun;\n\n* îmbunătățesc nivelul competențelor și abilităților absolvenților de masterate;\n\n* încurajează îmbunătățirea calității, inovarea, excelența și lucrul în echipe multidisciplinare;\n\n* sporesc relevanța programelor de masterat comune pentru piața forței de muncă, printr-o implicare sporită a angajatorilor.\n\n**SCUTIRI DE TAXE**\n\n**Universitatea de Stat din Moldova poate oferi scutiri de taxe de școlarizare pentru:**\n\n* studenții care au statutul de șefi de promoție, absolvenți ai ciclului I din cadrul USM;\n\n* studenții performanți, cu scopul promovării calității în educație, consolidării potențialului USM și asigurării pieții muncii cu cadre calificate;\n\n* studenţii, reprezentând cazuri sociale.\n\n###### Adresa\n\n###### Facultăţi\n\n* [Facultatea de Biologie și Geoștiințe](https://usm.md/?page_id=489)\n\n* [Facultatea de Chimie şi Tehnologie Chimică](https://usm.md/?page_id=492)\n\n* [Facultatea de Drept](https://usm.md/?page_id=495)\n\n* [Facultatea de Jurnalism şi Ştiinţe ale Comunicării](https://usm.md/?page_id=505)\n\n* [Facultatea de Fizica si Inginerie](https://usm.md/?page_id=498)\n\n* [Facultatea de Istorie şi Filosofie](https://usm.md/?page_id=502)\n\n* [Facultatea de Matematică şi Informatică](https://usm.md/?page_id=515)\n\n* [Facultatea de Litere](https://usm.md/?page_id=511)\n\n* [Facultatea de Științe Economice](https://usm.md/?page_id=528)\n\n* [Facultatea Psihologie, Ştiinţe ale Educaţiei, Sociologie și Asistență Socială](https://usm.md/?page_id=518)\n\n* [Facultatea de Relaţii Internaţionale, Ştiinţe Politice şi Administrative](https://usm.md/?page_id=522)\n\n###### Contacte\n\n* +373 22 244 810\n\n* 9:00 - 17:00\n\n* [Universitatea de Stat din Moldova str. Alexei Mateevici 60, MD-2009](https://www.google.com/maps/place/Universitatea+de+Stat+din+Moldova/@47.018939,28.824491,18z/data=!4m5!3m4!1s0x0:0xd8e8b74ac8c3ef7b!8m2!3d47.0192025!4d28.8230857?hl=ro)\n\n* rector@usm.md  \nToleranță zero corupției\n\n* integritate@usm.md  \n[Facebook](https://www.facebook.com/UniversitateaDeStatDinMoldova/) [Instagram](https://www.instagram.com/accounts/login/?next=/usm.md/) [Youtube](https://www.youtube.com/channel/UC3oFsXde0eZRaAqeX_6iBcg/videos)  \n**Universitatea de Stat din Moldova 2025 © All Rights Reserved\n​**  \nOficiul Programare Web al USM ®  \n×  \n×  \n×  \n×  \n×  \n×  \n×  \n×  \n×  \n×  \n×  \nUniversitatea de Stat din Moldova folosește module cookie strict necesare și alte tehnologii similare pentru a opera acest website și pentru a oferi utilizatorilor o experiență personalizată. Pe lângă modulele cookie strict necesare, Universitatea de Stat din Moldova folosește module cookie opționale pentru a îmbunătăți și personaliza experiența utilizatorilor, pentru a analiza performanța website-ului.Ok [Source]{https://usm.md/?page_id=1112)" ]
}