{
  "question" : "Ciclu 1 admitere",
  "answer" : "Pentru admiterea la ciclul I, trebuie să pregătești următoarele acte necesare:\n\n1. Cererea de înscriere la concursul de admitere.\n2. Actul de studii, în original, cu anexa respectivă. Absolvenții liceelor din România și alte state trebuie să prezinte certificatul de studii, cu notele obținute la examenele de bacalaureat și situația școlară pe anii de studii, urmând ca diploma de bacalaureat să fie prezentată ulterior. De asemenea, este necesar un xerox al actului de studii.\n3. 4 fotografii 3×4 cm.\n4. Copia buletinului de identitate.\n5. Adeverință de recrut.\n\nÎn plus, în situații speciale, pot fi necesare și alte documente, cum ar fi diplomele de gradul I-III obținute la concursuri școlare republicane sau internaționale.\n\nPentru mai multe detalii, poți consulta [actele necesare la admitere ciclul I](https://admitere.usm.md/?page_id=562). \n\nDacă ai nevoie de informații suplimentare, nu ezita să întrebi!",
  "contexts" : [ "Acte necesare la admitere ciclul II -- Admitere 2024 Skip to content  \n[![](https://admitere.usm.md/wp-content/uploads/cropped-cropped-logo_dark_22-2-1.png)](https://admitere.usm.md/)[![Admitere 2024](https://admitere.usm.md/wp-content/uploads/cropped-cropped-logo_dark_22-2.png)](https://admitere.usm.md/)\n\n* [Oferta 2024](http://admitere.usm.md/)\n  * [Licenta](https://admitere.usm.md/?page_id=98)\n  * [Master](https://admitere.usm.md/?page_id=94)\n  * [Întrebări frecvente](https://admitere.usm.md/?page_id=1925)\n  * [Programe de motivare](https://admitere.usm.md/?page_id=2395)\n  * [Broșuri](https://admitere.usm.md/?page_id=41)\n  * [Taxe](https://admitere.usm.md/?page_id=4209)\n\n* [Calendarul admiterii](https://admitere.usm.md/?page_id=3906)\n\n* [Acte](http://admitere.usm.md/)\n  * [Regulamente](https://admitere.usm.md/?page_id=50)\n  * [Acte necesare admitere](http://admitere.usm.md/)\n    * [Acte necesare la admitere ciclul I](https://admitere.usm.md/?page_id=562)\n    * [Acte necesare la admitere ciclul II](https://admitere.usm.md/?page_id=565)\n  * Plan de admitere\n    * [Plan admitere Licenţă cu frecvență](http://admitere.usm.md/wp-content/uploads/Plan-inmatriculare_Licenta-2.pdf)\n    * [Plan admitere Licenţă cu frecvență redusă](http://admitere.usm.md/wp-content/uploads/Plan-inmatriculare_Licenta_frec.-redusa-1.pdf)\n    * [Plan admitere Master cu frecvență](http://admitere.usm.md/wp-content/uploads/Plan-inmatriculare_Master-2.pdf)\n    * [Plan admitere Master cu frecvență redusă](http://admitere.usm.md/wp-content/uploads/Plan-inmatriculare_master.frec_.redusa.pdf)\n    * [Plan admitere pentru studenți străini](http://admitere.usm.md/wp-content/uploads/plan-inmatr.-cetateni-straini-1.pdf)\n  * [Tuition fees](https://admitere.usm.md/?page_id=1476)\n  * [Taxe de studii](http://admitere.usm.md/)\n    * [Taxele de studii, Ciclul I studii superioare de licenţă](https://admitere.usm.md/?page_id=3740)\n    * [Taxele de studii, Ciclul II studii superioare de masterat](https://admitere.usm.md/?page_id=3741)\n\n* [Comisia de admitere](https://admitere.usm.md/?page_id=1445)\n\n* [Rezultate](https://admitere.usm.md/?page_id=56)\n  * [Turul I: Anunţarea rezultatelor finale](https://admitere.usm.md/?page_id=2682)\n  * [Turul II: Anunţarea rezultatelor finale](https://admitere.usm.md/?page_id=2778)\n\n* [Centrul de Ghidare în Carieră](https://cgc.usm.md/)\n\n* Ro: ![Română](https://admitere.usm.md/wp-content/plugins/qtranslate-x/flags/ro.png)\n  * [![Română](https://admitere.usm.md/wp-content/plugins/qtranslate-x/flags/ro.png) Română](https://admitere.usm.md/?page_id=565&lang=ro \"Română\")\n  * [:uk: English](https://admitere.usm.md/?page_id=565&lang=en \"English\")\n  * [:ru: Русский](https://admitere.usm.md/?page_id=565&lang=ru \"Русский\")\n\n[![](https://admitere.usm.md/wp-content/uploads/cropped-cropped-logo_dark_22-2-1.png)](https://admitere.usm.md/)[![Admitere 2024](https://admitere.usm.md/wp-content/uploads/cropped-cropped-logo_dark_22-2.png)](https://admitere.usm.md/)\n\n* [Oferta 2024](http://admitere.usm.md/)\n  * [Licenta](https://admitere.usm.md/?page_id=98)\n  * [Master](https://admitere.usm.md/?page_id=94)\n  * [Întrebări frecvente](https://admitere.usm.md/?page_id=1925)\n  * [Programe de motivare](https://admitere.usm.md/?page_id=2395)\n  * [Broșuri](https://admitere.usm.md/?page_id=41)\n  * [Taxe](https://admitere.usm.md/?page_id=4209)\n\n* [Calendarul admiterii](https://admitere.usm.md/?page_id=3906)\n\n* [Acte](http://admitere.usm.md/)\n  * [Regulamente](https://admitere.usm.md/?page_id=50)\n  * [Acte necesare admitere](http://admitere.usm.md/)\n    * [Acte necesare la admitere ciclul I](https://admitere.usm.md/?page_id=562)\n    * [Acte necesare la admitere ciclul II](https://admitere.usm.md/?page_id=565)\n  * Plan de admitere\n    * [Plan admitere Licenţă cu frecvență](http://admitere.usm.md/wp-content/uploads/Plan-inmatriculare_Licenta-2.pdf)\n    * [Plan admitere Licenţă cu frecvență redusă](http://admitere.usm.md/wp-content/uploads/Plan-inmatriculare_Licenta_frec.-redusa-1.pdf)\n    * [Plan admitere Master cu frecvență](http://admitere.usm.md/wp-content/uploads/Plan-inmatriculare_Master-2.pdf)\n    * [Plan admitere Master cu frecvență redusă](http://admitere.usm.md/wp-content/uploads/Plan-inmatriculare_master.frec_.redusa.pdf)\n    * [Plan admitere pentru studenți străini](http://admitere.usm.md/wp-content/uploads/plan-inmatr.-cetateni-straini-1.pdf)\n  * [Tuition fees](https://admitere.usm.md/?page_id=1476)\n  * [Taxe de studii](http://admitere.usm.md/)\n    * [Taxele de studii, Ciclul I studii superioare de licenţă](https://admitere.usm.md/?page_id=3740)\n    * [Taxele de studii, Ciclul II studii superioare de masterat](https://admitere.usm.md/?page_id=3741)\n\n* [Comisia de admitere](https://admitere.usm.md/?page_id=1445)\n\n* [Rezultate](https://admitere.usm.md/?page_id=56)\n  * [Turul I: Anunţarea rezultatelor finale](https://admitere.usm.md/?page_id=2682)\n  * [Turul II: Anunţarea rezultatelor finale](https://admitere.usm.md/?page_id=2778)\n\n* [Centrul de Ghidare în Carieră](https://cgc.usm.md/)\n\n* Ro: ![Română](https://admitere.usm.md/wp-content/plugins/qtranslate-x/flags/ro.png)\n  * [![Română](https://admitere.usm.md/wp-content/plugins/qtranslate-x/flags/ro.png) Română](https://admitere.usm.md/?page_id=565&lang=ro \"Română\")\n  * [:uk: English](https://admitere.usm.md/?page_id=565&lang=en \"English\")\n\n* [:ru: Русский](https://admitere.usm.md/?page_id=565&lang=ru \"Русский\")\n\nActe necesare la admitere ciclul II\n===================================\n\n<br />\n\n***Documente obligatorii:***\n\n* cererea de înscriere la concursul de admitere;\n\n* actul de studii, în original, cu anexa respectivă (absolvenți liceelor din România și alte state, promoția din anul admiterii, prezintă certificatul de studii, cu notele obținute la examenele de bacalaureat şi situația școlară pe anii de studii, urmând ca diploma de bacalaureat să fie prezentată ulterior); act de studii-xerox\n\n* 4 fotografii 3×4 cm;\n\n* copia buletinului de identitate;\n\n* Adeverință de recrut\n\nNOTĂ: **Candidații care aspiră la programele de master destinate funcționarilor publici:**\n\n**[*Anticorupție (90 credite, studii cu frecvență)*](http://admitere.usm.md/wp-content/uploads/Anticoruptie_90-cr_MP_2024_cu-frecventa.pdf)** ***;***\n\n[***Anticorupție (90 credite, studii cu frecvență redusă)***](http://admitere.usm.md/wp-content/uploads/Anticoruptie_90-cr_MP_2024_cu-frecventa-redusa.pdf)***;***\n\n[***Drept public (90 credite, studii cu frecvență)***](http://admitere.usm.md/wp-content/uploads/Drept-public_90-cr_MP_2024_cu-frecventa.pdf)***;*** [Source]{https://admitere.usm.md/?page_id=565)", "Acte necesare la admitere ciclul I -- Admitere 2024 Skip to content  \n[![](https://admitere.usm.md/wp-content/uploads/cropped-cropped-logo_dark_22-2-1.png)](https://admitere.usm.md/)[![Admitere 2024](https://admitere.usm.md/wp-content/uploads/cropped-cropped-logo_dark_22-2.png)](https://admitere.usm.md/)\n\n* [Oferta 2024](http://admitere.usm.md/)\n  * [Licenta](https://admitere.usm.md/?page_id=98)\n  * [Master](https://admitere.usm.md/?page_id=94)\n  * [Întrebări frecvente](https://admitere.usm.md/?page_id=1925)\n  * [Programe de motivare](https://admitere.usm.md/?page_id=2395)\n  * [Broșuri](https://admitere.usm.md/?page_id=41)\n  * [Taxe](https://admitere.usm.md/?page_id=4209)\n\n* [Calendarul admiterii](https://admitere.usm.md/?page_id=3906)\n\n* [Acte](http://admitere.usm.md/)\n  * [Regulamente](https://admitere.usm.md/?page_id=50)\n  * [Acte necesare admitere](http://admitere.usm.md/)\n    * [Acte necesare la admitere ciclul I](https://admitere.usm.md/?page_id=562)\n    * [Acte necesare la admitere ciclul II](https://admitere.usm.md/?page_id=565)\n  * Plan de admitere\n    * [Plan admitere Licenţă cu frecvență](http://admitere.usm.md/wp-content/uploads/Plan-inmatriculare_Licenta-2.pdf)\n    * [Plan admitere Licenţă cu frecvență redusă](http://admitere.usm.md/wp-content/uploads/Plan-inmatriculare_Licenta_frec.-redusa-1.pdf)\n    * [Plan admitere Master cu frecvență](http://admitere.usm.md/wp-content/uploads/Plan-inmatriculare_Master-2.pdf)\n    * [Plan admitere Master cu frecvență redusă](http://admitere.usm.md/wp-content/uploads/Plan-inmatriculare_master.frec_.redusa.pdf)\n    * [Plan admitere pentru studenți străini](http://admitere.usm.md/wp-content/uploads/plan-inmatr.-cetateni-straini-1.pdf)\n  * [Tuition fees](https://admitere.usm.md/?page_id=1476)\n  * [Taxe de studii](http://admitere.usm.md/)\n    * [Taxele de studii, Ciclul I studii superioare de licenţă](https://admitere.usm.md/?page_id=3740)\n    * [Taxele de studii, Ciclul II studii superioare de masterat](https://admitere.usm.md/?page_id=3741)\n\n* [Comisia de admitere](https://admitere.usm.md/?page_id=1445)\n\n* [Rezultate](https://admitere.usm.md/?page_id=56)\n  * [Turul I: Anunţarea rezultatelor finale](https://admitere.usm.md/?page_id=2682)\n  * [Turul II: Anunţarea rezultatelor finale](https://admitere.usm.md/?page_id=2778)\n\n* [Centrul de Ghidare în Carieră](https://cgc.usm.md/)\n\n* Ro: ![Română](https://admitere.usm.md/wp-content/plugins/qtranslate-x/flags/ro.png)\n  * [![Română](https://admitere.usm.md/wp-content/plugins/qtranslate-x/flags/ro.png) Română](https://admitere.usm.md/?page_id=562&lang=ro \"Română\")\n  * [:uk: English](https://admitere.usm.md/?page_id=562&lang=en \"English\")\n  * [:ru: Русский](https://admitere.usm.md/?page_id=562&lang=ru \"Русский\")\n\n[![](https://admitere.usm.md/wp-content/uploads/cropped-cropped-logo_dark_22-2-1.png)](https://admitere.usm.md/)[![Admitere 2024](https://admitere.usm.md/wp-content/uploads/cropped-cropped-logo_dark_22-2.png)](https://admitere.usm.md/)\n\n* [Oferta 2024](http://admitere.usm.md/)\n  * [Licenta](https://admitere.usm.md/?page_id=98)\n  * [Master](https://admitere.usm.md/?page_id=94)\n  * [Întrebări frecvente](https://admitere.usm.md/?page_id=1925)\n  * [Programe de motivare](https://admitere.usm.md/?page_id=2395)\n  * [Broșuri](https://admitere.usm.md/?page_id=41)\n  * [Taxe](https://admitere.usm.md/?page_id=4209)\n\n* [Calendarul admiterii](https://admitere.usm.md/?page_id=3906)\n\n* [Acte](http://admitere.usm.md/)\n  * [Regulamente](https://admitere.usm.md/?page_id=50)\n  * [Acte necesare admitere](http://admitere.usm.md/)\n    * [Acte necesare la admitere ciclul I](https://admitere.usm.md/?page_id=562)\n    * [Acte necesare la admitere ciclul II](https://admitere.usm.md/?page_id=565)\n  * Plan de admitere\n    * [Plan admitere Licenţă cu frecvență](http://admitere.usm.md/wp-content/uploads/Plan-inmatriculare_Licenta-2.pdf)\n    * [Plan admitere Licenţă cu frecvență redusă](http://admitere.usm.md/wp-content/uploads/Plan-inmatriculare_Licenta_frec.-redusa-1.pdf)\n    * [Plan admitere Master cu frecvență](http://admitere.usm.md/wp-content/uploads/Plan-inmatriculare_Master-2.pdf)\n    * [Plan admitere Master cu frecvență redusă](http://admitere.usm.md/wp-content/uploads/Plan-inmatriculare_master.frec_.redusa.pdf)\n    * [Plan admitere pentru studenți străini](http://admitere.usm.md/wp-content/uploads/plan-inmatr.-cetateni-straini-1.pdf)\n  * [Tuition fees](https://admitere.usm.md/?page_id=1476)\n  * [Taxe de studii](http://admitere.usm.md/)\n    * [Taxele de studii, Ciclul I studii superioare de licenţă](https://admitere.usm.md/?page_id=3740)\n    * [Taxele de studii, Ciclul II studii superioare de masterat](https://admitere.usm.md/?page_id=3741)\n\n* [Comisia de admitere](https://admitere.usm.md/?page_id=1445)\n\n* [Rezultate](https://admitere.usm.md/?page_id=56)\n  * [Turul I: Anunţarea rezultatelor finale](https://admitere.usm.md/?page_id=2682)\n  * [Turul II: Anunţarea rezultatelor finale](https://admitere.usm.md/?page_id=2778)\n\n* [Centrul de Ghidare în Carieră](https://cgc.usm.md/)\n\n* Ro: ![Română](https://admitere.usm.md/wp-content/plugins/qtranslate-x/flags/ro.png)\n  * [![Română](https://admitere.usm.md/wp-content/plugins/qtranslate-x/flags/ro.png) Română](https://admitere.usm.md/?page_id=562&lang=ro \"Română\")\n  * [:uk: English](https://admitere.usm.md/?page_id=562&lang=en \"English\")\n\n* [:ru: Русский](https://admitere.usm.md/?page_id=562&lang=ru \"Русский\")\n\nActe necesare la admitere ciclul I\n==================================\n\n<br />\n\n***Documente obligatorii:***\n\n* cererea de înscriere la concursul de admitere;\n\n* actul de studii, în original, cu anexa respectivă (absolvenți liceelor din România și alte state, promoția din anul admiterii, prezintă certificatul de studii, cu notele obținute la examenele de bacalaureat şi situația școlară pe anii de studii, urmând ca diploma de bacalaureat să fie prezentată ulterior); act de studii-xerox\n\n* 4 fotografii 3×4 cm;\n\n* copia buletinului de identitate;\n\n* Adeverință de recrut\n\n***Alte documente, în situații speciale:***\n\n* diplomele de gradul I-III, obținute de către candidați la concursurile școlare republicane sau internaționale, la disciplinele de studiu, precum și diplomele ce atestă participarea la diferite concursuri (olimpiade), expoziții etc., organizate de Ministerul Educației, Culturii și Cercetării sau de ministerele de resort; [Source]{https://admitere.usm.md/?page_id=562)" ]
}